grain,period_start,period_end,video_id,channel_id,channel_name,title,period_views_delta,period_likes_delta,period_comments_delta,period_avg_engagement_rate,period_snapshots,latest_views,latest_likes,latest_comments
monthly,2026-05-01,2026-05-31,QPWScf-86po,UCWBWgCD4oAqT3hUeq40SCUw,Sambucha,I Made Mascots For Stores That Don’t Have Them,4322286,128205,1474,0.035226,4,5837817,188245,2596
monthly,2026-05-01,2026-05-31,ksn5yrsC3Wg,UCHnyfMqiRRG1u-2MsSQLbXA,Veritasium,The Disaster I Never Imagined Having To Worry About,2608382,79773,3886,0.038471,4,3958442,137544,8071
monthly,2026-05-01,2026-05-31,qgzwtKsXCMo,UCQHX6ViZmPsWiYSFAyS0a3Q,GothamChess,Jynxzi REALIZES,1950219,35349,328,0.021688,4,2644611,52588,576
monthly,2026-05-01,2026-05-31,Su0aCV35IFM,UC415bOPUcGSamy543abLmRA,Cleo Abram,There's a Telescope at the Bottom of the Ocean,1795069,47805,396,0.041735,4,5385030,213862,1823
monthly,2026-05-01,2026-05-31,WgcdDVIUXcI,UC52hytXteCKmuOzMViTK8_w,CdeCiencia,¿Cómo funcionan las gomas de borrar?,1756201,14135,38,0.018287,4,6594440,114433,344
monthly,2026-05-01,2026-05-31,IEJALLQFmDs,UCY1kMZp36IQSyNx_9h4mpCg,Mark Rober,You’re Breathing Dinosaur Breath!,1708290,33246,211,0.02459,4,3974105,93356,671
monthly,2026-05-01,2026-05-31,WOTUpoI2LQA,UCOWFKaCN-rzmYk502JFWnqg,Eze Martínez,Dron quieto o en movimiento?,1616553,62698,1254,0.055088,4,2997131,149755,2747
monthly,2026-05-01,2026-05-31,dqazxW8R5BY,UC415bOPUcGSamy543abLmRA,Cleo Abram,Our Brains Got Bigger. Now They’re Shrinking?,1182835,51422,1004,0.048506,4,2038679,94786,2027
monthly,2026-05-01,2026-05-31,jLFG_FZKbks,UCGq-a57w-aPwyi3pW7XLiHw,The Diary Of A CEO,"Stock Expert: Becoming Rich Is Simple, But You Won’t Do It!",1071699,18879,2034,0.022667,4,1106808,20533,2274
monthly,2026-05-01,2026-05-31,u_f8bJkfg68,UC52hytXteCKmuOzMViTK8_w,CdeCiencia,Este efecto táctil te hará sentir DOBLE,1039487,13570,72,0.027916,4,3964708,104653,922
monthly,2026-05-01,2026-05-31,xjcVnFd-4YA,UCLe_q9axMaeTbjN0hy1Z9xA,Caleb Hammer,Mustang VS Tesla,1004270,25221,1329,0.029665,4,1439337,38849,2119
monthly,2026-05-01,2026-05-31,0y8vRPcSvbw,UCLe_q9axMaeTbjN0hy1Z9xA,Caleb Hammer,This Paralegal Has a WILD Side Hustle,926572,20191,231,0.026341,4,2098450,52571,1064
monthly,2026-05-01,2026-05-31,7Y7Iv5XAXwI,UCLe_q9axMaeTbjN0hy1Z9xA,Caleb Hammer,"Girlfriend Finds Out Partner is $72,000 in DEBT",909569,15340,279,0.021082,4,1783021,35464,719
monthly,2026-05-01,2026-05-31,GDex3WIPF7c,UCLe_q9axMaeTbjN0hy1Z9xA,Caleb Hammer,The Most USELESS College Degrees,904400,29146,1000,0.038646,4,1393320,48759,1786
monthly,2026-05-01,2026-05-31,OrI86PV-aPg,UCDOSaJ0pnglwzfkR6fYbisA,Luis Mi Negocios,Ozempic está DESTRUYENDO negocios que NADIE esperaba,891315,37708,864,0.049034,3,1260860,56960,1410
monthly,2026-05-01,2026-05-31,vmRbevilfpU,UCOWFKaCN-rzmYk502JFWnqg,Eze Martínez,Números de la suerte 🍀,859356,17702,125,0.033808,4,7297243,241800,1663
monthly,2026-05-01,2026-05-31,n2T6AOoUkOM,UCLe_q9axMaeTbjN0hy1Z9xA,Caleb Hammer,This New Day Trading Rule Will BANKRUPT People,789728,16920,259,0.025421,2,1753266,42066,634
monthly,2026-05-01,2026-05-31,eOI7WQIEX1Y,UCQX_MZRCaluNKxkywkLEgfA,Date un Vlog,"Cole Allen, Trump y los 11 científicos desaparecidos",782556,33778,2555,0.06258,4,1569059,86017,7560
monthly,2026-05-01,2026-05-31,P1DSZNhApJA,UCQHX6ViZmPsWiYSFAyS0a3Q,GothamChess,Jynxzi no no no no nooooooo,688945,10752,61,0.021448,2,2782529,57062,355
monthly,2026-05-01,2026-05-31,UncqiOQc4rI,UCLe_q9axMaeTbjN0hy1Z9xA,Caleb Hammer,Couple Makes $12 an Hour ILLEGALLY,687688,15556,225,0.029316,4,3516045,100362,1326
monthly,2026-05-01,2026-05-31,pG99B0ui06s,UC415bOPUcGSamy543abLmRA,Cleo Abram,How They Build Underwater Tunnels,675954,28806,118,0.046287,4,1766441,81800,510
monthly,2026-05-01,2026-05-31,yE8fJOgv7Pc,UCLe_q9axMaeTbjN0hy1Z9xA,Caleb Hammer,"Grandma Makes $100,000 Per Year",645187,14931,548,0.02768,4,916898,22903,818
monthly,2026-05-01,2026-05-31,5LJ1cxjQhyE,UC415bOPUcGSamy543abLmRA,Cleo Abram,Why Antarctica Has SO MANY Meteorites,619357,29793,147,0.055317,2,1941277,104297,518
monthly,2026-05-01,2026-05-31,reCJ5EuvukI,UCLe_q9axMaeTbjN0hy1Z9xA,Caleb Hammer,"Rest in Peace, Charlie Kirk....",547653,19737,308,0.039442,3,823090,30552,614
monthly,2026-05-01,2026-05-31,4s9LuOSR3Q4,UC7DdEm33SyaTDtWYGO2CwdA,Physics Girl,What would happen if the Sun dissapeared?,546487,11783,367,0.027873,2,916358,22573,773
monthly,2026-05-01,2026-05-31,pXI3xinu4bc,UCWBWgCD4oAqT3hUeq40SCUw,Sambucha,"People Who Are Famous, But Don’t Feel Famous",543856,26637,204,0.0518,3,1041378,52447,578
monthly,2026-05-01,2026-05-31,iBpxQpktHN4,UCQHX6ViZmPsWiYSFAyS0a3Q,GothamChess,1000 DAYS,541637,11177,37,0.029441,4,1943032,54657,343
monthly,2026-05-01,2026-05-31,jKTNMlUEdgU,UCQHX6ViZmPsWiYSFAyS0a3Q,GothamChess,Absurd 💀💀💀,525653,9592,55,0.023096,4,1186323,26230,224
monthly,2026-05-01,2026-05-31,2ZV29QhLfjw,UC1viRct91s1a3Z5yvk7FJXw,Diego Ruzzarin,"Los aranceles de Trump fueron ilegales, ahora el pueblo paga. #diegoruzzarin",493694,18845,569,0.060471,4,704829,35035,1070
monthly,2026-05-01,2026-05-31,FMdrD_jcYgE,UC7_gcs09iThXybpVgjHZ_7g,PBS Space Time,We Found Galaxies Too Old for the Universe,480958,23541,2119,0.082181,4,690712,42454,4077
monthly,2026-05-01,2026-05-31,tkLxg6h07aE,UCLe_q9axMaeTbjN0hy1Z9xA,Caleb Hammer,The WORST Debt In Financial Audit History,479798,4435,894,0.018689,4,939550,13158,3382
monthly,2026-05-01,2026-05-31,Hk-ARbCTKzM,UCWBWgCD4oAqT3hUeq40SCUw,Sambucha,People Who Became Famous For Doing Nothing,471008,14604,87,0.044485,4,5448903,239047,1326
monthly,2026-05-01,2026-05-31,N-zjDtQOwxc,UCNYW2vfGrUE6R5mIJYzkRyQ,DrossRotzank,Científicos importantes mueren y desaparecen en Estados Unidos ~ TODO LO QUE SE SABE,427441,24016,1130,0.083339,4,798834,57091,3477
monthly,2026-05-01,2026-05-31,W41XcEogOB0,UCWBWgCD4oAqT3hUeq40SCUw,Sambucha,Biggest One-Hit Wonders In History,418532,14452,90,0.046339,4,3642719,165510,1456
monthly,2026-05-01,2026-05-31,PnpHwhTWw0c,UCGq-a57w-aPwyi3pW7XLiHw,The Diary Of A CEO,Sex Expert: What Women Actually Need To Enjoy Sex,394256,6251,256,0.022693,4,1448715,29388,2645
monthly,2026-05-01,2026-05-31,ndkH5fZSIvs,UCWBWgCD4oAqT3hUeq40SCUw,Sambucha,Surprising People That Have Social Media,393992,19890,109,0.060437,4,987561,57425,401
monthly,2026-05-01,2026-05-31,Czf68kDF_7Y,UCLe_q9axMaeTbjN0hy1Z9xA,Caleb Hammer,This Mother Makes BANK,385120,8785,193,0.024597,4,2252922,54196,1003
monthly,2026-05-01,2026-05-31,snM0UfZxakc,UCLe_q9axMaeTbjN0hy1Z9xA,Caleb Hammer,"This Cat Operation Cost $9,000",364922,7027,426,0.026763,3,672921,15335,1155
monthly,2026-05-01,2026-05-31,31t_CBePs34,UCOWFKaCN-rzmYk502JFWnqg,Eze Martínez,El Cifrado Más Difícil,354624,7363,89,0.042525,4,1157021,46225,669
monthly,2026-05-01,2026-05-31,W65cfPslnzo,UCWBWgCD4oAqT3hUeq40SCUw,Sambucha,I Tried Getting Banned From Every Store (Again),352082,6963,355,0.030306,4,552147,13499,1107
monthly,2026-05-01,2026-05-31,v_1Dhh8G84c,UCLe_q9axMaeTbjN0hy1Z9xA,Caleb Hammer,Paying $2500 a Month For Rent in Texas,337068,5983,69,0.029037,4,1716351,48158,722
monthly,2026-05-01,2026-05-31,A2O_CSDImRs,UCLe_q9axMaeTbjN0hy1Z9xA,Caleb Hammer,What The Car You Drive Says About You,334564,11303,406,0.034575,2,662859,22148,865
monthly,2026-05-01,2026-05-31,mpZK1dqX6aA,UCQHX6ViZmPsWiYSFAyS0a3Q,GothamChess,BOOM BOOM BOOM BOOM,329076,8888,58,0.032173,4,827712,25522,194
monthly,2026-05-01,2026-05-31,pUlUgkaTQZg,UC415bOPUcGSamy543abLmRA,Cleo Abram,There’s Antimatter In This Truck,313807,10859,100,0.052409,4,1732158,87875,950
monthly,2026-05-01,2026-05-31,s6XPoPYDn-Y,UCLe_q9axMaeTbjN0hy1Z9xA,Caleb Hammer,Caleb Hammer RUINED Financial Audit,304728,7626,80,0.03078,4,1265518,38347,396
monthly,2026-05-01,2026-05-31,PoHZWjU54jY,UCQHX6ViZmPsWiYSFAyS0a3Q,GothamChess,HE THREW THE CHAIR,302134,6472,57,0.037064,4,2112730,75961,579
monthly,2026-05-01,2026-05-31,dU5sDKcwN9E,UCGq-a57w-aPwyi3pW7XLiHw,The Diary Of A CEO,YOU WILL NEVER SEE DISCIPLINE THE SAME AGAIN,301889,15576,155,0.049551,4,394902,19418,263
monthly,2026-05-01,2026-05-31,MOrBFf1DVvs,UCLe_q9axMaeTbjN0hy1Z9xA,Caleb Hammer,"This Guy Spent $25,000 To Marry a Somali",295437,5838,101,0.026109,2,905534,22199,383
monthly,2026-05-01,2026-05-31,MVFd0qFB9TE,UCHnyfMqiRRG1u-2MsSQLbXA,Veritasium,Why don't trains make *that* sound anymore?,292746,7765,83,0.031266,4,4131211,127167,1586
monthly,2026-05-01,2026-05-31,kB_PJC80JhY,UC52hytXteCKmuOzMViTK8_w,CdeCiencia,Por esto NO PUEDES dibujar una BICICLETA,292499,14417,81,0.043774,3,1116789,49648,275
monthly,2026-05-01,2026-05-31,TmkbUF0V0hM,UCLe_q9axMaeTbjN0hy1Z9xA,Caleb Hammer,Financial Audit's Most Disgusting Guest,291749,3470,1084,0.025939,3,665275,11174,4274
monthly,2026-05-01,2026-05-31,IrGd4xIhTN0,UCPdaxSov0mgwh77JvjQO2jQ,Man Carrying Thing,the Rise of Woke Books - a Response,290431,14727,3722,0.081061,4,497906,29884,8238
monthly,2026-05-01,2026-05-31,oRVJREzko-M,UCWBWgCD4oAqT3hUeq40SCUw,Sambucha,Weird Traits That Predict Success,273073,15135,130,0.061465,4,598465,36234,446
monthly,2026-05-01,2026-05-31,4yDM3ZFcQm4,UCUyDOdBWhC1MCxEjC46d-zw,Alex Hormozi,"""Am I Selling The Wrong Thing?""",271263,6530,59,0.032254,2,402964,11250,119
monthly,2026-05-01,2026-05-31,dNNyCZwEa6k,UC415bOPUcGSamy543abLmRA,Cleo Abram,There's a Secret Network Under Your Feet,265615,10745,77,0.068459,4,2444462,163175,1863
monthly,2026-05-01,2026-05-31,0t118SCf-2w,UCLe_q9axMaeTbjN0hy1Z9xA,Caleb Hammer,I'm Selling Everything,262735,3065,51,0.017908,4,1922701,33515,591
monthly,2026-05-01,2026-05-31,VgH5rhALEfU,UCWBWgCD4oAqT3hUeq40SCUw,Sambucha,Actors Who Changed Identities For Roles,256693,13107,180,0.05111,4,653046,33141,614
monthly,2026-05-01,2026-05-31,3PZ3d4eNWrc,UCWBWgCD4oAqT3hUeq40SCUw,Sambucha,How Long Could You Stay At A Dunkin After It Closes?,247285,12054,45,0.054512,3,796683,42508,286
monthly,2026-05-01,2026-05-31,gdjCR9h1yGc,UCWBWgCD4oAqT3hUeq40SCUw,Sambucha,Things You’re Allowed To Own But Not Sell,238057,7965,184,0.056848,4,2505863,138089,2344
monthly,2026-05-01,2026-05-31,vgwG6e9TFcw,UC415bOPUcGSamy543abLmRA,Cleo Abram,What Actually Is A Dyson Sphere?,235511,9485,156,0.052776,4,1550154,79818,1293
monthly,2026-05-01,2026-05-31,IMM5cm6xrXQ,UCLe_q9axMaeTbjN0hy1Z9xA,Caleb Hammer,Couple Makes $13k Per Month But Spends DOUBLE,227272,3604,94,0.022198,4,1543493,33073,851
monthly,2026-05-01,2026-05-31,5YKhtb3DNNo,UCNYW2vfGrUE6R5mIJYzkRyQ,DrossRotzank,Querido Dross llorando a mi mejor amigo,224656,13395,1022,0.093767,4,747231,61684,6209
monthly,2026-05-01,2026-05-31,jytAQWCc_TI,UCC552Sd-3nyi_tk2BudLUzA,AsapSCIENCE,You’ll never look at it the same after this video,223744,12078,768,0.064176,4,253453,14255,1019
monthly,2026-05-01,2026-05-31,XsY6iChNzf0,UCQHX6ViZmPsWiYSFAyS0a3Q,GothamChess,Human vs Computer,217109,4101,20,0.031527,4,1077429,32859,288
monthly,2026-05-01,2026-05-31,ExlWYbISs6I,UCWBWgCD4oAqT3hUeq40SCUw,Sambucha,How Much Money Does It Take To Empty A Vending Machine?,216178,9468,86,0.04638,4,538844,24481,355
monthly,2026-05-01,2026-05-31,mK3xENFCGnI,UC52hytXteCKmuOzMViTK8_w,CdeCiencia,El experimento de las descargas eléctricas,214278,18801,186,0.078914,2,459338,37157,446
monthly,2026-05-01,2026-05-31,BdUzhVM5w1U,UCQHX6ViZmPsWiYSFAyS0a3Q,GothamChess,Why is he laying down,198114,2916,14,0.027609,4,2513816,67921,629
monthly,2026-05-01,2026-05-31,JWOErbTL9N4,UCzR-rom72PHN9Zg7RML9EbA,PBS Eons,How Dinosaurs May Have Cursed Us With Aging,197494,5401,303,0.04998,4,505317,22825,1330
monthly,2026-05-01,2026-05-31,4at2bVIhLgc,UCQHX6ViZmPsWiYSFAyS0a3Q,GothamChess,GUESS THE ELO 3.0!!!!!!!!,195486,4238,96,0.034376,4,666436,21396,884
monthly,2026-05-01,2026-05-31,m-nnyNZ0TQ0,UCGq-a57w-aPwyi3pW7XLiHw,The Diary Of A CEO,Stanford Neuroscientist: Can’t Remember Your Dreams? Your Brain May Be Warning You!,191659,3523,159,0.021832,4,2053014,41957,2728
monthly,2026-05-01,2026-05-31,io_Ysi-LFWE,UCLe_q9axMaeTbjN0hy1Z9xA,Caleb Hammer,"I Inherited $200,000 of Debt From My Mother",187582,4837,103,0.031888,3,539772,16302,343
monthly,2026-05-01,2026-05-31,wgADj9n8XMs,UC52hytXteCKmuOzMViTK8_w,CdeCiencia,¿Por qué te mareas al leer en un coche?,185870,8962,67,0.044464,4,789524,35361,285
monthly,2026-05-01,2026-05-31,z7Qp9Q_Br88,UCsXVk37bltHxD1rDPwtNM8Q,Kurzgesagt – In a Nutshell,Laughing Gas Is Not So Funny,185050,8894,174,0.055951,4,651888,35089,878
monthly,2026-05-01,2026-05-31,XGAhqBxEV78,UCQHX6ViZmPsWiYSFAyS0a3Q,GothamChess,MAGNUS CARLSEN RETURNS TO CLASSICAL CHESS,180976,3985,200,0.036665,3,465237,14638,1159
monthly,2026-05-01,2026-05-31,a9T6IRpz31E,UCLe_q9axMaeTbjN0hy1Z9xA,Caleb Hammer,TOP 5 HIGHEST DEBT INTEREST RATES ON FINANCIAL AUDIT,180882,4866,179,0.037912,4,879246,31606,1163
monthly,2026-05-01,2026-05-31,Bcag49Fk3zA,UCLe_q9axMaeTbjN0hy1Z9xA,Caleb Hammer,"I Spend $300,000 a Month on Financial Audit",177543,3322,35,0.030681,4,1388356,41907,432
monthly,2026-05-01,2026-05-31,pcAJLeGAtwc,UCLe_q9axMaeTbjN0hy1Z9xA,Caleb Hammer,DO NOT BUY A NISSAN ALTIMA,175292,3224,33,0.02691,4,990942,25767,489
monthly,2026-05-01,2026-05-31,Cr7oGnSzmb4,UC415bOPUcGSamy543abLmRA,Cleo Abram,What If Earth Was Hollow?,173686,5524,26,0.050627,4,2012747,100286,578
monthly,2026-05-01,2026-05-31,39czcByvq7c,UCWBWgCD4oAqT3hUeq40SCUw,Sambucha,I Investigated Stores That Are Disappearing (Again),169091,2202,148,0.02465,4,690482,14891,1552
monthly,2026-05-01,2026-05-31,2pao0845DQQ,UCUyDOdBWhC1MCxEjC46d-zw,Alex Hormozi,Please Say  No....,167068,4452,32,0.03508,3,186117,5339,45
monthly,2026-05-01,2026-05-31,-1Fhry-Mqks,UCJ24N4O0bP7LGLBDvye7oCA,Matt D'Avella,I tried to optimize my life. It made it worse.,165395,8051,391,0.060928,4,207480,11384,589
monthly,2026-05-01,2026-05-31,rfRFwXnk660,UC5PwIMtLiIBCBhsu8f_-6UQ,Santiago Bilinkis,Salvá a tus hijos (estás a tiempo),163328,9418,579,0.073694,4,220723,13859,899
monthly,2026-05-01,2026-05-31,0D14LJGiBkg,UCQHX6ViZmPsWiYSFAyS0a3Q,GothamChess,"Chess, But Each Piece Is A Human?!",160520,7367,414,0.050709,4,324108,15091,1142
monthly,2026-05-01,2026-05-31,8TvJvfKz8Fo,UCTfQ65AxquXmih3r6rZmK-Q,jefillysh,No es Normal Vivir Así,160152,12202,711,0.098351,4,244984,20941,1354
monthly,2026-05-01,2026-05-31,R-klQGp_308,UCWBWgCD4oAqT3hUeq40SCUw,Sambucha,Websites That Have Never Changed,159863,5727,81,0.041972,2,446869,17956,251
monthly,2026-05-01,2026-05-31,dl0-TveDDGA,UCsXVk37bltHxD1rDPwtNM8Q,Kurzgesagt – In a Nutshell,Our Minds Are Weirder than You Think,159739,4742,145,0.051055,4,1816309,88053,3330
monthly,2026-05-01,2026-05-31,ywEV7NQlO1Y,UC36xmz34q02JYaZYKrMwXng,Nate Gentile,33.000 € en suscripciones. 🫠,159267,5188,86,0.052697,2,165318,5597,106
monthly,2026-05-01,2026-05-31,roUppNywDks,UCLe_q9axMaeTbjN0hy1Z9xA,Caleb Hammer,"$388,000 Of Debt To Storm The Capitol | Financial Audit",156969,1976,777,0.024883,4,871493,14904,6401
monthly,2026-05-01,2026-05-31,8--Bq5oEsZ8,UCWBWgCD4oAqT3hUeq40SCUw,Sambucha,I Tested AI Survival Products,155468,6484,87,0.045922,2,344584,15215,242
monthly,2026-05-01,2026-05-31,eRD2C7w9r6Y,UCDV1MWcRLthxSrmb2Zv-jeg,Ricardo Alca2,"""Hablemos de Cuerpos Ajenos""",154494,11058,378,0.095037,4,197513,16150,727
monthly,2026-05-01,2026-05-31,RniYUmKs93U,UCsXVk37bltHxD1rDPwtNM8Q,Kurzgesagt – In a Nutshell,Pigeons Are GPS Drones,152119,6960,94,0.062179,4,386314,22264,437
monthly,2026-05-01,2026-05-31,tpay1lEGZ7g,UCNYW2vfGrUE6R5mIJYzkRyQ,DrossRotzank,El muerto que se enterró a sí mismo,150896,9772,154,0.088619,2,397441,32123,971
monthly,2026-05-01,2026-05-31,vNXFk8iGHk8,UCWBWgCD4oAqT3hUeq40SCUw,Sambucha,How Long Could You Stay At Places After They Close?,147148,4851,18,0.053977,4,591544,29840,327
monthly,2026-05-01,2026-05-31,mDh52QTqR0o,UC1viRct91s1a3Z5yvk7FJXw,Diego Ruzzarin,Revisando las  noticias en vivo #14. El nuevo intento de desvivir a Trump.,146463,5146,303,0.055244,4,267785,13433,674
monthly,2026-05-01,2026-05-31,jAaw0vn7eLs,UCR1IuLEqb6UEA_zQ81kwXfg,Real Engineering,Why the Nokia 3310 was so Durable,145553,12678,206,0.080069,4,210482,17197,348
monthly,2026-05-01,2026-05-31,ktkpd9A8MD8,UCOWFKaCN-rzmYk502JFWnqg,Eze Martínez,El Objeto Que Costó Una Guerra,138520,5445,245,0.063224,4,485486,28273,1616
monthly,2026-05-01,2026-05-31,fuxYQrqkfns,UCOWFKaCN-rzmYk502JFWnqg,Eze Martínez,0.999 = 1?,136741,8269,198,0.076434,2,658638,48179,1056
monthly,2026-05-01,2026-05-31,wy3a_xJI3so,UCWBWgCD4oAqT3hUeq40SCUw,Sambucha,Can You Buy An Entire Movie For Yourself?,135220,4592,39,0.059932,4,882655,51046,646
monthly,2026-05-01,2026-05-31,81RBVN6P9cM,UCQHX6ViZmPsWiYSFAyS0a3Q,GothamChess,Magnus Carlsen Broke Computers With This Game,134265,3321,129,0.039273,2,357978,11987,950
monthly,2026-05-01,2026-05-31,fwUWAoSeg2g,UC5mQQ4Ur6oA8lsGFkvH2lyg,Noche De Chicxs,¡Dos AMANTES en su FUNERAL! 😱 Ft.  @fridaaraujof  - T10E06 #podcast #chismes #amantes,133399,3044,285,0.033062,4,257877,7430,734
monthly,2026-05-01,2026-05-31,DYkyYUjOZTk,UCWBWgCD4oAqT3hUeq40SCUw,Sambucha,Movie Scenes That Were Improvised,130052,4270,7,0.055255,4,1633509,88521,548
monthly,2026-05-01,2026-05-31,YUwjueXzffE,UCOHxDwCcOzBaLkeTazanwcw,Bravos Research,History is About to Be Made.,124962,2234,4,0.023891,3,239817,5269,46
monthly,2026-05-01,2026-05-31,JrGlAw_Q7ow,UCUyDOdBWhC1MCxEjC46d-zw,Alex Hormozi,It's Not As Hard As You Think,123983,4007,52,0.035223,4,132613,4609,67
monthly,2026-05-01,2026-05-31,QfUb5MEAOXA,UC4QZ_LsYcvcq7qOsOhpAX4A,ColdFusion,An Unknown Engineer is Apple's New CEO,115406,2700,149,0.035029,4,598648,19071,1405
monthly,2026-05-01,2026-05-31,kijJaXVri7Q,UCNYW2vfGrUE6R5mIJYzkRyQ,DrossRotzank,3 metrajes hechos antes de morir,115326,5151,85,0.070078,4,751902,50250,1466
monthly,2026-05-01,2026-05-31,KGeCwEOLPGE,UCWBWgCD4oAqT3hUeq40SCUw,Sambucha,How Long Could You Stay At A Movie Theater After It Closes?,114238,4074,17,0.059063,4,1998270,116616,658
monthly,2026-05-01,2026-05-31,tVpky2riji0,UCJQQVLyM6wtPleV4wFBK06g,VisualPolitik,EMIRATOS ROMPE la OPEP: el GOLPE que puede hundir el CÁRTEL del petróleo @VisualPolitik,112758,2967,69,0.038266,4,321322,11740,306
monthly,2026-05-01,2026-05-31,FYMdllTCrc0,UCR1IuLEqb6UEA_zQ81kwXfg,Real Engineering,The Insane Engineering of the V-22 Osprey,112644,2665,52,0.036013,4,826624,28305,972
monthly,2026-05-01,2026-05-31,oOCN30ulVyo,UC2UXDak6o7rBm23k3Vv5dww,Tina Huang,My FULL OpenClaw Setup (steal my prompts!),110018,3392,145,0.045792,4,180143,7046,377
monthly,2026-05-01,2026-05-31,ERWIJPTNZVM,UCQHX6ViZmPsWiYSFAyS0a3Q,GothamChess,JYNXZI vs GOTHAM CHESS BATTLE,109862,2779,108,0.03651,4,1100830,38235,1526
monthly,2026-05-01,2026-05-31,LLK879SXq_w,UCBBWpss2iXVXtTzl7-4eWbg,Jessica Fernández García,La TÍA PATY: Del CHISME en REDES a la CÁRCEL- Más allá del rosa con Perla Calvillo Cantu,108824,1623,292,0.021493,4,220787,3849,729
monthly,2026-05-01,2026-05-31,t9PF8V132Y4,UCgNg3vwj3xt7QOrcIDaHdFg,PolyMatter,Walmart’s New Plan to Defeat Amazon,107661,3093,365,0.039963,3,218429,7175,944
monthly,2026-05-01,2026-05-31,-uSQcEfnKp0,UCLe_q9axMaeTbjN0hy1Z9xA,Caleb Hammer,She Bought a Ford Bronco and Instantly Got it Repossessed,107642,2703,80,0.036437,4,645518,22537,693
monthly,2026-05-01,2026-05-31,Y254oB1QNOE,UCLe_q9axMaeTbjN0hy1Z9xA,Caleb Hammer,Gen-Z Men Need To LOCK IN,106720,2446,280,0.033294,4,331355,9858,838
monthly,2026-05-01,2026-05-31,Lqq78q17jDY,UCVt4ugq2txl_szlXAO7B3-g,Adrián Sáenz,La Forma Más Fácil De Ganar Dinero Con Claude,106718,5218,186,0.056807,4,394532,20954,1221
monthly,2026-05-01,2026-05-31,_WrHMsTYlOU,UCLe_q9axMaeTbjN0hy1Z9xA,Caleb Hammer,Couple Spent $100k Inheritance on a SCHOOL BUS,106636,1958,104,0.027957,4,948742,24948,1241
monthly,2026-05-01,2026-05-31,WeliLUboy3M,UCLe_q9axMaeTbjN0hy1Z9xA,Caleb Hammer,The Hairiest Guest in Financial Audit History,106195,1337,18,0.016385,4,1190044,18821,540
monthly,2026-05-01,2026-05-31,u5HPVyEpyNI,UCaVPhFg-Ax873wvhbNitsrQ,El Robot de Platón,Por qué son INÚTILES las LEYES de la ROBÓTICA,105033,6764,627,0.083822,4,164106,11672,1150
monthly,2026-05-01,2026-05-31,kH_bSvf7EVA,UCSju5G2aFaWMqn-_0YBtq5A,Stand-up Maths,What is up with UK bridge height signs?,103297,3428,422,0.05336,4,481150,21999,3126
monthly,2026-05-01,2026-05-31,rc-xQnupse0,UCJQQVLyM6wtPleV4wFBK06g,VisualPolitik,La EXTRAÑA decisión de CHINA sobre IRÁN que DESCONCIERTA a todo el mundo @VisualPolitik,103248,1400,55,0.031197,4,479438,13833,620
monthly,2026-05-01,2026-05-31,2r0m4TsyIxs,UCM55RjebjSevVWPnj2LEymw,viyaura,"These Emojis Should NOT Exist...(yes, again)",102839,2145,732,0.059332,2,196469,6648,2825
monthly,2026-05-01,2026-05-31,UsS6bOYnnOI,UC1yNl2E66ZzKApQdRuTQ4tw,Sabine Hossenfelder,The Reason Aliens Haven’t Contacted Us Might Be Horrifying…,102129,3965,867,0.069597,4,308630,16460,3541
monthly,2026-05-01,2026-05-31,TET8fTKH1e8,UCtIdb7KRqOTcOogKsos_QRw,Lord Draugr,Algo MUY RARO está pasando en el DESIERTO de CHINA,100614,2189,37,0.042567,4,572999,22835,655
monthly,2026-05-01,2026-05-31,U0f47Nt9g-Q,UCQX_MZRCaluNKxkywkLEgfA,Date un Vlog,Cole Allen: ¿Viaje en el tiempo… o casualidad?,100263,4263,136,0.060718,3,282575,15948,413
monthly,2026-05-01,2026-05-31,ucN2hf0CgI8,UCLe_q9axMaeTbjN0hy1Z9xA,Caleb Hammer,Togi Bought a LAMBO at an 18% Interest Rate,99666,1511,11,0.025644,4,1455835,36580,347
monthly,2026-05-01,2026-05-31,JjwHFerSu4M,UCaRLjOy-9m_eJ9REVqc0YoQ,Gustavo Entrala,CHINA hizo grande a APPLE. APPLE hizo de CHINA una SUPERPOTENCIA.,98603,5237,258,0.064508,3,143432,8138,441
monthly,2026-05-01,2026-05-31,0HSNPIttevk,UCLe_q9axMaeTbjN0hy1Z9xA,Caleb Hammer,Do This in Your 20s To Become a MILLIONAIRE,95973,1482,42,0.025311,4,969170,23537,762
monthly,2026-05-01,2026-05-31,UPbaPjDGQIE,UCWBWgCD4oAqT3hUeq40SCUw,Sambucha,I Tried Buying All The Fries From McDonald’s,93580,2902,28,0.052681,4,2343997,121654,1196
monthly,2026-05-01,2026-05-31,HRxULulg_hM,UCLe_q9axMaeTbjN0hy1Z9xA,Caleb Hammer,Dog Groomer Has No Idea How Much Money They Make,92304,1986,23,0.031603,4,947379,29074,371
monthly,2026-05-01,2026-05-31,if955Z_s4Ts,UCUyDOdBWhC1MCxEjC46d-zw,Alex Hormozi,I Don't Do Early Meetings,91560,1780,10,0.023022,4,278779,6275,62
monthly,2026-05-01,2026-05-31,3LnNwS6rqk8,UC36xmz34q02JYaZYKrMwXng,Nate Gentile,Monté el PC de BATMAN dentro de una Batcueva REAL,91298,4012,70,0.061356,4,435198,25464,728
monthly,2026-05-01,2026-05-31,OEtIq4tR1rA,UCUyDOdBWhC1MCxEjC46d-zw,Alex Hormozi,$1M Year Is Not Normal...,91022,6792,82,0.094378,2,95914,7334,85
monthly,2026-05-01,2026-05-31,BOmc_wliaRg,UCyJbb85EUgWjl38GcF236Jg,Eva Maria Beristain,CASO EDITH GUADALUPE Y JUAN JESUS N - Ruido Social,90198,2203,212,0.048753,4,792021,33317,4672
monthly,2026-05-01,2026-05-31,UM9dcnJXX0k,UCM55RjebjSevVWPnj2LEymw,viyaura,I Mastered Popular Anime Art Styles,89618,2740,336,0.052487,4,373251,15502,3465
monthly,2026-05-01,2026-05-31,eBbqRceO2qY,UCWBWgCD4oAqT3hUeq40SCUw,Sambucha,Deadliest Video Games,87397,2501,27,0.055049,4,1365078,73098,1137
monthly,2026-05-01,2026-05-31,er7v-GJj_V0,UCQX_MZRCaluNKxkywkLEgfA,Date un Vlog,La economía mundial depende de esta isla (NO ES PETRÓLEO),87032,4558,206,0.069776,4,531583,34649,1924
monthly,2026-05-01,2026-05-31,1baBzd1XPkU,UC1VLQPn9cYSqx8plbk9RxxQ,The Action Lab,Gravity Assists Are Basically Free Energy,86257,2062,242,0.048888,2,204352,7855,923
monthly,2026-05-01,2026-05-31,tbvteFr4SPQ,UCNYW2vfGrUE6R5mIJYzkRyQ,DrossRotzank,Querido Dross: el infierno del IMSS (Instituto Mexicano de Seguro Social),84350,3594,160,0.066508,4,1405023,85365,7426
monthly,2026-05-01,2026-05-31,4Zi41MRVP0g,UC5mQQ4Ur6oA8lsGFkvH2lyg,Noche De Chicxs,¡Me LIGÓ el amigo de mi ESPOSO! 😱 Ft. Fabrizio Santini de La Oficina - T10E07 #podcast #LaOficina,83327,2277,336,0.042002,4,102096,3203,436
monthly,2026-05-01,2026-05-31,69AWec8qjjo,UC55-mxUj5Nj3niXFReG44OQ,Platzi,La batalla legal entre Elon Musk y OpenAI,82397,2268,48,0.039964,3,146223,5067,142
monthly,2026-05-01,2026-05-31,up__2flbXw4,UCLe_q9axMaeTbjN0hy1Z9xA,Caleb Hammer,"Couple Spent $10,000 on Squishmallows",82336,851,19,0.021346,4,929358,18995,447
monthly,2026-05-01,2026-05-31,nVHr2D6tnA4,UC52hytXteCKmuOzMViTK8_w,CdeCiencia,Las pasas que cobran vida,81886,5111,49,0.073612,4,172339,12392,159
monthly,2026-05-01,2026-05-31,8u7HqZJQHDM,UCLe_q9axMaeTbjN0hy1Z9xA,Caleb Hammer,The Most INSANE Financial Audit Ever,79961,1003,261,0.021352,4,977738,15137,5607
monthly,2026-05-01,2026-05-31,7NeECqsR_u4,UCUyDOdBWhC1MCxEjC46d-zw,Alex Hormozi,"Is It Worth $100,000?",79729,1683,8,0.034686,2,95180,2361,16
monthly,2026-05-01,2026-05-31,48hHo2WcAQI,UC1viRct91s1a3Z5yvk7FJXw,Diego Ruzzarin,"¿Argentina, será el nuevo patio trasero de Israel? #diegoruzzarin #milei #argentina",79607,5618,975,0.090658,4,465573,38180,3823
monthly,2026-05-01,2026-05-31,oqoBSeL5GIU,UCGq-a57w-aPwyi3pW7XLiHw,The Diary Of A CEO,YOUR PENIS WILL SHRINK FOREVER,78695,3981,197,0.036938,4,295726,11312,623
monthly,2026-05-01,2026-05-31,98ShZgIhSbk,UCUyDOdBWhC1MCxEjC46d-zw,Alex Hormozi,Don't Ask This Question In A Sale,77592,2517,13,0.039357,4,87860,3038,15
monthly,2026-05-01,2026-05-31,8QsAx7s9PmQ,UCQHX6ViZmPsWiYSFAyS0a3Q,GothamChess,Please stop,76979,781,3,0.025639,4,1337908,33369,451
monthly,2026-05-01,2026-05-31,3era1_feC3U,UCQHX6ViZmPsWiYSFAyS0a3Q,GothamChess,HES A GENIUS,76804,1239,13,0.028957,4,1021678,28981,223
monthly,2026-05-01,2026-05-31,1PIbKMyFMAY,UCbdSYaPD-lr1kW27UJuk8Pw,QuantumFracture,¿Existen Fisuras en el Universo?,76747,4243,101,0.070956,4,157080,10142,322
monthly,2026-05-01,2026-05-31,TRVnxUYQAmI,UCPgVPrgqpALC1s2e63fgKyg,elWacky,El Contenido De Twitch Evoluciona,74520,5332,217,0.08612,4,207390,16643,991
monthly,2026-05-01,2026-05-31,gEUMAljLr78,UCb8GKeOvI7WsFUkB4UVAeXA,Cordura Artificial,"¿Por qué los RICOS fingen ser ""POBRES""?",71716,5125,443,0.09028,4,96021,7665,695
monthly,2026-05-01,2026-05-31,8fIRAhGGRgA,UCWBWgCD4oAqT3hUeq40SCUw,Sambucha,What Is The Most Amount Of Cereal You Can Buy At A Target?,71001,2305,35,0.050825,4,270329,13131,279
