grain,period_start,period_end,video_id,channel_id,channel_name,title,period_views_delta,period_likes_delta,period_comments_delta,period_avg_engagement_rate,period_snapshots,latest_views,latest_likes,latest_comments
monthly,2026-05-01,2026-05-31,fpkC4nn2D60,UCRDQzsHtx2cXvzEXnEhbxBg,Mister Krax,La jugada de USA 🇺🇸 para ingresar a México 🇲🇽 #mexico,5072,367,19,0.080423,4,6417,468,41
monthly,2026-05-01,2026-05-31,SvLaz6y-mhs,UCBBWpss2iXVXtTzl7-4eWbg,Jessica Fernández García,Escúchalo completo en Más Allá del Rosa en YouTube,5056,108,2,0.025202,4,24959,628,6
monthly,2026-05-01,2026-05-31,uvfU2B8b4G4,UCDOSaJ0pnglwzfkR6fYbisA,Luis Mi Negocios,¿Por qué ESPERAN años para SALIR a BOLSA?,5030,255,6,0.047781,4,48341,2299,23
monthly,2026-05-01,2026-05-31,U4gpio58908,UC1yNl2E66ZzKApQdRuTQ4tw,Sabine Hossenfelder,Physicists finally prove that virtual particles are real and all around us,4984,174,24,0.057771,4,237061,12228,1435
monthly,2026-05-01,2026-05-31,lWQY5zccbQs,UCUyDOdBWhC1MCxEjC46d-zw,Alex Hormozi,Stick With The Pan,4825,119,2,0.037653,4,25022,890,38
monthly,2026-05-01,2026-05-31,1X8BPKi1kP8,UCm5iBOcQ0GET_2FqFI61QDA,Cara Nicole,How Americans plan to pay for their summer vacations ☀️,4797,187,12,0.047718,3,9478,395,36
monthly,2026-05-01,2026-05-31,s2NSwy8xraQ,UCtoo4_P6ilCj7jwa4FmA5lQ,Soy Dalto,Con ESTO tu vida podria ser MÁS FÁCIL,4662,280,6,0.06296,4,10489,646,13
monthly,2026-05-01,2026-05-31,e5jQUYrRPRk,UCF0L4jd9LcSIxsj5gKITMqQ,Jaime Higuera,Reemplaza años de universidad con estos vídeos  #shorts,4661,235,1,0.053127,2,7481,386,3
monthly,2026-05-01,2026-05-31,OWkM5YoEhgM,UCEQXxiYxNZbym9Fad7-n2Lg,Doctor Fisión,EL FUTURO DE LA PROPULSIÓN ESPACIAL SIN COMBUSTIBLE 🛰️,4591,274,6,0.077306,4,71664,5404,99
monthly,2026-05-01,2026-05-31,k30WHO9_ppU,UCl5-lvQyfILb-l2abPk4Ntg,Inteligencia Artificial,👉🏻 Te dejo la Guía Pro de ChatGPT fijada en los comentarios de este video.,4588,176,4,0.037418,4,7432,277,5
monthly,2026-05-01,2026-05-31,LQd65ctML6o,UCF0L4jd9LcSIxsj5gKITMqQ,Jaime Higuera,Este es uno de los errores más comunes cuando la gente empieza a ganar dinero #shorts,4578,548,5,0.114353,4,5152,578,5
monthly,2026-05-01,2026-05-31,sqXsMACtso0,UCEQXxiYxNZbym9Fad7-n2Lg,Doctor Fisión,ASÍ SE CONFIGURÓ EL MOTOR CLIMÁTICO DEL PLANETA 🌎,4572,283,2,0.10048,4,26665,2583,42
monthly,2026-05-01,2026-05-31,sncgYGQt1T8,UCl5-lvQyfILb-l2abPk4Ntg,Inteligencia Artificial,👉🏻 Te dejo el PROMPT para mejorar tu foto de perfil fijado en los comentarios de este vídeo,4534,184,3,0.043009,4,9434,388,12
monthly,2026-05-01,2026-05-31,EZLeWRbCEbA,UCEK0oX3X2yK9y27khCsrNKg,Mis Propias Finanzas,El Método Exacto para Invertir en CTDs (Renta Fija) y Crear Patrimonio | Experto en Inversiones,4530,147,8,0.0424,4,38765,1541,89
monthly,2026-05-01,2026-05-31,QLnHGjCD-Vw,UCF0L4jd9LcSIxsj5gKITMqQ,Jaime Higuera,Así te espera el 2027 #shorts,4515,368,10,0.080061,4,5137,400,12
monthly,2026-05-01,2026-05-31,B2ag364pRgQ,UCoOae5nYA7VqaXzerajD0lg,Ali Abdaal,I got cancelled for my 2x speed,4510,115,13,0.040413,4,65949,2246,401
monthly,2026-05-01,2026-05-31,iGaMJCi8mAk,UCyM-2pRapEv6V2q7UNO9icg,Emprende Aprendiendo,Pasó de FUNDADORA a COMPETENCIA,4459,100,0,0.028215,4,11084,297,3
monthly,2026-05-01,2026-05-31,siKdeoxrxIA,UCxFACDJ98idvo9Gq9M9AQgg,Moris Dieck | Finanzas e Inversiones ,1 de cada 10 mexicanos tiene seguro médico,4444,102,5,0.047895,4,17877,824,24
monthly,2026-05-01,2026-05-31,3QRWlCFdzyE,UCF0L4jd9LcSIxsj5gKITMqQ,Jaime Higuera,Me cambió la vida cuando Jaime Higuera dijo esto #shorts,4426,174,1,0.04922,4,20161,952,20
monthly,2026-05-01,2026-05-31,jcfifYFAdpM,UCRDQzsHtx2cXvzEXnEhbxBg,Mister Krax,Ecatepec en la mira del desarrollo #ecatepec #méxico,4378,609,18,0.130788,4,8434,1067,36
monthly,2026-05-01,2026-05-31,67JREKwyixk,UCl5-lvQyfILb-l2abPk4Ntg,Inteligencia Artificial,👉🏻 Te dejo la Guía Pro de ChatGPT fijada en los comentarios de este video.,4302,135,0,0.029078,4,8647,255,2
monthly,2026-05-01,2026-05-31,Gr6qcQdzDfw,UCEK0oX3X2yK9y27khCsrNKg,Mis Propias Finanzas,La Verdad Económica del Nuevo Decreto Pensional en Colombia,4274,138,63,0.069569,2,9168,430,145
monthly,2026-05-01,2026-05-31,TUSbI3pqiCM,UCRlBDnRQduDk4tmm1OtpSRg,UN POCO MEJOR,14 Reglas para Ser Rico que el 90% de la Gente Ignora,4247,222,2,0.073561,4,20189,1423,27
monthly,2026-05-01,2026-05-31,TOKUlItJpY4,UCF0L4jd9LcSIxsj5gKITMqQ,Jaime Higuera,Lo que tengo no es suerte  #shorts,4225,74,2,0.02987,4,7927,220,5
monthly,2026-05-01,2026-05-31,YD2iT-SCJb0,UCBBWpss2iXVXtTzl7-4eWbg,Jessica Fernández García,Escúchalo completo en Más Allá del Rosa en YouTube,4213,76,3,0.020227,4,6707,133,6
monthly,2026-05-01,2026-05-31,DYhg0nWZ1UQ,UCDOSaJ0pnglwzfkR6fYbisA,Luis Mi Negocios,La cruda REALIDAD FINANCIERA de las MUJERES,4210,443,63,0.121378,4,4210,448,63
monthly,2026-05-01,2026-05-31,z-7AhJ55htQ,UCJQQVLyM6wtPleV4wFBK06g,VisualPolitik,ESTADO DE ALERTA en COREA: IRÁN pone al país CONTRA LAS CUERDAS @VisualPolitik,4197,98,2,0.034843,4,408751,13355,868
monthly,2026-05-01,2026-05-31,o39vHtwxPRg,UC5mQQ4Ur6oA8lsGFkvH2lyg,Noche De Chicxs,Complicó su chamba #chisme #comedia #podcast,4195,162,2,0.032562,2,7016,245,3
monthly,2026-05-01,2026-05-31,rr8ZpzHcZJc,UCF0L4jd9LcSIxsj5gKITMqQ,Jaime Higuera,Enfócate en este hábito para cambiar tu vida #shorts,4176,409,7,0.118726,2,6039,645,11
monthly,2026-05-01,2026-05-31,5fKeNMp7F6s,UCUyDOdBWhC1MCxEjC46d-zw,Alex Hormozi,Im Doing Too Many Things In The Business,4150,87,1,0.025214,4,26203,650,5
monthly,2026-05-01,2026-05-31,EXOQ7vN2NXk,UC4FHiPgS1KXkUMx3dxBUtPg,HolaMundo,¿Cuál es la mejor IA para programar?,4126,162,11,0.050735,4,23408,1075,98
monthly,2026-05-01,2026-05-31,FbRnMwKmmTA,UCP15FVAA2UL-QOcGhy7-ezA,EDteam,¿Existen pasos para convertirse en experto en IA?,4113,274,10,0.076476,3,8132,566,33
monthly,2026-05-01,2026-05-31,a8LrJMGoVL4,UCoXtmmnLCbXDiSo8GxsmOzA,La gata de Schrödinger,Tres libros imprescindibles para cambiar tu forma de ver el mundo,4095,350,5,0.078115,4,127866,9525,473
monthly,2026-05-01,2026-05-31,CZe8DucT3qA,UCPgVPrgqpALC1s2e63fgKyg,elWacky,Actualización Repugnante,4078,227,3,0.07565,4,245059,17517,1006
monthly,2026-05-01,2026-05-31,Wz8CxWdCHC0,UCF0L4jd9LcSIxsj5gKITMqQ,Jaime Higuera,Por esto estoy agradecido con mis padres #shorts,4007,272,6,0.061574,4,9208,570,10
monthly,2026-05-01,2026-05-31,1gyuiKoSc-w,UCjSVqRtdOsxQDss_pJpp_Yg,COMPUESTOS Podcast,Bárbara Tijerina: Cómo Detectar Mentiras y Leer a Cualquier Persona en Segundos | EP. #65,4004,137,7,0.046594,4,5819,236,13
monthly,2026-05-01,2026-05-31,iPg5fXvAqqo,UCF0L4jd9LcSIxsj5gKITMqQ,Jaime Higuera,Me voló la cabeza cuando Jaime Higuera dijo esto #shorts,3977,92,2,0.030614,2,8241,229,5
monthly,2026-05-01,2026-05-31,TLdMXZSABH8,UCP15FVAA2UL-QOcGhy7-ezA,EDteam,En vivo: ¿Qué es lo nuevo de Deepseek 4?,3966,112,14,0.045627,4,10511,444,23
monthly,2026-05-01,2026-05-31,QDZUOBnmf4Q,UCEQXxiYxNZbym9Fad7-n2Lg,Doctor Fisión,LA MATERIA OSCURA PODRÍA TENER DOS ESTADOS 🌌,3965,229,5,0.091062,4,40151,3501,114
monthly,2026-05-01,2026-05-31,ys1zQyiLrMc,UC5mQQ4Ur6oA8lsGFkvH2lyg,Noche De Chicxs,¡Le tuve que mentir a mi mamá! #chisme #comedia #podcast,3959,222,1,0.049872,4,7201,366,3
monthly,2026-05-01,2026-05-31,j584RpaMrDg,UCl5-lvQyfILb-l2abPk4Ntg,Inteligencia Artificial,👉🏻 Te dejo la Guía Pro de ChatGPT fijada en los comentarios de este video.,3952,117,3,0.030007,4,4311,130,4
monthly,2026-05-01,2026-05-31,xO5diVmgE8Y,UCM55RjebjSevVWPnj2LEymw,viyaura,i drew secret emojis...#art #artist,3941,99,18,0.072516,4,51176,3291,358
monthly,2026-05-01,2026-05-31,cdOcjUyQr8A,UCGq-a57w-aPwyi3pW7XLiHw,The Diary Of A CEO,TRAUMA TRIANGLE SHAPES WHO YOU ARE AS AN ADULT,3939,128,1,0.043244,4,194380,8217,173
monthly,2026-05-01,2026-05-31,kLJNcHqVmJA,UC9WGON3pXofvE958Uq3Lw3Q,Exito Financiero,3 Metas Financieras Que NADIE Te Dice (Pero Son Cruciales),3937,149,2,0.056546,4,11621,603,24
monthly,2026-05-01,2026-05-31,lE7rIBv-nV8,UCUyDOdBWhC1MCxEjC46d-zw,Alex Hormozi,Business Will Always Be Hard,3932,117,0,0.034138,4,17477,585,4
monthly,2026-05-01,2026-05-31,AXvou3mSGQA,UC55-mxUj5Nj3niXFReG44OQ,Platzi,"OpenAI lanzó GPT 5.5, ya no necesitas prompts detallados.",3901,21,2,0.03332,4,35370,1096,44
monthly,2026-05-01,2026-05-31,Jr9Xm5f44NQ,UCPTlwyaEoJOVyvDLzHagzNQ,WATOP,China Abandonó A Millones De Vietnamitas A Su Suerte Arrebatándoles Lo Que Mantenía Viva A La Región,3882,163,4,0.05962,4,13600,777,15
monthly,2026-05-01,2026-05-31,sGEEHGc7eyo,UCl5-lvQyfILb-l2abPk4Ntg,Inteligencia Artificial,👉🏻 Te dejo la Guía de Gemini Pro  fijada en los comentarios de este video.,3749,149,2,0.033131,4,6386,221,5
monthly,2026-05-01,2026-05-31,jdrW-vJOD1w,UC55-mxUj5Nj3niXFReG44OQ,Platzi,Meta está entrenando la IA con sus propios empleados,3730,53,4,0.053856,4,16264,795,33
monthly,2026-05-01,2026-05-31,LDQnGP6iSH4,UC3nwmvE2aDzUSJ4evQ1NhoA,IA Innova,¡El NUEVO Navegador de Google que usa un Agente de IA es una LOCURA!,3722,162,13,0.054796,3,9733,490,28
monthly,2026-05-01,2026-05-31,qf_JlCrcPy0,UCP15FVAA2UL-QOcGhy7-ezA,EDteam,DeepSeek V4 utiliza chips de Huawei,3722,169,10,0.05835,2,10475,561,27
monthly,2026-05-01,2026-05-31,0dwlHNDdn2s,UCxFACDJ98idvo9Gq9M9AQgg,Moris Dieck | Finanzas e Inversiones ,¿Curar o facturar?,3710,174,1,0.050378,4,14444,723,4
monthly,2026-05-01,2026-05-31,DHk0gFHyHeE,UCl5-lvQyfILb-l2abPk4Ntg,Inteligencia Artificial,ChatGPT 5.5 es un cambio de era 🔥🚀,3708,89,3,0.033382,4,150167,4636,363
monthly,2026-05-01,2026-05-31,rhVEOqNhjKo,UCUyDOdBWhC1MCxEjC46d-zw,Alex Hormozi,People WANT To Buy...,3684,81,0,0.031254,4,32396,986,16
monthly,2026-05-01,2026-05-31,Hf6NC8AzAKo,UCtT7zEoC9-HNyLYb8cYWoww,Ale Marin,LA VERDAD DETRÁS DEL JUEGO MÁS POPULAR DE LOS MILLENIALS... l Qué caraj* son Los Sims? l Ale Marin,3678,310,22,0.106881,3,4908,444,31
monthly,2026-05-01,2026-05-31,_FP4gbF0KWY,UCP15FVAA2UL-QOcGhy7-ezA,EDteam,¿ChatGPT o Claude? ¡No importa cuál es mejor!,3676,203,3,0.075495,3,7866,530,17
monthly,2026-05-01,2026-05-31,p5zWy46yWxU,UCUyDOdBWhC1MCxEjC46d-zw,Alex Hormozi,Here's How I'd Get To $1M/Month,3669,55,0,0.020207,4,62327,1238,15
monthly,2026-05-01,2026-05-31,HEW0VJx9iw0,UCUyDOdBWhC1MCxEjC46d-zw,Alex Hormozi,Watch If You're Under $1M Year,3649,103,1,0.037194,4,55672,2042,15
monthly,2026-05-01,2026-05-31,1t2Yd_bmg_k,UCF0L4jd9LcSIxsj5gKITMqQ,Jaime Higuera,Me cambió la vida cuando Jaime Higuera dijo esto #shorts,3641,178,2,0.062028,4,9280,556,5
monthly,2026-05-01,2026-05-31,waOGddip3Wk,UCRDQzsHtx2cXvzEXnEhbxBg,Mister Krax,La maldición de la silla presidencial #méxico,3573,293,22,0.103407,4,4694,417,31
monthly,2026-05-01,2026-05-31,NDF3VSFbxAU,UC55-mxUj5Nj3niXFReG44OQ,Platzi,¿Claude Design destruyó Figma?,3539,93,2,0.04583,4,6449,260,5
monthly,2026-05-01,2026-05-31,L8_m7pOI2-A,UCOvzFyIAr32yspwxx77BHcQ,Rob Paper Clips,¿Los Fans del Temach son una SECTA?,3520,105,14,0.052294,4,86209,4054,438
monthly,2026-05-01,2026-05-31,7IL0scdhgJA,UCm5iBOcQ0GET_2FqFI61QDA,Cara Nicole,Let’s talk about Emily Blunt’s career advice 😬,3493,161,8,0.054803,4,7074,351,24
monthly,2026-05-01,2026-05-31,DgX6SMZaC_8,UCEQXxiYxNZbym9Fad7-n2Lg,Doctor Fisión,UN PLANETA GIGANTE ORBITANDO UNA PEQUEÑA ESTRELLA 🛰️,3486,218,3,0.081334,4,50131,3975,68
monthly,2026-05-01,2026-05-31,MnlZeYcfowk,UCF0L4jd9LcSIxsj5gKITMqQ,Jaime Higuera,Este es el verdadero problema   #shorts,3476,385,2,0.105308,4,3793,400,2
monthly,2026-05-01,2026-05-31,DB302vKJ2Go,UCP15FVAA2UL-QOcGhy7-ezA,EDteam,¿La gente olvidó cómo utilizar Google?,3468,221,25,0.092681,2,11399,920,92
monthly,2026-05-01,2026-05-31,RNUjufFVGXs,UCfOaXuYSAQXm7CTYWD8dUXQ,MIGALA D,El aguacate,3467,304,26,0.11583,3,5100,502,36
monthly,2026-05-01,2026-05-31,7PY7jbupwSg,UCP15FVAA2UL-QOcGhy7-ezA,EDteam,¿Qué ganan las empresas que dan Open Source?,3408,96,4,0.046037,4,8789,385,8
monthly,2026-05-01,2026-05-31,8erUsIGULKc,UCvPGx8qh8AkrFZW06tESvaA,Dot Dager,"Mirá lo que hiciste, Leito.    #dev #programacion",3355,158,9,0.057368,4,6772,347,33
monthly,2026-05-01,2026-05-31,Um1DSnUqmko,UCl5-lvQyfILb-l2abPk4Ntg,Inteligencia Artificial,👉🏻 Te dejo la Guía Pro de ChatGPT fijada en los comentarios de este video.,3291,103,0,0.026294,4,11234,297,1
monthly,2026-05-01,2026-05-31,MmtdaRSSUZA,UCaZ5txM63JGqgzRTVXy5e9g,César Dabián Finanzas,Cómo salir de Deudas Para Siempre- Clase Completa,3278,169,13,0.082386,4,6682,459,39
monthly,2026-05-01,2026-05-31,fgasMQ6UWPY,UCEK0oX3X2yK9y27khCsrNKg,Mis Propias Finanzas,Reporte de resultados,3277,124,-4,0.053164,4,4859,214,15
monthly,2026-05-01,2026-05-31,dIwCndpKuSE,UCF0L4jd9LcSIxsj5gKITMqQ,Jaime Higuera,Así actúan los millonarios #shorts,3245,345,1,0.071352,2,3969,379,1
monthly,2026-05-01,2026-05-31,G9L3zK57X6Y,UCDOSaJ0pnglwzfkR6fYbisA,Luis Mi Negocios,El ERROR más PELIGROSO que COMETES sin saber,3236,121,0,0.053966,4,89525,4732,85
monthly,2026-05-01,2026-05-31,w_Z0cdu9c9I,UC9mrBfjgyOsqJ0J-zw7kZLQ,Atherion,¿miedo al abandono?,3207,204,5,0.085287,3,7171,564,15
monthly,2026-05-01,2026-05-31,AxM96v9ZCzI,UC36xmz34q02JYaZYKrMwXng,Nate Gentile,Dándole ojos a la IA 👁️🤖💻,3200,79,0,0.026453,4,67237,1757,12
monthly,2026-05-01,2026-05-31,OkuWh46I4m4,UCDOSaJ0pnglwzfkR6fYbisA,Luis Mi Negocios,5 pasos para MULTIPLICAR tu DINERO,3183,148,9,0.061934,4,17788,1057,35
monthly,2026-05-01,2026-05-31,3GUtClCifjw,UC4FHiPgS1KXkUMx3dxBUtPg,HolaMundo,¿se puede programar con agentes y una gráfica integrada?,3170,94,1,0.029479,3,11022,319,7
monthly,2026-05-01,2026-05-31,XNDiFY5vIk0,UCUyDOdBWhC1MCxEjC46d-zw,Alex Hormozi,What Is Focus?,3159,99,0,0.046209,2,13775,604,6
monthly,2026-05-01,2026-05-31,mT-7tbs7rVw,UCF0L4jd9LcSIxsj5gKITMqQ,Jaime Higuera,Por esto digo que vestir bien es un acto de rebeldía  #shorts,3157,155,3,0.059482,4,17638,1018,20
monthly,2026-05-01,2026-05-31,tPuup43tbgA,UCyM-2pRapEv6V2q7UNO9icg,Emprende Aprendiendo,La mujer que revolcionó la moda femenina,3130,52,0,0.024815,2,8215,186,2
monthly,2026-05-01,2026-05-31,3W1KfxQnQiU,UCOxW1h1VV379Q8GDdUJOhgw,Mariano Trejo,30 Hábitos que (Silenciosamente) Cambiaron mi Vida para Siempre,3035,151,6,0.066664,4,10889,681,32
monthly,2026-05-01,2026-05-31,XX7hskkX1AA,UC1viRct91s1a3Z5yvk7FJXw,Diego Ruzzarin,El imperio en decadencia: El capricho de Trump costeado por el pueblo de U.S.A.,2999,102,3,0.046508,4,90823,4087,127
monthly,2026-05-01,2026-05-31,87jnYKGVetM,UCUyDOdBWhC1MCxEjC46d-zw,Alex Hormozi,Most People Quit Right Before This Happens,2952,84,0,0.039251,4,31009,1192,12
monthly,2026-05-01,2026-05-31,N8Bc_M2Ew2E,UC5PwIMtLiIBCBhsu8f_-6UQ,Santiago Bilinkis,¿Por qué las mejores ideas aparecen en la ducha?,2948,146,0,0.065582,3,8961,551,9
monthly,2026-05-01,2026-05-31,pVXm6lt1F7w,UCF0L4jd9LcSIxsj5gKITMqQ,Jaime Higuera,Este es el tiempo más peligroso #shorts,2939,198,3,0.101126,4,20985,2075,18
monthly,2026-05-01,2026-05-31,bouvNyq8xCY,UCX6b17PVsYBQ0ip5gyeme-Q,CrashCourse,Earth's Crust and Mantle Explained: Crash Course Geology #3,2818,107,0,0.069777,4,31139,2069,66
monthly,2026-05-01,2026-05-31,dYJM9jmLBzY,UCPgVPrgqpALC1s2e63fgKyg,elWacky,No Lo Puedo Creer,2810,213,7,0.108703,4,163304,16933,798
monthly,2026-05-01,2026-05-31,B18aH00d8oE,UCJQQVLyM6wtPleV4wFBK06g,VisualPolitik,El PENTÁGONO ya tiene un plan para CUBA:  ¿Intervención a la vista? @VisualPolitik,2786,91,6,0.046534,4,280108,12260,765
monthly,2026-05-01,2026-05-31,stk7f11pyr8,UCl5-lvQyfILb-l2abPk4Ntg,Inteligencia Artificial,👉🏻 Te dejo la Guía para convertirte en un pastel fijada en los comentarios de este vídeo,2752,20,2,0.010933,4,7970,75,11
monthly,2026-05-01,2026-05-31,UWRxdKxuOb8,UCF0L4jd9LcSIxsj5gKITMqQ,Jaime Higuera,Me voló la cabeza cuando Jaime Higuera dijo esto #shorts,2708,103,2,0.068604,4,15565,1038,18
monthly,2026-05-01,2026-05-31,QSe13hyv68o,UCl5-lvQyfILb-l2abPk4Ntg,Inteligencia Artificial,🤖  Los sistemas de seguridad nuclear están diseñados para proteger la vida 🤖 #ia #chatgpt #nuclear,2698,31,1,0.015645,4,33334,500,18
monthly,2026-05-01,2026-05-31,lvw8Fe5wcBo,UCP15FVAA2UL-QOcGhy7-ezA,EDteam,"ChatGPT, Claude y Gemini están empatados, ninguno es mejor.",2689,100,6,0.037678,4,12898,460,28
monthly,2026-05-01,2026-05-31,6-PunI-5Ts4,UCEQXxiYxNZbym9Fad7-n2Lg,Doctor Fisión,DESCUBREN PARTÍCULAS QUE SALEN DIRECTAMENTE DEL VACÍO 🌌,2685,169,2,0.101576,4,29226,2849,88
monthly,2026-05-01,2026-05-31,_BhjwaNE8mc,UCF0L4jd9LcSIxsj5gKITMqQ,Jaime Higuera,Ser rico es toda una estafa  #shorts,2673,306,7,0.113647,4,7482,846,17
monthly,2026-05-01,2026-05-31,HyWpbCUdCr8,UCl5-lvQyfILb-l2abPk4Ntg,Inteligencia Artificial,👉🏻 Te dejo la Guía Pro de ChatGPT fijada en los comentarios de este video.,2661,136,2,0.042577,4,6061,263,5
monthly,2026-05-01,2026-05-31,8CpQzf_RYb4,UCxFACDJ98idvo9Gq9M9AQgg,Moris Dieck | Finanzas e Inversiones ,"""Le vas invertir dinero al aire""",2654,174,1,0.070759,3,4486,306,3
monthly,2026-05-01,2026-05-31,T34ygnCahZc,UC5PwIMtLiIBCBhsu8f_-6UQ,Santiago Bilinkis,¿Nacimos para ser fieles? La mentira de la monogamia,2631,71,3,0.036847,4,40797,1394,113
monthly,2026-05-01,2026-05-31,y3HkZSayX2s,UC30ajuhy8cViP2DiM1QLjmg,98grados,Decisión por apariencia es mala decisión (probablemente) #smartphone #iphone #apple,2603,150,1,0.054334,4,15930,846,18
monthly,2026-05-01,2026-05-31,2A0dbP8LJoA,UCLYoURyGHMUuQ5YrfX55PWg,Aprendiz Financiero,DEJA de PERDER el tiempo I 5 Cosas en las cuales DEBERÍA DOLERTE gastar tu tiempo,2598,174,4,0.099766,3,6588,585,29
monthly,2026-05-01,2026-05-31,0IGNbK4bbXA,UCHMSzZaVrEjK35aYK3J7Htw,Pequeño Cerdo Capitalista,Ideas de Negocio: Servicios para Mascotas 🐶 🐱 (Ignorados Pero MUY Rentables),2580,126,6,0.068071,4,15560,985,64
monthly,2026-05-01,2026-05-31,rYKQ0Ukxe6k,UC55-mxUj5Nj3niXFReG44OQ,Platzi,Me borran la memoria y despierto en 2008,2575,81,2,0.04367,4,19537,808,36
monthly,2026-05-01,2026-05-31,Q4zggacUY6E,UCEK0oX3X2yK9y27khCsrNKg,Mis Propias Finanzas,El Mejor Consejo Financiero del VP de Mastercard,2548,55,0,0.020664,4,3934,84,1
monthly,2026-05-01,2026-05-31,A83vXatD6sY,UCl5-lvQyfILb-l2abPk4Ntg,Inteligencia Artificial,👉🏻 Te dejo la Guía Pro de ChatGPT fijada en los comentarios de este video.,2532,43,1,0.020803,4,10603,222,6
monthly,2026-05-01,2026-05-31,-5kkpHpexIA,UC5mQQ4Ur6oA8lsGFkvH2lyg,Noche De Chicxs,Se ofendieron sin contexto #chisme #comedia #podcast,2521,29,0,0.020677,4,33196,672,4
monthly,2026-05-01,2026-05-31,BnAKfe0qGbE,UCP15FVAA2UL-QOcGhy7-ezA,EDteam,La forma más fácil de crear tu primera skill,2516,114,2,0.072593,4,12673,902,6
monthly,2026-05-01,2026-05-31,5ymn2oV1Zls,UCPgVPrgqpALC1s2e63fgKyg,elWacky,Al Parecer Sí Es Un Monstruo,2462,131,-3,0.071477,4,305446,20685,1131
monthly,2026-05-01,2026-05-31,UxUmboIvArE,UC-ktYMwvFKNmhQdps8VDrkg,Daniel Felipe Medina,La nueva estrategia de YouTube que está generando millones,2443,124,11,0.061901,4,2739,143,13
monthly,2026-05-01,2026-05-31,9QKOkpu78CQ,UCV5G678sZwW5IcF3pCfRbHQ,La Hiperactina,Publi⭐️ ¿Por qué hay cosas que lees mil veces y no entiendes… y en vídeo sí? 📹🧬✨,2429,169,4,0.08082,4,97543,7751,131
monthly,2026-05-01,2026-05-31,e7IyFScAa-Q,UC9WGON3pXofvE958Uq3Lw3Q,Exito Financiero,Los 5 NIVELES De La LIBERTAD FINANCIERA,2428,42,4,0.043592,4,17154,673,50
monthly,2026-05-01,2026-05-31,IQZiAOokKXo,UCUyDOdBWhC1MCxEjC46d-zw,Alex Hormozi,Here Is Why People Stop Buying From You,2396,39,0,0.025497,4,29541,746,3
monthly,2026-05-01,2026-05-31,-Ap6qWvqk0I,UCF7UoUGGOUcSSNcVDndq7KQ,Itzcalli,"SI ERES MUJER, TU BELLEZA ES UNA MONEDA DE CAMBIO: Barbie y los Diarios de una boticaria",2378,304,8,0.145613,4,20983,2890,152
monthly,2026-05-01,2026-05-31,pra3fiwosjU,UCtT7zEoC9-HNyLYb8cYWoww,Ale Marin,todos se enojaron con ella pero NO TIENEN RAZON,2348,63,0,0.034955,3,3722,115,5
monthly,2026-05-01,2026-05-31,La4ogJrxI0g,UCTfQ65AxquXmih3r6rZmK-Q,jefillysh,"Neuronas jugando Doom, Mega Terremotos y Nuestra Piel tiene Memoria - JefiNews Abril 22 2026",2344,100,1,0.074983,4,48881,3450,189
monthly,2026-05-01,2026-05-31,664cs6FZEZo,UCUyDOdBWhC1MCxEjC46d-zw,Alex Hormozi,The Reason Why You Can't Is Why You Should,2331,33,1,0.028995,4,69908,1984,35
monthly,2026-05-01,2026-05-31,Xshu2lM5PZE,UCF0L4jd9LcSIxsj5gKITMqQ,Jaime Higuera,No compartas tus objetivos con la gente  #shorts,2294,292,5,0.11605,2,4789,571,5
monthly,2026-05-01,2026-05-31,5BbGrGFI2gQ,UCRDQzsHtx2cXvzEXnEhbxBg,Mister Krax,Se inaugura tren suburbano Buenavista-AIFA #trensuburbano #méxico,2256,309,3,0.172408,4,14231,2408,34
monthly,2026-05-01,2026-05-31,GfSGy5C1OIA,UCxFACDJ98idvo9Gq9M9AQgg,Moris Dieck | Finanzas e Inversiones ,¿Tener seguro hace que pagues más?,2246,60,0,0.048396,4,17310,818,8
monthly,2026-05-01,2026-05-31,-6t20SnbOyc,UCYZLVhSSwdBllvn4tw5a4uQ,Rob Paper Sheet,"Un buen clasista no es aquel que juzga, es que el describe la realidad.",2208,80,3,0.060146,4,74645,4252,221
monthly,2026-05-01,2026-05-31,Nq-c06vj5PM,UCxFACDJ98idvo9Gq9M9AQgg,Moris Dieck | Finanzas e Inversiones ,Médicos vs Aseguradoras ¿Por qué no te alcanza el seguro? | Dimes y Billetes #445,2204,44,5,0.035437,4,24775,748,115
monthly,2026-05-01,2026-05-31,Xy09nfcwZ3E,UC5mQQ4Ur6oA8lsGFkvH2lyg,Noche De Chicxs,Los factos van en la factoría #chisme #comedia #podcast,2175,61,0,0.038482,4,34315,1312,5
monthly,2026-05-01,2026-05-31,i6wL2IzuW7s,UCLYoURyGHMUuQ5YrfX55PWg,Aprendiz Financiero,Los Bancos no quieren que sepas ESTO #finanzas,2167,179,1,0.0906,2,8602,761,9
monthly,2026-05-01,2026-05-31,uWOLkr7S47A,UCUyDOdBWhC1MCxEjC46d-zw,Alex Hormozi,This Sales Tactic Is Underrated,2165,34,0,0.023475,4,75555,1764,5
monthly,2026-05-01,2026-05-31,3skIuC1lP00,UCOvzFyIAr32yspwxx77BHcQ,Rob Paper Clips,"Las mujeres tienen pepino… y están guangas, según esta fan del temach",2112,100,1,0.052847,4,13856,711,19
monthly,2026-05-01,2026-05-31,nOR-IY0SnEY,UCRDQzsHtx2cXvzEXnEhbxBg,Mister Krax,Los mexicanos saben sobrevivir #méxico #mrbeast,2101,167,16,0.065197,4,41085,2529,167
monthly,2026-05-01,2026-05-31,J9p4GMskefU,UC3IEYr87JpgBeVbbc0gP9DA,Irene Albacete,“La memoria colectiva” puede ser tu mayor obstáculo.,2092,191,7,0.094021,4,30786,2805,86
monthly,2026-05-01,2026-05-31,GEXxx3JQmdw,UCvPGx8qh8AkrFZW06tESvaA,Dot Dager,A NADIE LE IMPORTA #dev #programacion,2064,102,2,0.069612,3,7556,493,14
monthly,2026-05-01,2026-05-31,XzkJ2WrHR2c,UCF0L4jd9LcSIxsj5gKITMqQ,Jaime Higuera,No esperes que el mundo sea bueno contigo si no haces el bien #shorts,2054,96,2,0.062024,4,19190,1144,39
monthly,2026-05-01,2026-05-31,l1-D1s67YU4,UCP15FVAA2UL-QOcGhy7-ezA,EDteam,Anthropic perdió su liderazgo frente a OpenAI ¿cómo pasó? ,1995,51,3,0.047588,4,52513,2309,177
monthly,2026-05-01,2026-05-31,01NMf5-J_P4,UCUyDOdBWhC1MCxEjC46d-zw,Alex Hormozi,Don't Let Them Stop You,1968,65,0,0.043604,4,57247,2471,18
monthly,2026-05-01,2026-05-31,x0HFad-M2iE,UC30ajuhy8cViP2DiM1QLjmg,98grados,La gente no me creyó cuando les enseñé la optimización de la laptop #laptop #windows,1937,90,0,0.098238,4,23401,2240,34
monthly,2026-05-01,2026-05-31,CzIJ566XexE,UCyM-2pRapEv6V2q7UNO9icg,Emprende Aprendiendo,Por esto NO DEBES vender BARATO,1909,56,0,0.036626,4,11810,428,2
monthly,2026-05-01,2026-05-31,AVyYMXc_t9s,UCEK0oX3X2yK9y27khCsrNKg,Mis Propias Finanzas,"""Dinero Roto"" (Broken Money) de Lyn Alden | Club de Lectura #199",1878,56,3,0.065218,4,7765,446,35
monthly,2026-05-01,2026-05-31,I-rogofBX8c,UCUyDOdBWhC1MCxEjC46d-zw,Alex Hormozi,Work Beats Talent....,1824,41,0,0.037648,4,25506,948,7
monthly,2026-05-01,2026-05-31,S3JuEF7RQ5k,UC5PwIMtLiIBCBhsu8f_-6UQ,Santiago Bilinkis,¿El fin de los expertos?,1824,55,-2,0.02838,4,64038,1777,46
monthly,2026-05-01,2026-05-31,vMnp3ptycik,UCBBWpss2iXVXtTzl7-4eWbg,Jessica Fernández García,Escúchalo completo en Más Allá del Rosa en YouTube,1810,173,0,0.038129,2,3734,209,2
monthly,2026-05-01,2026-05-31,0ShXZN7aHqA,UCP15FVAA2UL-QOcGhy7-ezA,EDteam,¿Qué es exactamente una skill de IA?,1800,132,0,0.07578,4,7138,532,4
monthly,2026-05-01,2026-05-31,XV4eV0wnx-c,UCoOae5nYA7VqaXzerajD0lg,Ali Abdaal,The Identity Shift Effect,1784,65,0,0.037283,4,20598,757,9
monthly,2026-05-01,2026-05-31,L7fVqlOzegQ,UCs0QXHkbkBDM_NwnRiGFoTA,Crea Y Transforma,TRONÓ el Petrodólar! Petróleo en YUANES CHINOS! Deuda de 39 TRILLONES de USA,1758,48,3,0.050846,4,61308,2943,158
monthly,2026-05-01,2026-05-31,vd8fb3noIgY,UCF0L4jd9LcSIxsj5gKITMqQ,Jaime Higuera,Jaime Higuera no se equivocó cuando dijo esto #shorts,1739,80,2,0.081613,4,16964,1359,16
monthly,2026-05-01,2026-05-31,5ov8sBSV-pc,UCDnUOd6PIlQAL9bPUTf9BkQ,Sapiencia práctica,6 TRUCOS psicológicos para ENAMORAR a cualquiera,1731,77,5,0.082837,4,4971,372,14
monthly,2026-05-01,2026-05-31,u7sbQBw3X3g,UC5mQQ4Ur6oA8lsGFkvH2lyg,Noche De Chicxs,¡Tenía el pie roto! #chisme #comedia #podcast,1707,19,0,0.022272,4,22613,496,0
monthly,2026-05-01,2026-05-31,X9fGa-F_ars,UCPgVPrgqpALC1s2e63fgKyg,elWacky,Jugador Profesional Se Enoja y Lo Pierde Todo,1693,76,1,0.071446,4,158754,10866,454
monthly,2026-05-01,2026-05-31,yaBzATxyEYs,UCaVPhFg-Ax873wvhbNitsrQ,El Robot de Platón,La Gran Mentira del Helio - 3,1651,134,5,0.078181,4,41121,3097,118
monthly,2026-05-01,2026-05-31,2FFoc89SAj0,UCOD6LXgeBoeiUZTsPLdG-0g,Vida MRR - Programacion web,GitHub va a cambiar PARA SIEMPRE,1641,69,2,0.040055,4,4008,156,11
monthly,2026-05-01,2026-05-31,SK8tkpErsm8,UCF0L4jd9LcSIxsj5gKITMqQ,Jaime Higuera,No te hables mal a ti mismo #shorts,1627,57,1,0.056372,4,22143,1232,16
monthly,2026-05-01,2026-05-31,K38w2QlgHPQ,UC5PwIMtLiIBCBhsu8f_-6UQ,Santiago Bilinkis,¿Por qué tardás en responder cuando te hablan?,1615,64,2,0.058066,4,12615,705,25
monthly,2026-05-01,2026-05-31,lkM12v2VZyE,UCP15FVAA2UL-QOcGhy7-ezA,EDteam,¿Qué es Shadow AI y por qué es peligroso?,1606,65,1,0.032324,4,46872,1488,35
monthly,2026-05-01,2026-05-31,6AKlPLtjBR8,UC55-mxUj5Nj3niXFReG44OQ,Platzi,¿Fue Tim Cook un buen CEO?,1604,78,2,0.053527,4,15911,828,26
monthly,2026-05-01,2026-05-31,MSl5mD3E7PE,UC3IEYr87JpgBeVbbc0gP9DA,Irene Albacete,4 creencias que te mantienen pobre.,1594,105,3,0.094905,4,20865,1863,99
