grain,period_start,period_end,video_id,channel_id,channel_name,title,period_views_delta,period_likes_delta,period_comments_delta,period_avg_engagement_rate,period_snapshots,latest_views,latest_likes,latest_comments
monthly,2026-04-01,2026-04-30,DHk0gFHyHeE,UCl5-lvQyfILb-l2abPk4Ntg,Inteligencia Artificial,ChatGPT 5.5 es un cambio de era 🔥🚀,7616,140,4,0.033987,6,146459,4547,360
monthly,2026-04-01,2026-04-30,NuoEsHIW5JA,UCzR-rom72PHN9Zg7RML9EbA,PBS Eons,Why do mammals keep evolving into ant-eaters?,7460,173,4,0.041043,5,83871,3231,133
monthly,2026-04-01,2026-04-30,rXs8JlFIS-U,UCF0L4jd9LcSIxsj5gKITMqQ,Jaime Higuera,Me voló la cabeza cuando Jaime Higuera dijo esto #shorts,7448,354,4,0.055701,5,16972,898,15
monthly,2026-04-01,2026-04-30,DB1fSfulSJQ,UCUyDOdBWhC1MCxEjC46d-zw,Alex Hormozi,This Is What Wasted Potential Actually Looks Like,7429,238,1,0.042084,5,54578,2227,17
monthly,2026-04-01,2026-04-30,HVPhcOmSMtM,UCEK0oX3X2yK9y27khCsrNKg,Mis Propias Finanzas,La Verdad que Nadie te Dice sobre Cómo los Colombianos Están Gastando Su Dinero | VP de Mastercard,7418,209,58,0.054889,3,7697,229,59
monthly,2026-04-01,2026-04-30,CZe8DucT3qA,UCPgVPrgqpALC1s2e63fgKyg,elWacky,Actualización Repugnante,7342,402,16,0.076216,5,240981,17290,1003
monthly,2026-04-01,2026-04-30,dYJM9jmLBzY,UCPgVPrgqpALC1s2e63fgKyg,elWacky,No Lo Puedo Creer,7242,610,16,0.109607,5,160494,16720,791
monthly,2026-04-01,2026-04-30,0IGNbK4bbXA,UCHMSzZaVrEjK35aYK3J7Htw,Pequeño Cerdo Capitalista,Ideas de Negocio: Servicios para Mascotas 🐶 🐱 (Ignorados Pero MUY Rentables),7238,369,21,0.081731,5,12980,859,58
monthly,2026-04-01,2026-04-30,aqIgIWIc3uw,UCRDQzsHtx2cXvzEXnEhbxBg,Mister Krax,México empieza a tener matices de país desarrollado #méxico,7172,556,31,0.044643,2,13239,724,50
monthly,2026-04-01,2026-04-30,XzkJ2WrHR2c,UCF0L4jd9LcSIxsj5gKITMqQ,Jaime Higuera,No esperes que el mundo sea bueno contigo si no haces el bien #shorts,7146,328,14,0.067065,5,17136,1048,37
monthly,2026-04-01,2026-04-30,HEW0VJx9iw0,UCUyDOdBWhC1MCxEjC46d-zw,Alex Hormozi,Watch If You're Under $1M Year,7113,196,0,0.038187,5,52023,1939,14
monthly,2026-04-01,2026-04-30,ZjtJALByo70,UC55-mxUj5Nj3niXFReG44OQ,Platzi,¿Qué le dirías a la siguiente persona?,7066,448,7,0.052604,5,9098,546,9
monthly,2026-04-01,2026-04-30,K38w2QlgHPQ,UC5PwIMtLiIBCBhsu8f_-6UQ,Santiago Bilinkis,¿Por qué tardás en responder cuando te hablan?,7065,305,9,0.068594,5,11000,641,23
monthly,2026-04-01,2026-04-30,ERxzxl6fXbw,UCRDQzsHtx2cXvzEXnEhbxBg,Mister Krax,Un mundial para ricos? #mundial2026 #méxico,6962,392,7,0.071055,5,13923,927,19
monthly,2026-04-01,2026-04-30,Vd3Pkc0YGrM,UCF0L4jd9LcSIxsj5gKITMqQ,Jaime Higuera,Mira estos videos si quieres volverte rico #shorts,6956,291,1,0.034567,2,7592,309,1
monthly,2026-04-01,2026-04-30,lWQY5zccbQs,UCUyDOdBWhC1MCxEjC46d-zw,Alex Hormozi,Stick With The Pan,6947,222,7,0.04179,2,20197,771,36
monthly,2026-04-01,2026-04-30,Jr9Xm5f44NQ,UCPTlwyaEoJOVyvDLzHagzNQ,WATOP,China Abandonó A Millones De Vietnamitas A Su Suerte Arrebatándoles Lo Que Mantenía Viva A La Región,6933,328,5,0.079989,3,9718,614,11
monthly,2026-04-01,2026-04-30,nJ0oh5u6YbM,UCUyDOdBWhC1MCxEjC46d-zw,Alex Hormozi,Don't Even Think About Passive Income,6922,186,0,0.035706,5,110745,3896,26
monthly,2026-04-01,2026-04-30,tg0LuGGeOPA,UC1viRct91s1a3Z5yvk7FJXw,Diego Ruzzarin,¿Cómo van las cosas en Irán? Resumen noticias.,6807,234,6,0.062596,5,117395,7061,211
monthly,2026-04-01,2026-04-30,a8LrJMGoVL4,UCoXtmmnLCbXDiSo8GxsmOzA,La gata de Schrödinger,Tres libros imprescindibles para cambiar tu forma de ver el mundo,6791,509,16,0.07794,5,123771,9175,468
monthly,2026-04-01,2026-04-30,nZlhHf8vSbU,UCF0L4jd9LcSIxsj5gKITMqQ,Jaime Higuera,Por esto ser realista ha matado a nuestra generación #shorts,6709,747,6,0.083049,5,8170,819,8
monthly,2026-04-01,2026-04-30,3skIuC1lP00,UCOvzFyIAr32yspwxx77BHcQ,Rob Paper Clips,"Las mujeres tienen pepino… y están guangas, según esta fan del temach",6649,310,6,0.056598,5,11744,611,18
monthly,2026-04-01,2026-04-30,TLdMXZSABH8,UCP15FVAA2UL-QOcGhy7-ezA,EDteam,En vivo: ¿Qué es lo nuevo de Deepseek 4?,6545,327,9,0.052101,3,6545,332,9
monthly,2026-04-01,2026-04-30,51dULrDA8E8,UCDOSaJ0pnglwzfkR6fYbisA,Luis Mi Negocios,NINTENDO no nació como EMPRESA de videojuegos… ESTO PASÓ,6434,473,5,0.090252,3,11653,980,14
monthly,2026-04-01,2026-04-30,uvfU2B8b4G4,UCDOSaJ0pnglwzfkR6fYbisA,Luis Mi Negocios,¿Por qué ESPERAN años para SALIR a BOLSA?,6233,277,4,0.047747,5,43311,2044,17
monthly,2026-04-01,2026-04-30,664cs6FZEZo,UCUyDOdBWhC1MCxEjC46d-zw,Alex Hormozi,The Reason Why You Can't Is Why You Should,6163,134,1,0.029649,5,67577,1951,34
monthly,2026-04-01,2026-04-30,uHXjo7DUAAM,UCUyDOdBWhC1MCxEjC46d-zw,Alex Hormozi,Entrepreneurship Often Sucks,6158,284,3,0.066445,2,8363,454,5
monthly,2026-04-01,2026-04-30,lYpHv3Tg0Vg,UCjSVqRtdOsxQDss_pJpp_Yg,COMPUESTOS Podcast,¿Cómo Tener Buenas Ideas En YouTube? 💡 #Compuestos #AndresGarza #EloisaWolf #Ideas,6144,189,3,0.016958,5,14810,314,3
monthly,2026-04-01,2026-04-30,Xf_v62TQOx4,UCbfYPyITQ-7l4upoX8nvctg,Two Minute Papers,NVIDIA's New AI Broke My Brain,6023,195,17,0.052531,5,67346,3149,339
monthly,2026-04-01,2026-04-30,AVyYMXc_t9s,UCEK0oX3X2yK9y27khCsrNKg,Mis Propias Finanzas,"""Dinero Roto"" (Broken Money) de Lyn Alden | Club de Lectura #199",5887,383,32,0.098799,6,5887,390,32
monthly,2026-04-01,2026-04-30,OkuWh46I4m4,UCDOSaJ0pnglwzfkR6fYbisA,Luis Mi Negocios,5 pasos para MULTIPLICAR tu DINERO,5868,271,7,0.069083,5,14605,909,26
monthly,2026-04-01,2026-04-30,5ymn2oV1Zls,UCPgVPrgqpALC1s2e63fgKyg,elWacky,Al Parecer Sí Es Un Monstruo,5828,209,12,0.071856,5,302984,20554,1134
monthly,2026-04-01,2026-04-30,QSe13hyv68o,UCl5-lvQyfILb-l2abPk4Ntg,Inteligencia Artificial,🤖  Los sistemas de seguridad nuclear están diseñados para proteger la vida 🤖 #ia #chatgpt #nuclear,5790,69,3,0.016275,6,30636,469,17
monthly,2026-04-01,2026-04-30,0SSctcuOy0o,UCb8GKeOvI7WsFUkB4UVAeXA,Cordura Artificial,Mi nuevo lector de E-books #productividad #libros #lectura #tecnologia,5738,351,13,0.089747,5,17937,1467,60
monthly,2026-04-01,2026-04-30,kLJNcHqVmJA,UC9WGON3pXofvE958Uq3Lw3Q,Exito Financiero,Las 3 Metas Financieras Que Deberías Lograr,5677,269,16,0.075856,4,7684,454,22
monthly,2026-04-01,2026-04-30,wB2Kb0MiyAc,UC5mQQ4Ur6oA8lsGFkvH2lyg,Noche De Chicxs,¡Estafó a sus padres por años! #chisme #comedia #podcast,5671,72,0,0.019564,5,32821,613,6
monthly,2026-04-01,2026-04-30,QDZUOBnmf4Q,UCEQXxiYxNZbym9Fad7-n2Lg,Doctor Fisión,LA MATERIA OSCURA PODRÍA TENER DOS ESTADOS 🌌,5617,373,17,0.095657,5,36186,3272,109
monthly,2026-04-01,2026-04-30,lvw8Fe5wcBo,UCP15FVAA2UL-QOcGhy7-ezA,EDteam,"ChatGPT, Claude y Gemini están empatados, ninguno es mejor.",5516,135,8,0.041157,5,10209,360,22
monthly,2026-04-01,2026-04-30,7vdW8a6jEfw,UCUyDOdBWhC1MCxEjC46d-zw,Alex Hormozi,"""What Should I Price My Products?""",5479,141,0,0.032947,5,36886,1188,10
monthly,2026-04-01,2026-04-30,IQZiAOokKXo,UCUyDOdBWhC1MCxEjC46d-zw,Alex Hormozi,Here Is Why People Stop Buying From You,5472,102,1,0.027076,5,27145,707,3
monthly,2026-04-01,2026-04-30,6-PunI-5Ts4,UCEQXxiYxNZbym9Fad7-n2Lg,Doctor Fisión,DESCUBREN PARTÍCULAS QUE SALEN DIRECTAMENTE DEL VACÍO 🌌,5407,427,10,0.107021,5,26541,2680,86
monthly,2026-04-01,2026-04-30,LPTQADIf6Xk,UCaVPhFg-Ax873wvhbNitsrQ,El Robot de Platón,Tecnologías de las que NADIE Habla,5366,276,10,0.070881,5,120768,8023,491
monthly,2026-04-01,2026-04-30,z-7AhJ55htQ,UCJQQVLyM6wtPleV4wFBK06g,VisualPolitik,ESTADO DE ALERTA en COREA: IRÁN pone al país CONTRA LAS CUERDAS @VisualPolitik,5361,159,5,0.034943,5,404554,13257,866
monthly,2026-04-01,2026-04-30,1lx0bttCAbs,UCF0L4jd9LcSIxsj5gKITMqQ,Jaime Higuera,Estos suplementos te harán dormir en menos de 5 minutos #shorts,5312,243,5,0.052656,5,32725,1688,31
monthly,2026-04-01,2026-04-30,CzIJ566XexE,UCyM-2pRapEv6V2q7UNO9icg,Emprende Aprendiendo,Por esto NO DEBES vender BARATO,5279,175,2,0.039485,3,9901,372,2
monthly,2026-04-01,2026-04-30,pGGJHrxn1VU,UC5mQQ4Ur6oA8lsGFkvH2lyg,Noche De Chicxs,Me estafó un fantasma japonés #chisme #comedia #podcast,5275,140,0,0.02519,2,8970,231,0
monthly,2026-04-01,2026-04-30,yawQxLw0K08,UCF0L4jd9LcSIxsj5gKITMqQ,Jaime Higuera,Esta técnica es muy efectiva  #shorts,4883,452,1,0.078484,3,6019,524,4
monthly,2026-04-01,2026-04-30,0ShXZN7aHqA,UCP15FVAA2UL-QOcGhy7-ezA,EDteam,¿Qué es exactamente una skill de IA?,4870,370,3,0.069771,5,5338,400,4
monthly,2026-04-01,2026-04-30,L8_m7pOI2-A,UCOvzFyIAr32yspwxx77BHcQ,Rob Paper Clips,¿Los Fans del Temach son una SECTA?,4855,133,7,0.053641,5,82689,3949,424
monthly,2026-04-01,2026-04-30,IldLswg2yAM,UCxFACDJ98idvo9Gq9M9AQgg,Moris Dieck | Finanzas e Inversiones ,Bely y Beto: salí de la tele sin plan y sin dinero | Belinda Treviño | Dimes y Billetes #448,4855,163,22,0.054862,2,4883,165,22
monthly,2026-04-01,2026-04-30,Um1DSnUqmko,UCl5-lvQyfILb-l2abPk4Ntg,Inteligencia Artificial,👉🏻 Te dejo la Guía Pro de ChatGPT fijada en los comentarios de este video.,4762,110,0,0.025633,3,7943,194,1
monthly,2026-04-01,2026-04-30,iq599kyAjVA,UCOHxDwCcOzBaLkeTazanwcw,Bravos Research,The UNTHINKABLE is About to Happen to Stocks (Emergency Update),4742,61,0,0.027172,5,146165,3858,80
monthly,2026-04-01,2026-04-30,_O6ICkmg1Zg,UCyM-2pRapEv6V2q7UNO9icg,Emprende Aprendiendo,Cruzó ESTADOS UNIDOS con UN CENTAVO,4710,83,6,0.029528,5,9722,256,9
monthly,2026-04-01,2026-04-30,B18aH00d8oE,UCJQQVLyM6wtPleV4wFBK06g,VisualPolitik,El PENTÁGONO ya tiene un plan para CUBA:  ¿Intervención a la vista? @VisualPolitik,4691,127,6,0.046767,5,277322,12169,759
monthly,2026-04-01,2026-04-30,I-rogofBX8c,UCUyDOdBWhC1MCxEjC46d-zw,Alex Hormozi,Work Beats Talent....,4609,137,2,0.039512,5,23682,907,7
monthly,2026-04-01,2026-04-30,l1-D1s67YU4,UCP15FVAA2UL-QOcGhy7-ezA,EDteam,Anthropic perdió su liderazgo frente a OpenAI ¿cómo pasó? ,4589,147,6,0.048901,5,50518,2258,174
monthly,2026-04-01,2026-04-30,-6t20SnbOyc,UCYZLVhSSwdBllvn4tw5a4uQ,Rob Paper Sheet,"Un buen clasista no es aquel que juzga, es que el describe la realidad.",4584,167,6,0.061195,5,72437,4172,218
monthly,2026-04-01,2026-04-30,iS1jGgfO9Z0,UCl5-lvQyfILb-l2abPk4Ntg,Inteligencia Artificial,👉🏻 Te dejo el link de la Guía de NotbookLM fijado en los comentarios de este vídeo.,4576,310,4,0.067586,4,5146,346,5
monthly,2026-04-01,2026-04-30,nOR-IY0SnEY,UCRDQzsHtx2cXvzEXnEhbxBg,Mister Krax,Los mexicanos saben sobrevivir #méxico #mrbeast,4559,280,11,0.064009,5,38984,2362,151
monthly,2026-04-01,2026-04-30,TUSbI3pqiCM,UCRlBDnRQduDk4tmm1OtpSRg,UN POCO MEJOR,El ÚNICO Sistema de Dinero que Necesitas // Te Enseñaré a Ser Rico,4482,288,4,0.079234,5,15942,1201,25
monthly,2026-04-01,2026-04-30,-JTeDTLElVg,UC5mQQ4Ur6oA8lsGFkvH2lyg,Noche De Chicxs,Abandoné a mis trillizos #chisme #comedia #podcast,4405,174,0,0.035538,5,16879,603,3
monthly,2026-04-01,2026-04-30,Mxv60XerzG4,UCF0L4jd9LcSIxsj5gKITMqQ,Jaime Higuera,Me voló la cabeza cuando Jaime Higuera dijo esto #shorts,4388,361,9,0.062721,5,6522,456,15
monthly,2026-04-01,2026-04-30,k0ZYVWoVWAc,UCEK0oX3X2yK9y27khCsrNKg,Mis Propias Finanzas,¡S&P rebaja calificación de Colombia! ¿Qué significa esto para tu dinero?,4334,136,32,0.057973,6,18517,832,186
monthly,2026-04-01,2026-04-30,3QRWlCFdzyE,UCF0L4jd9LcSIxsj5gKITMqQ,Jaime Higuera,Me cambió la vida cuando Jaime Higuera dijo esto #shorts,4318,163,2,0.053027,5,15735,778,19
monthly,2026-04-01,2026-04-30,01NMf5-J_P4,UCUyDOdBWhC1MCxEjC46d-zw,Alex Hormozi,Don't Let Them Stop You,4292,193,1,0.043908,5,55279,2406,18
monthly,2026-04-01,2026-04-30,3W1KfxQnQiU,UCOxW1h1VV379Q8GDdUJOhgw,Mariano Trejo,30 Hábitos que (Silenciosamente) Cambiaron mi Vida para Siempre,4242,234,7,0.079892,6,7854,530,26
monthly,2026-04-01,2026-04-30,AMpe2jD0lZw,UCF0L4jd9LcSIxsj5gKITMqQ,Jaime Higuera,Por esto paré de leer un libro por semana #shorts,4216,330,1,0.060729,3,5098,366,2
monthly,2026-04-01,2026-04-30,S3JuEF7RQ5k,UC5PwIMtLiIBCBhsu8f_-6UQ,Santiago Bilinkis,¿El fin de los expertos?,4186,105,7,0.0285,5,62214,1722,48
monthly,2026-04-01,2026-04-30,oeymdn1d4qg,UCRDQzsHtx2cXvzEXnEhbxBg,Mister Krax,La situación en Argentina no mejora #argentina,4092,362,14,0.078081,5,7037,561,26
monthly,2026-04-01,2026-04-30,G9L3zK57X6Y,UCDOSaJ0pnglwzfkR6fYbisA,Luis Mi Negocios,El ERROR más PELIGROSO que COMETES sin saber,4015,232,3,0.054336,5,86289,4611,85
monthly,2026-04-01,2026-04-30,nLlqkXdlNsM,UCF0L4jd9LcSIxsj5gKITMqQ,Jaime Higuera,Así fue cuando me tuve que ir a Londres  #shorts,3988,105,0,0.047304,5,23166,1042,12
monthly,2026-04-01,2026-04-30,EZLeWRbCEbA,UCEK0oX3X2yK9y27khCsrNKg,Mis Propias Finanzas,El Método Exacto para Invertir en CTDs (Renta Fija) y Crear Patrimonio | Experto en Inversiones,3984,114,6,0.044029,6,34235,1394,81
monthly,2026-04-01,2026-04-30,AYIqxqyY-es,UCHMSzZaVrEjK35aYK3J7Htw,Pequeño Cerdo Capitalista,⚠️ ¡Cuidado! Tu fondo de vivienda corre PELIGRO 😨,3942,324,69,0.137194,3,4118,354,74
monthly,2026-04-01,2026-04-30,_BhjwaNE8mc,UCF0L4jd9LcSIxsj5gKITMqQ,Jaime Higuera,Ser rico es toda una estafa  #shorts,3937,453,8,0.108217,2,4809,540,10
monthly,2026-04-01,2026-04-30,5Z4z2oEoxw8,UCQIUhtP5WYIx_pMG8UvMYHg,Cristina Dayz ,"11,7 Cosas que son un DESPERDICIO de Dinero en 2026",3825,118,6,0.060018,5,27529,1527,74
monthly,2026-04-01,2026-04-30,RBz3O-4xBYE,UCF0L4jd9LcSIxsj5gKITMqQ,Jaime Higuera,Me voló la cabeza cuando Jaime Higuera dijo esto #shorts,3726,213,7,0.089964,5,14467,1220,31
monthly,2026-04-01,2026-04-30,9QKOkpu78CQ,UCV5G678sZwW5IcF3pCfRbHQ,La Hiperactina,Publi⭐️ ¿Por qué hay cosas que lees mil veces y no entiendes… y en vídeo sí? 📹🧬✨,3715,271,2,0.081171,5,95114,7582,127
monthly,2026-04-01,2026-04-30,X9fGa-F_ars,UCPgVPrgqpALC1s2e63fgKyg,elWacky,Jugador Profesional Se Enoja y Lo Pierde Todo,3696,135,0,0.071993,5,157061,10790,453
monthly,2026-04-01,2026-04-30,uWOLkr7S47A,UCUyDOdBWhC1MCxEjC46d-zw,Alex Hormozi,This Sales Tactic Is Underrated,3690,50,0,0.023957,5,73390,1730,5
monthly,2026-04-01,2026-04-30,NkWtrW-9GDY,UCX9NJ471o7Wie1DQe94RVIg,Fazt,3 Formas de Desplegar tu Proyecto Web que TODO Desarrollador Debe Conocer,3690,190,13,0.077565,5,5137,338,17
monthly,2026-04-01,2026-04-30,ckyeC880OPA,UC55-mxUj5Nj3niXFReG44OQ,Platzi,Comparamos el nuevo GPT Images 2.0 vs. Nano Banana 2 🤯,3592,36,0,0.037976,5,46012,1650,38
monthly,2026-04-01,2026-04-30,uAOfsghz2NY,UCl5-lvQyfILb-l2abPk4Ntg,Inteligencia Artificial,👉🏻 Te dejo la Guía Completa para convertirte en Slime fijada en los comentarios de este vídeo.,3543,16,1,0.008944,6,27705,227,12
monthly,2026-04-01,2026-04-30,1t2Yd_bmg_k,UCF0L4jd9LcSIxsj5gKITMqQ,Jaime Higuera,Me cambió la vida cuando Jaime Higuera dijo esto #shorts,3535,237,0,0.069353,3,5639,378,3
monthly,2026-04-01,2026-04-30,wJwQm_aqC8U,UCUyDOdBWhC1MCxEjC46d-zw,Alex Hormozi,Life Isn't Easy,3502,141,0,0.045369,5,25643,1142,7
monthly,2026-04-01,2026-04-30,DgX6SMZaC_8,UCEQXxiYxNZbym9Fad7-n2Lg,Doctor Fisión,UN PLANETA GIGANTE ORBITANDO UNA PEQUEÑA ESTRELLA 🛰️,3467,236,7,0.082459,5,46645,3757,65
monthly,2026-04-01,2026-04-30,jcfifYFAdpM,UCRDQzsHtx2cXvzEXnEhbxBg,Mister Krax,Ecatepec en la mira del desarrollo #ecatepec #méxico,3307,399,14,0.100735,2,4056,458,18
monthly,2026-04-01,2026-04-30,XV4eV0wnx-c,UCoOae5nYA7VqaXzerajD0lg,Ali Abdaal,The Identity Shift Effect,3296,85,0,0.038447,5,18814,692,9
monthly,2026-04-01,2026-04-30,AxM96v9ZCzI,UC36xmz34q02JYaZYKrMwXng,Nate Gentile,Dándole ojos a la IA 👁️🤖💻,3288,67,0,0.026601,5,64037,1678,12
monthly,2026-04-01,2026-04-30,NAooB35YkHA,UC3nwmvE2aDzUSJ4evQ1NhoA,IA Innova,OpenClaw 4.25: la VOZ por IA ACABA de CAMBIARLO TODO,3274,129,5,0.058386,3,4015,182,8
monthly,2026-04-01,2026-04-30,L7fVqlOzegQ,UCs0QXHkbkBDM_NwnRiGFoTA,Crea Y Transforma,TRONÓ el Petrodólar! Petróleo en YUANES CHINOS! Deuda de 39 TRILLONES de USA,3256,109,1,0.0517,5,59550,2895,155
monthly,2026-04-01,2026-04-30,-5kkpHpexIA,UC5mQQ4Ur6oA8lsGFkvH2lyg,Noche De Chicxs,Se ofendieron sin contexto #chisme #comedia #podcast,3239,43,0,0.021544,5,30675,643,4
monthly,2026-04-01,2026-04-30,UQXupr6-Wmg,UCUyDOdBWhC1MCxEjC46d-zw,Alex Hormozi,Helping A Stranger Scale Her $300K Year Business,3221,107,1,0.032113,5,65228,2074,19
monthly,2026-04-01,2026-04-30,gtdao7DVsBo,UCUyDOdBWhC1MCxEjC46d-zw,Alex Hormozi,You Have To Pick 1 Thing,3218,59,0,0.030893,5,27041,808,7
monthly,2026-04-01,2026-04-30,dINRvKoLQ-c,UCF0L4jd9LcSIxsj5gKITMqQ,Jaime Higuera,Me voló la cabeza cuando Jaime Higuera dijo esto #shorts,3188,146,5,0.055127,5,32597,1753,34
monthly,2026-04-01,2026-04-30,sncgYGQt1T8,UCl5-lvQyfILb-l2abPk4Ntg,Inteligencia Artificial,👉🏻 Te dejo el PROMPT para mejorar tu foto de perfil fijado en los comentarios de este vídeo,3181,126,1,0.046127,3,4900,204,9
monthly,2026-04-01,2026-04-30,pqIZk9qrBEM,UC30ajuhy8cViP2DiM1QLjmg,98grados,"La Mejor, Peor e Ideal. Rankeando GPU #pc #pcgamer #gpu",3172,186,14,0.076034,5,19419,1395,64
monthly,2026-04-01,2026-04-30,bouvNyq8xCY,UCX6b17PVsYBQ0ip5gyeme-Q,CrashCourse,Earth's Crust and Mantle Explained: Crash Course Geology #3,3132,121,0,0.07361,5,28321,1962,66
monthly,2026-04-01,2026-04-30,PCAPjDDY-h4,UC1viRct91s1a3Z5yvk7FJXw,Diego Ruzzarin,El Mitin de María Corina Machado y el muy cuestionable grito de Carlos Baute.,3102,141,16,0.083886,5,64520,4845,528
monthly,2026-04-01,2026-04-30,HyWpbCUdCr8,UCl5-lvQyfILb-l2abPk4Ntg,Inteligencia Artificial,👉🏻 Te dejo la Guía Pro de ChatGPT fijada en los comentarios de este video.,3049,109,2,0.046183,2,3400,127,3
monthly,2026-04-01,2026-04-30,v8z-clVwRxM,UC9WGON3pXofvE958Uq3Lw3Q,Exito Financiero,Lo Que No Te Dicen De La Subida De Tasas — CUIDADO ⚠️,3040,52,5,0.035553,5,31694,1008,96
monthly,2026-04-01,2026-04-30,AXvou3mSGQA,UC55-mxUj5Nj3niXFReG44OQ,Platzi,"OpenAI lanzó GPT 5.5, ya no necesitas prompts detallados.",3018,27,1,0.037058,5,31469,1075,42
monthly,2026-04-01,2026-04-30,xO5diVmgE8Y,UCM55RjebjSevVWPnj2LEymw,viyaura,i drew secret emojis...#art #artist,2980,112,8,0.076102,5,47235,3192,340
monthly,2026-04-01,2026-04-30,Nq-c06vj5PM,UCxFACDJ98idvo9Gq9M9AQgg,Moris Dieck | Finanzas e Inversiones ,Médicos vs Aseguradoras ¿Por qué no te alcanza el seguro? | Dimes y Billetes #445,2976,79,7,0.036677,5,22571,704,110
monthly,2026-04-01,2026-04-30,kkQDCTCcgC0,UC5mQQ4Ur6oA8lsGFkvH2lyg,Noche De Chicxs,Chisme express con Frida Araujo #chisme #comedia #podcast,2890,182,3,0.075668,3,3601,242,5
monthly,2026-04-01,2026-04-30,7Ocx3WwDK_c,UCxFACDJ98idvo9Gq9M9AQgg,Moris Dieck | Finanzas e Inversiones ,"""Mi mala relación con los números""",2830,104,5,0.051483,5,3900,171,6
monthly,2026-04-01,2026-04-30,0xTKuxdSrRI,UCF0L4jd9LcSIxsj5gKITMqQ,Jaime Higuera,Esta es la forma más rápida de leer a una persona #shorts,2803,119,2,0.039508,5,25902,1016,12
monthly,2026-04-01,2026-04-30,XoY4BiK1WW8,UCF0L4jd9LcSIxsj5gKITMqQ,Jaime Higuera,Tomar café al despertarte es un error   #shorts,2734,114,1,0.03937,3,4515,179,3
monthly,2026-04-01,2026-04-30,7m9uIc31Egw,UCEK0oX3X2yK9y27khCsrNKg,Mis Propias Finanzas,Las 3 Reglas que Necesitas Seguir para Vivir del Trading - Hyenuk Chu,2678,75,1,0.051033,6,5257,215,6
monthly,2026-04-01,2026-04-30,MSl5mD3E7PE,UC3IEYr87JpgBeVbbc0gP9DA,Irene Albacete,4 creencias que te mantienen pobre.,2678,162,5,0.098839,5,19271,1758,96
monthly,2026-04-01,2026-04-30,vrW0swCG3Kg,UCUyDOdBWhC1MCxEjC46d-zw,Alex Hormozi,Nobody Warns You About This Part Of Wanting Something Big,2664,81,0,0.055246,5,30843,1638,26
monthly,2026-04-01,2026-04-30,R1iBWKeX42I,UCP15FVAA2UL-QOcGhy7-ezA,EDteam,¿Cómo evitar que la IA te reemplace?,2637,157,1,0.096155,3,3778,291,5
monthly,2026-04-01,2026-04-30,EnLpF9i3I4I,UC9mrBfjgyOsqJ0J-zw7kZLQ,Atherion,querido desconocido…,2615,151,1,0.075239,5,5507,393,4
monthly,2026-04-01,2026-04-30,03uRM4Uz5t8,UCF0L4jd9LcSIxsj5gKITMqQ,Jaime Higuera,Por esto no creo en el amor eterno #shorts,2586,145,2,0.075062,5,18987,1363,37
monthly,2026-04-01,2026-04-30,SYdW3cZKdmY,UCl5-lvQyfILb-l2abPk4Ntg,Inteligencia Artificial,🤖 Los países nórdicos combinan con éxito la energía hidroeléctrica con la nuclear 🤖 #ia #chatgpt,2558,47,3,0.025684,6,11764,289,7
monthly,2026-04-01,2026-04-30,F4ZxeuNDoUw,UCRDQzsHtx2cXvzEXnEhbxBg,Mister Krax,¿Te gustó supernova Genesis? #supernovagenesis #mexico,2528,258,2,0.038238,5,11880,508,21
monthly,2026-04-01,2026-04-30,PfdNPN9Jv6s,UCF0L4jd9LcSIxsj5gKITMqQ,Jaime Higuera,Me voló la cabeza cuando Jaime Higuera dijo esto #shorts,2494,137,1,0.081715,5,18648,1476,17
monthly,2026-04-01,2026-04-30,61fk5yAs7Jw,UC5mQQ4Ur6oA8lsGFkvH2lyg,Noche De Chicxs,¡Episodio estreno con Frida Araujo! #chisme #comedia #podcast,2478,102,0,0.058129,3,3289,161,0
monthly,2026-04-01,2026-04-30,La4ogJrxI0g,UCTfQ65AxquXmih3r6rZmK-Q,jefillysh,"Neuronas jugando Doom, Mega Terremotos y Nuestra Piel tiene Memoria - JefiNews Abril 22 2026",2460,104,2,0.076945,5,46537,3350,188
monthly,2026-04-01,2026-04-30,FpwEaued1Hc,UCUyDOdBWhC1MCxEjC46d-zw,Alex Hormozi,What Your Passion Is Actually Covering Up,2427,108,0,0.050628,5,45477,2264,29
monthly,2026-04-01,2026-04-30,67JREKwyixk,UCl5-lvQyfILb-l2abPk4Ntg,Inteligencia Artificial,👉🏻 Te dejo la Guía Pro de ChatGPT fijada en los comentarios de este video.,2411,63,1,0.02878,3,4345,120,2
monthly,2026-04-01,2026-04-30,J9p4GMskefU,UC3IEYr87JpgBeVbbc0gP9DA,Irene Albacete,“La memoria colectiva” puede ser tu mayor obstáculo.,2353,214,8,0.093747,5,28694,2614,79
monthly,2026-04-01,2026-04-30,CF4oRpaLSqw,UCbUYAYd1WUznxEEl498z7vA,Woshingo Streams,lunes de whitexicanadas y ratones,2340,82,6,0.050002,4,6057,277,8
monthly,2026-04-01,2026-04-30,f1rK6WfCjCQ,UCoOae5nYA7VqaXzerajD0lg,Ali Abdaal,The biggest myth in business,2339,101,2,0.026772,5,35944,967,17
monthly,2026-04-01,2026-04-30,7A5KHuRU8BE,UCF0L4jd9LcSIxsj5gKITMqQ,Jaime Higuera,Empecé a dormir mejor con esta rutina #shorts,2330,123,3,0.055961,3,3101,165,7
monthly,2026-04-01,2026-04-30,IBBboS2nK3c,UCl5-lvQyfILb-l2abPk4Ntg,Inteligencia Artificial,👉🏻 Te dejo la Guía Pro de ChatGPT fijada en los comentarios de este video.,2300,79,2,0.035668,4,2740,90,3
monthly,2026-04-01,2026-04-30,oOLYgK6RqS4,UCP7PV59jal4PobLeo5cSG_Q,Santiago Amat,ARBITRAJE DOLAR CRIPTO-DOLAR CCL,2297,216,0,0.223454,3,3010,373,83
monthly,2026-04-01,2026-04-30,nxCFXdIgxmw,UCRDQzsHtx2cXvzEXnEhbxBg,Mister Krax,Solo tienes derecho a tener una casa #españa #notícias,2296,179,12,0.045849,5,9443,443,37
monthly,2026-04-01,2026-04-30,5ov8sBSV-pc,UCDnUOd6PIlQAL9bPUTf9BkQ,Sapiencia práctica,6 TRUCOS psicológicos para ENAMORAR a cualquiera,2266,154,5,0.113121,5,3240,295,9
monthly,2026-04-01,2026-04-30,u7sbQBw3X3g,UC5mQQ4Ur6oA8lsGFkvH2lyg,Noche De Chicxs,¡Tenía el pie roto! #chisme #comedia #podcast,2226,43,0,0.022985,5,20906,477,0
monthly,2026-04-01,2026-04-30,s47EWzAbZL4,UCUyDOdBWhC1MCxEjC46d-zw,Alex Hormozi,Don't Let It Affect You Twice,2225,40,0,0.025497,5,45918,1155,9
monthly,2026-04-01,2026-04-30,PQOKPfU-zIs,UCF0L4jd9LcSIxsj5gKITMqQ,Jaime Higuera,Enfócate únicamente en una cosa a la vez #shorts,2225,181,1,0.036749,3,3452,200,3
monthly,2026-04-01,2026-04-30,ys1zQyiLrMc,UC5mQQ4Ur6oA8lsGFkvH2lyg,Noche De Chicxs,¡Le tuve que mentir a mi mamá! #chisme #comedia #podcast,2208,94,2,0.045926,3,3242,144,2
monthly,2026-04-01,2026-04-30,Zu3g28TTetU,UC55-mxUj5Nj3niXFReG44OQ,Platzi,Startups de Silicon Valley dejan OpenAI por modelos chinos 😳,2202,119,5,0.052177,5,47992,2331,175
monthly,2026-04-01,2026-04-30,FOyH5MIRyD4,UCF0L4jd9LcSIxsj5gKITMqQ,Jaime Higuera,Me voló la cabeza cuando Jaime Higuera dijo esto #shorts,2185,73,0,0.058001,5,18302,1035,10
monthly,2026-04-01,2026-04-30,OkVrrVAG9yg,UCRDQzsHtx2cXvzEXnEhbxBg,Mister Krax,¿Es normal lo que pasa en México? ¿O nos quieren desestabilizar?,2169,87,17,0.096249,5,31309,2492,471
monthly,2026-04-01,2026-04-30,ieJE93iObcI,UCuhw3KIv3wM14By2-LcxDGw,El Consejero,Por qué las personas secretamente te odian (aún más de lo que imaginas) | Carl Jung,2168,96,6,0.089566,4,2731,172,9
monthly,2026-04-01,2026-04-30,fQK8Lx-oRIU,UCPTlwyaEoJOVyvDLzHagzNQ,WATOP,Australia Eliminó Toda Vida en Esta Línea en MEDIO de la Ciudad y Dejó a Todos en Shock,2143,52,2,0.047945,5,14802,653,30
monthly,2026-04-01,2026-04-30,5zwotvZ1rl0,UCxFACDJ98idvo9Gq9M9AQgg,Moris Dieck | Finanzas e Inversiones ,⁠Stablecoins: La revolución financiera | SHAPING THE FUTURE OF FINANCE | Dimes y Billetes #446,2104,41,4,0.028649,5,10953,272,35
monthly,2026-04-01,2026-04-30,ax0ogeQpq3E,UCBBWpss2iXVXtTzl7-4eWbg,Jessica Fernández García,Escúchalo completo en Más Allá del Rosa en YouTube,2046,39,1,0.049846,5,16944,784,18
monthly,2026-04-01,2026-04-30,6_o0OElprPo,UCOD6LXgeBoeiUZTsPLdG-0g,Vida MRR - Programacion web,GITHUB Copilot va a COBRAR por TOKEN...,1997,80,26,0.071919,5,2157,96,28
monthly,2026-04-01,2026-04-30,X5MyBjZ8Jgw,UCF0L4jd9LcSIxsj5gKITMqQ,Jaime Higuera,Me quedé pensando cuando Jaime Higuera dijo esto #shorts,1983,61,1,0.056463,5,23932,1317,11
monthly,2026-04-01,2026-04-30,DWt3zfqtI6g,UC2UXDak6o7rBm23k3Vv5dww,Tina Huang,Top 10 AI-Exposed Occupations,1927,45,0,0.032894,5,13260,419,8
monthly,2026-04-01,2026-04-30,yaBzATxyEYs,UCaVPhFg-Ax873wvhbNitsrQ,El Robot de Platón,La Gran Mentira del Helio - 3,1913,142,5,0.078019,5,39470,2963,113
monthly,2026-04-01,2026-04-30,XyFrfcsbDGY,UCPTlwyaEoJOVyvDLzHagzNQ,WATOP,"Japón Perforó Un Agujero En La Tierra Cerca De Un Volcán, y Esto Provocó Algo",1893,52,-1,0.043643,5,56769,2392,75
monthly,2026-04-01,2026-04-30,-tzJJPnAenI,UCjSVqRtdOsxQDss_pJpp_Yg,COMPUESTOS Podcast,¿Cuánto Gana Un Canal De YouTube en LATAM? 🎥 #Compuestos #AndresGarza #EloisaWolf #Dinero,1884,101,0,0.03155,5,2421,108,0
monthly,2026-04-01,2026-04-30,lkM12v2VZyE,UCP15FVAA2UL-QOcGhy7-ezA,EDteam,¿Qué es Shadow AI y por qué es peligroso?,1865,62,4,0.032133,5,45266,1423,34
monthly,2026-04-01,2026-04-30,MdYM6kw372Q,UCF0L4jd9LcSIxsj5gKITMqQ,Jaime Higuera,Este es el quinto cambio mental que necesitas hacer #shorts,1859,82,2,0.065455,5,16479,1048,18
