grain,period_start,period_end,video_id,channel_id,channel_name,title,period_views_delta,period_likes_delta,period_comments_delta,period_avg_engagement_rate,period_snapshots,latest_views,latest_likes,latest_comments
monthly,2026-04-01,2026-04-30,-6t20SnbOyc,UCYZLVhSSwdBllvn4tw5a4uQ,Rob Paper Sheet,"Un buen clasista no es aquel que juzga, es que el describe la realidad.",3492,122,5,0.061343,4,71345,4127,217
monthly,2026-04-01,2026-04-30,iS1jGgfO9Z0,UCl5-lvQyfILb-l2abPk4Ntg,Inteligencia Artificial,👉🏻 Te dejo el link de la Guía de NotbookLM fijado en los comentarios de este vídeo.,3453,231,4,0.067379,3,4023,267,5
monthly,2026-04-01,2026-04-30,QSe13hyv68o,UCl5-lvQyfILb-l2abPk4Ntg,Inteligencia Artificial,🤖  Los sistemas de seguridad nuclear están diseñados para proteger la vida 🤖 #ia #chatgpt #nuclear,3414,38,2,0.016357,5,28260,438,16
monthly,2026-04-01,2026-04-30,L8_m7pOI2-A,UCOvzFyIAr32yspwxx77BHcQ,Rob Paper Clips,¿Los Fans del Temach son una SECTA?,3409,94,4,0.05383,4,81243,3910,421
monthly,2026-04-01,2026-04-30,I-rogofBX8c,UCUyDOdBWhC1MCxEjC46d-zw,Alex Hormozi,Work Beats Talent....,3267,98,0,0.039742,4,22340,868,5
monthly,2026-04-01,2026-04-30,NkWtrW-9GDY,UCX9NJ471o7Wie1DQe94RVIg,Fazt,3 Formas de Desplegar tu Proyecto Web que TODO Desarrollador Debe Conocer,3172,158,10,0.07968,4,4619,306,14
monthly,2026-04-01,2026-04-30,k0ZYVWoVWAc,UCEK0oX3X2yK9y27khCsrNKg,Mis Propias Finanzas,¡S&P rebaja calificación de Colombia! ¿Qué significa esto para tu dinero?,3133,114,25,0.058572,5,17316,810,179
monthly,2026-04-01,2026-04-30,51dULrDA8E8,UCDOSaJ0pnglwzfkR6fYbisA,Luis Mi Negocios,NINTENDO no nació como EMPRESA de videojuegos… ESTO PASÓ,3131,205,2,0.092728,2,8350,712,11
monthly,2026-04-01,2026-04-30,oeymdn1d4qg,UCRDQzsHtx2cXvzEXnEhbxBg,Mister Krax,La situación en Argentina no mejora #argentina,2987,262,10,0.076747,4,5932,461,22
monthly,2026-04-01,2026-04-30,yawQxLw0K08,UCF0L4jd9LcSIxsj5gKITMqQ,Jaime Higuera,Esta técnica es muy efectiva  #shorts,2964,260,0,0.073864,2,4100,332,3
monthly,2026-04-01,2026-04-30,Mxv60XerzG4,UCF0L4jd9LcSIxsj5gKITMqQ,Jaime Higuera,Me voló la cabeza cuando Jaime Higuera dijo esto #shorts,2956,236,6,0.060346,4,5090,331,12
monthly,2026-04-01,2026-04-30,X9fGa-F_ars,UCPgVPrgqpALC1s2e63fgKyg,elWacky,Jugador Profesional Se Enoja y Lo Pierde Todo,2921,104,0,0.072095,4,156286,10759,453
monthly,2026-04-01,2026-04-30,TUSbI3pqiCM,UCRlBDnRQduDk4tmm1OtpSRg,UN POCO MEJOR,El ÚNICO Sistema de Dinero que Necesitas // Te Enseñaré a Ser Rico,2914,186,2,0.079816,4,14374,1099,23
monthly,2026-04-01,2026-04-30,3W1KfxQnQiU,UCOxW1h1VV379Q8GDdUJOhgw,Mariano Trejo,30 Hábitos que (Silenciosamente) Cambiaron mi Vida para Siempre,2899,169,5,0.081712,5,6511,465,24
monthly,2026-04-01,2026-04-30,uWOLkr7S47A,UCUyDOdBWhC1MCxEjC46d-zw,Alex Hormozi,This Sales Tactic Is Underrated,2873,45,0,0.024036,4,72573,1725,5
monthly,2026-04-01,2026-04-30,1lx0bttCAbs,UCF0L4jd9LcSIxsj5gKITMqQ,Jaime Higuera,Estos suplementos te harán dormir en menos de 5 minutos #shorts,2853,103,1,0.052687,4,30266,1548,27
monthly,2026-04-01,2026-04-30,5Z4z2oEoxw8,UCQIUhtP5WYIx_pMG8UvMYHg,Cristina Dayz ,"11,7 Cosas que son un DESPERDICIO de Dinero en 2026",2825,86,3,0.060484,4,26529,1495,71
monthly,2026-04-01,2026-04-30,nLlqkXdlNsM,UCF0L4jd9LcSIxsj5gKITMqQ,Jaime Higuera,Así fue cuando me tuve que ir a Londres  #shorts,2733,75,0,0.047756,4,21911,1012,12
monthly,2026-04-01,2026-04-30,RBz3O-4xBYE,UCF0L4jd9LcSIxsj5gKITMqQ,Jaime Higuera,Me voló la cabeza cuando Jaime Higuera dijo esto #shorts,2728,142,5,0.090837,4,13469,1149,29
monthly,2026-04-01,2026-04-30,dINRvKoLQ-c,UCF0L4jd9LcSIxsj5gKITMqQ,Jaime Higuera,Me voló la cabeza cuando Jaime Higuera dijo esto #shorts,2623,127,3,0.055203,4,32032,1734,32
monthly,2026-04-01,2026-04-30,pqIZk9qrBEM,UC30ajuhy8cViP2DiM1QLjmg,98grados,"La Mejor, Peor e Ideal. Rankeando GPU #pc #pcgamer #gpu",2594,160,14,0.07626,4,18841,1369,64
monthly,2026-04-01,2026-04-30,7Ocx3WwDK_c,UCxFACDJ98idvo9Gq9M9AQgg,Moris Dieck | Finanzas e Inversiones ,"""Mi mala relación con los números""",2591,100,5,0.053007,4,3661,167,6
monthly,2026-04-01,2026-04-30,EZLeWRbCEbA,UCEK0oX3X2yK9y27khCsrNKg,Mis Propias Finanzas,El Método Exacto para Invertir en CTDs (Renta Fija) y Crear Patrimonio | Experto en Inversiones,2569,73,2,0.044218,5,32820,1353,77
monthly,2026-04-01,2026-04-30,9QKOkpu78CQ,UCV5G678sZwW5IcF3pCfRbHQ,La Hiperactina,Publi⭐️ ¿Por qué hay cosas que lees mil veces y no entiendes… y en vídeo sí? 📹🧬✨,2539,189,1,0.081201,4,93938,7500,126
monthly,2026-04-01,2026-04-30,3QRWlCFdzyE,UCF0L4jd9LcSIxsj5gKITMqQ,Jaime Higuera,Me cambió la vida cuando Jaime Higuera dijo esto #shorts,2528,103,0,0.053621,4,13945,718,17
monthly,2026-04-01,2026-04-30,S3JuEF7RQ5k,UC5PwIMtLiIBCBhsu8f_-6UQ,Santiago Bilinkis,¿El fin de los expertos?,2517,63,4,0.028513,4,60545,1680,45
monthly,2026-04-01,2026-04-30,wJwQm_aqC8U,UCUyDOdBWhC1MCxEjC46d-zw,Alex Hormozi,Life Isn't Easy,2509,111,0,0.045509,4,24650,1112,7
monthly,2026-04-01,2026-04-30,XV4eV0wnx-c,UCoOae5nYA7VqaXzerajD0lg,Ali Abdaal,The Identity Shift Effect,2435,70,0,0.038744,4,17953,677,9
monthly,2026-04-01,2026-04-30,G9L3zK57X6Y,UCDOSaJ0pnglwzfkR6fYbisA,Luis Mi Negocios,El ERROR más PELIGROSO que COMETES sin saber,2421,141,3,0.054314,4,84695,4520,85
monthly,2026-04-01,2026-04-30,DgX6SMZaC_8,UCEQXxiYxNZbym9Fad7-n2Lg,Doctor Fisión,UN PLANETA GIGANTE ORBITANDO UNA PEQUEÑA ESTRELLA 🛰️,2383,161,7,0.082589,4,45561,3682,65
monthly,2026-04-01,2026-04-30,Rvy2kXZpBtM,UCs0QXHkbkBDM_NwnRiGFoTA,Crea Y Transforma,50 Datos Sorprendentes de la Ciudad de Miami,2374,93,2,0.093021,2,2798,147,4
monthly,2026-04-01,2026-04-30,L7fVqlOzegQ,UCs0QXHkbkBDM_NwnRiGFoTA,Crea Y Transforma,TRONÓ el Petrodólar! Petróleo en YUANES CHINOS! Deuda de 39 TRILLONES de USA,2365,82,2,0.05182,4,58659,2868,156
monthly,2026-04-01,2026-04-30,PCAPjDDY-h4,UC1viRct91s1a3Z5yvk7FJXw,Diego Ruzzarin,El Mitin de María Corina Machado y el muy cuestionable grito de Carlos Baute.,2362,99,15,0.084038,4,63780,4803,527
monthly,2026-04-01,2026-04-30,v8z-clVwRxM,UC9WGON3pXofvE958Uq3Lw3Q,Exito Financiero,Subió La Rentabilidad En Cuentas Y CDTs — OJO Con Esto 👀,2287,39,2,0.035733,4,30941,995,93
monthly,2026-04-01,2026-04-30,-5kkpHpexIA,UC5mQQ4Ur6oA8lsGFkvH2lyg,Noche De Chicxs,Se ofendieron sin contexto #chisme #comedia #podcast,2281,35,0,0.021657,4,29717,635,4
monthly,2026-04-01,2026-04-30,AYIqxqyY-es,UCHMSzZaVrEjK35aYK3J7Htw,Pequeño Cerdo Capitalista,⚠️ ¡Cuidado! Tu fondo de vivienda corre PELIGRO 😨,2260,187,43,0.153824,2,2436,217,48
monthly,2026-04-01,2026-04-30,UQXupr6-Wmg,UCUyDOdBWhC1MCxEjC46d-zw,Alex Hormozi,Helping A Stranger Scale Her $300K Year Business,2256,77,1,0.032119,4,64263,2044,19
monthly,2026-04-01,2026-04-30,EnLpF9i3I4I,UC9mrBfjgyOsqJ0J-zw7kZLQ,Atherion,querido desconocido…,2248,127,1,0.076026,4,5140,369,4
monthly,2026-04-01,2026-04-30,uAOfsghz2NY,UCl5-lvQyfILb-l2abPk4Ntg,Inteligencia Artificial,👉🏻 Te dejo la Guía Completa para convertirte en Slime fijada en los comentarios de este vídeo.,2220,8,0,0.009007,5,26382,219,11
monthly,2026-04-01,2026-04-30,AxM96v9ZCzI,UC36xmz34q02JYaZYKrMwXng,Nate Gentile,Dándole ojos a la IA 👁️🤖💻,2145,47,0,0.026654,4,62894,1658,12
monthly,2026-04-01,2026-04-30,Um1DSnUqmko,UCl5-lvQyfILb-l2abPk4Ntg,Inteligencia Artificial,👉🏻 Te dejo la Guía Pro de ChatGPT fijada en los comentarios de este video.,2126,51,0,0.026174,2,5307,135,1
monthly,2026-04-01,2026-04-30,AMpe2jD0lZw,UCF0L4jd9LcSIxsj5gKITMqQ,Jaime Higuera,Por esto paré de leer un libro por semana #shorts,2101,165,1,0.055001,2,2983,201,2
monthly,2026-04-01,2026-04-30,SYdW3cZKdmY,UCl5-lvQyfILb-l2abPk4Ntg,Inteligencia Artificial,🤖 Los países nórdicos combinan con éxito la energía hidroeléctrica con la nuclear 🤖 #ia #chatgpt,2093,34,3,0.025788,5,11299,276,7
monthly,2026-04-01,2026-04-30,F4ZxeuNDoUw,UCRDQzsHtx2cXvzEXnEhbxBg,Mister Krax,¿Te gustó supernova Genesis? #supernovagenesis #mexico,2087,221,2,0.036665,4,11439,471,21
monthly,2026-04-01,2026-04-30,gtdao7DVsBo,UCUyDOdBWhC1MCxEjC46d-zw,Alex Hormozi,You Have To Pick 1 Thing,2082,32,0,0.031082,4,25905,781,7
monthly,2026-04-01,2026-04-30,bouvNyq8xCY,UCX6b17PVsYBQ0ip5gyeme-Q,CrashCourse,Earth's Crust and Mantle Explained: Crash Course Geology #3,2045,71,0,0.07411,4,27234,1912,66
monthly,2026-04-01,2026-04-30,ckyeC880OPA,UC55-mxUj5Nj3niXFReG44OQ,Platzi,Comparamos el nuevo GPT Images 2.0 vs. Nano Banana 2 🤯,1969,18,0,0.038298,4,44389,1632,38
monthly,2026-04-01,2026-04-30,FpwEaued1Hc,UCUyDOdBWhC1MCxEjC46d-zw,Alex Hormozi,What Your Passion Is Actually Covering Up,1963,92,0,0.050679,4,45013,2248,29
monthly,2026-04-01,2026-04-30,NAooB35YkHA,UC3nwmvE2aDzUSJ4evQ1NhoA,IA Innova,OpenClaw 4.25: la VOZ por IA ACABA de CAMBIARLO TODO,1957,84,1,0.063917,2,2698,137,4
monthly,2026-04-01,2026-04-30,xO5diVmgE8Y,UCM55RjebjSevVWPnj2LEymw,viyaura,i drew secret emojis...#art #artist,1931,78,5,0.076434,4,46186,3158,337
monthly,2026-04-01,2026-04-30,CF4oRpaLSqw,UCbUYAYd1WUznxEEl498z7vA,Woshingo Streams,lunes de whitexicanadas y ratones,1926,73,6,0.050985,3,5643,268,8
monthly,2026-04-01,2026-04-30,PfdNPN9Jv6s,UCF0L4jd9LcSIxsj5gKITMqQ,Jaime Higuera,Me voló la cabeza cuando Jaime Higuera dijo esto #shorts,1906,103,1,0.082128,4,18060,1442,17
monthly,2026-04-01,2026-04-30,FOyH5MIRyD4,UCF0L4jd9LcSIxsj5gKITMqQ,Jaime Higuera,Me voló la cabeza cuando Jaime Higuera dijo esto #shorts,1887,56,0,0.058227,4,18004,1018,10
monthly,2026-04-01,2026-04-30,0xTKuxdSrRI,UCF0L4jd9LcSIxsj5gKITMqQ,Jaime Higuera,Esta es la forma más rápida de leer a una persona #shorts,1887,80,2,0.039463,4,24986,977,12
monthly,2026-04-01,2026-04-30,6_o0OElprPo,UCOD6LXgeBoeiUZTsPLdG-0g,Vida MRR - Programacion web,GITHUB Copilot va a COBRAR por TOKEN...,1874,79,26,0.075526,4,2034,95,28
monthly,2026-04-01,2026-04-30,MSl5mD3E7PE,UC3IEYr87JpgBeVbbc0gP9DA,Irene Albacete,4 creencias que te mantienen pobre.,1869,119,3,0.099497,4,18462,1715,94
monthly,2026-04-01,2026-04-30,Nq-c06vj5PM,UCxFACDJ98idvo9Gq9M9AQgg,Moris Dieck | Finanzas e Inversiones ,Médicos vs Aseguradoras ¿Por qué no te alcanza el seguro? | Dimes y Billetes #445,1868,50,6,0.036831,4,21463,675,109
monthly,2026-04-01,2026-04-30,7A5KHuRU8BE,UCF0L4jd9LcSIxsj5gKITMqQ,Jaime Higuera,Empecé a dormir mejor con esta rutina #shorts,1807,88,2,0.056208,2,2578,130,6
monthly,2026-04-01,2026-04-30,fKtG9uPeMCc,UCdfnfXWCGkBAx2cN2l-4u2w,Semo Historia,Esto podría salvar a Ciudad de México,1799,174,21,0.208756,2,2513,329,55
monthly,2026-04-01,2026-04-30,nxCFXdIgxmw,UCRDQzsHtx2cXvzEXnEhbxBg,Mister Krax,Solo tienes derecho a tener una casa #españa #notícias,1780,138,11,0.044603,4,8927,402,36
monthly,2026-04-01,2026-04-30,f1rK6WfCjCQ,UCoOae5nYA7VqaXzerajD0lg,Ali Abdaal,The biggest myth in business,1772,76,2,0.026622,4,35377,942,17
monthly,2026-04-01,2026-04-30,01NMf5-J_P4,UCUyDOdBWhC1MCxEjC46d-zw,Alex Hormozi,Don't Let Them Stop You,1754,94,1,0.043922,4,52741,2307,18
monthly,2026-04-01,2026-04-30,XoY4BiK1WW8,UCF0L4jd9LcSIxsj5gKITMqQ,Jaime Higuera,Tomar café al despertarte es un error   #shorts,1753,75,0,0.0389,2,3534,140,2
monthly,2026-04-01,2026-04-30,03uRM4Uz5t8,UCF0L4jd9LcSIxsj5gKITMqQ,Jaime Higuera,Por esto no creo en el amor eterno #shorts,1742,103,1,0.075393,4,18143,1321,36
monthly,2026-04-01,2026-04-30,ieJE93iObcI,UCuhw3KIv3wM14By2-LcxDGw,El Consejero,Por qué las personas secretamente te odian (aún más de lo que imaginas) | Carl Jung,1675,82,6,0.097329,3,2238,158,9
monthly,2026-04-01,2026-04-30,J9p4GMskefU,UC3IEYr87JpgBeVbbc0gP9DA,Irene Albacete,“La memoria colectiva” puede ser tu mayor obstáculo.,1656,146,7,0.09372,4,27997,2546,78
monthly,2026-04-01,2026-04-30,5ov8sBSV-pc,UCDnUOd6PIlQAL9bPUTf9BkQ,Sapiencia práctica,6 TRUCOS psicológicos para ENAMORAR a cualquiera,1651,121,3,0.117944,4,2625,262,7
monthly,2026-04-01,2026-04-30,vrW0swCG3Kg,UCUyDOdBWhC1MCxEjC46d-zw,Alex Hormozi,Nobody Warns You About This Part Of Wanting Something Big,1649,58,0,0.05557,4,29828,1615,26
monthly,2026-04-01,2026-04-30,X5MyBjZ8Jgw,UCF0L4jd9LcSIxsj5gKITMqQ,Jaime Higuera,Me quedé pensando cuando Jaime Higuera dijo esto #shorts,1644,49,0,0.056706,4,23593,1305,10
monthly,2026-04-01,2026-04-30,R1iBWKeX42I,UCP15FVAA2UL-QOcGhy7-ezA,EDteam,¿Cómo evitar que la IA te reemplace?,1629,108,1,0.105058,2,2770,242,5
monthly,2026-04-01,2026-04-30,La4ogJrxI0g,UCTfQ65AxquXmih3r6rZmK-Q,jefillysh,"Neuronas jugando Doom, Mega Terremotos y Nuestra Piel tiene Memoria - JefiNews Abril 22 2026",1626,63,2,0.077174,4,45703,3309,188
monthly,2026-04-01,2026-04-30,AXvou3mSGQA,UC55-mxUj5Nj3niXFReG44OQ,Platzi,"OpenAI lanzó GPT 5.5, ya no necesitas prompts detallados.",1613,13,0,0.037449,4,30064,1061,41
monthly,2026-04-01,2026-04-30,kkQDCTCcgC0,UC5mQQ4Ur6oA8lsGFkvH2lyg,Noche De Chicxs,Chisme express con Frida Araujo #chisme #comedia #podcast,1592,99,3,0.079206,2,2303,159,5
monthly,2026-04-01,2026-04-30,XyFrfcsbDGY,UCPTlwyaEoJOVyvDLzHagzNQ,WATOP,"Japón Perforó Un Agujero En La Tierra Cerca De Un Volcán, y Esto Provocó Algo",1591,38,-1,0.04369,4,56467,2378,75
monthly,2026-04-01,2026-04-30,OkVrrVAG9yg,UCRDQzsHtx2cXvzEXnEhbxBg,Mister Krax,¿Es normal lo que pasa en México? ¿O nos quieren desestabilizar?,1588,63,12,0.096652,4,30728,2468,466
monthly,2026-04-01,2026-04-30,fQK8Lx-oRIU,UCPTlwyaEoJOVyvDLzHagzNQ,WATOP,Australia Eliminó Toda Vida en Esta Línea en MEDIO de la Ciudad y Dejó a Todos en Shock,1568,39,2,0.048395,4,14227,640,30
monthly,2026-04-01,2026-04-30,1t2Yd_bmg_k,UCF0L4jd9LcSIxsj5gKITMqQ,Jaime Higuera,Me cambió la vida cuando Jaime Higuera dijo esto #shorts,1560,120,0,0.070247,2,3664,261,3
monthly,2026-04-01,2026-04-30,Zu3g28TTetU,UC55-mxUj5Nj3niXFReG44OQ,Platzi,Startups de Silicon Valley dejan OpenAI por modelos chinos 😳,1523,87,3,0.052167,4,47313,2299,173
monthly,2026-04-01,2026-04-30,s47EWzAbZL4,UCUyDOdBWhC1MCxEjC46d-zw,Alex Hormozi,Don't Let It Affect You Twice,1496,24,0,0.025533,4,45189,1139,9
monthly,2026-04-01,2026-04-30,DWt3zfqtI6g,UC2UXDak6o7rBm23k3Vv5dww,Tina Huang,Top 10 AI-Exposed Occupations,1496,35,0,0.033067,4,12829,409,8
monthly,2026-04-01,2026-04-30,u7sbQBw3X3g,UC5mQQ4Ur6oA8lsGFkvH2lyg,Noche De Chicxs,¡Tenía el pie roto! #chisme #comedia #podcast,1490,27,0,0.023028,4,20170,461,0
monthly,2026-04-01,2026-04-30,MdYM6kw372Q,UCF0L4jd9LcSIxsj5gKITMqQ,Jaime Higuera,Este es el quinto cambio mental que necesitas hacer #shorts,1453,59,1,0.065647,4,16073,1025,17
monthly,2026-04-01,2026-04-30,7m9uIc31Egw,UCEK0oX3X2yK9y27khCsrNKg,Mis Propias Finanzas,Las 3 Reglas que Necesitas Seguir para Vivir del Trading - Hyenuk Chu,1449,44,0,0.052832,5,4028,184,5
monthly,2026-04-01,2026-04-30,5zwotvZ1rl0,UCxFACDJ98idvo9Gq9M9AQgg,Moris Dieck | Finanzas e Inversiones ,⁠Stablecoins: La revolución financiera | SHAPING THE FUTURE OF FINANCE | Dimes y Billetes #446,1420,27,3,0.028804,4,10269,258,34
monthly,2026-04-01,2026-04-30,IBBboS2nK3c,UCl5-lvQyfILb-l2abPk4Ntg,Inteligencia Artificial,👉🏻 Te dejo la Guía Pro de ChatGPT fijada en los comentarios de este video.,1406,63,0,0.036244,3,1846,74,1
monthly,2026-04-01,2026-04-30,u03PlL13QDw,UCjSVqRtdOsxQDss_pJpp_Yg,COMPUESTOS Podcast,La Estructura De Un Buen Video De YouTube📏 #Compuestos #AndresGarza #EloisaWolf #YouTube,1378,18,0,0.013933,4,3239,44,0
monthly,2026-04-01,2026-04-30,sncgYGQt1T8,UCl5-lvQyfILb-l2abPk4Ntg,Inteligencia Artificial,👉🏻 Te dejo el PROMPT para mejorar tu foto de perfil fijado en los comentarios de este vídeo,1378,52,1,0.047456,2,3097,130,9
monthly,2026-04-01,2026-04-30,aFvAFWzCwF8,UCF0L4jd9LcSIxsj5gKITMqQ,Jaime Higuera,Algunas personas llegan a tu vida por esta razón #shorts,1342,76,3,0.066347,4,22189,1430,38
monthly,2026-04-01,2026-04-30,fHes8kAGJHs,UCUyDOdBWhC1MCxEjC46d-zw,Alex Hormozi,Working Hard Isn't Enough,1341,33,1,0.042382,4,38133,1592,12
monthly,2026-04-01,2026-04-30,oOLYgK6RqS4,UCP7PV59jal4PobLeo5cSG_Q,Santiago Amat,ARBITRAJE DOLAR CRIPTO-DOLAR CCL,1339,124,10,0.259434,2,2052,281,93
monthly,2026-04-01,2026-04-30,_BHe9R7pYNw,UCQIUhtP5WYIx_pMG8UvMYHg,Cristina Dayz ,Por qué la clase media es cada vez más POBRE,1301,77,7,0.080102,4,6831,505,34
monthly,2026-04-01,2026-04-30,UacKz43AiDQ,UCHMSzZaVrEjK35aYK3J7Htw,Pequeño Cerdo Capitalista,Lo que separa a los negocios exitosos de los que fracasan | Sofía Contreras,1292,34,0,0.031447,4,1661,47,0
monthly,2026-04-01,2026-04-30,VREVC0wXPfs,UChhw6DlKKTQ9mYSpTfXUYqA,Starter Story,This idea validation formula has made him $500K from iOS apps,1283,34,0,0.027329,4,24147,656,3
monthly,2026-04-01,2026-04-30,lkM12v2VZyE,UCP15FVAA2UL-QOcGhy7-ezA,EDteam,¿Qué es Shadow AI y por qué es peligroso?,1279,39,3,0.032119,4,44680,1400,33
monthly,2026-04-01,2026-04-30,raie7EtagZk,UCxFACDJ98idvo9Gq9M9AQgg,Moris Dieck | Finanzas e Inversiones ,¿Qué está encareciendo los seguros médicos?,1262,27,0,0.099107,4,9899,931,8
monthly,2026-04-01,2026-04-30,kp1dLUox9_Y,UCxFACDJ98idvo9Gq9M9AQgg,Moris Dieck | Finanzas e Inversiones ,¿Qué esta haciendo el IMSS?,1212,54,2,0.045506,4,20120,890,27
monthly,2026-04-01,2026-04-30,-tzJJPnAenI,UCjSVqRtdOsxQDss_pJpp_Yg,COMPUESTOS Podcast,¿Cuánto Gana Un Canal De YouTube en LATAM? 🎥 #Compuestos #AndresGarza #EloisaWolf #Dinero,1197,62,0,0.028285,4,1734,69,0
monthly,2026-04-01,2026-04-30,PQOKPfU-zIs,UCF0L4jd9LcSIxsj5gKITMqQ,Jaime Higuera,Enfócate únicamente en una cosa a la vez #shorts,1191,61,1,0.02572,2,2418,80,3
monthly,2026-04-01,2026-04-30,94PJFiyaSrs,UCyJbb85EUgWjl38GcF236Jg,Eva Maria Beristain,Renovaciones por el mundial,1175,37,3,0.061261,4,35515,2027,135
monthly,2026-04-01,2026-04-30,9361MUAmA24,UCLYoURyGHMUuQ5YrfX55PWg,Aprendiz Financiero,Haz ESTO para gestionar BIEN tu tiempo,1172,71,1,0.076029,4,13457,1003,10
monthly,2026-04-01,2026-04-30,MX1a5garnwc,UC9WGON3pXofvE958Uq3Lw3Q,Exito Financiero,Cómo INVERTIR Con El Salario MÍNIMO,1164,58,8,0.086466,4,6981,499,87
monthly,2026-04-01,2026-04-30,tveRHTJJyy8,UCUyDOdBWhC1MCxEjC46d-zw,Alex Hormozi,This Is What's Actually Been Stopping You,1145,35,0,0.03696,4,21078,771,5
monthly,2026-04-01,2026-04-30,7u0DJM1SNPs,UCxFACDJ98idvo9Gq9M9AQgg,Moris Dieck | Finanzas e Inversiones ,“No salgo si no me pagan”,1143,3,0,0.018209,4,19716,344,7
monthly,2026-04-01,2026-04-30,SY53rwqE2i0,UCaVPhFg-Ax873wvhbNitsrQ,El Robot de Platón,¡Atención Perú! 🇵🇪,1129,33,2,0.056197,4,24871,1319,65
monthly,2026-04-01,2026-04-30,1a5xOhqvm-I,UCoOae5nYA7VqaXzerajD0lg,Ali Abdaal,The Minimum $2K Pricing Effect,1129,19,0,0.033766,4,11836,375,13
monthly,2026-04-01,2026-04-30,sPHe-L95K0o,UCP7PV59jal4PobLeo5cSG_Q,Santiago Amat,Estrategia Gaps Tesla,1128,20,-1,0.035475,4,1410,25,10
monthly,2026-04-01,2026-04-30,TSAh8dzN0cw,UCl5-lvQyfILb-l2abPk4Ntg,Inteligencia Artificial,👉🏻 Te dejo la Guía Pro de ChatGPT fijada en los comentarios de este video.,1107,20,0,0.023453,5,10481,240,3
monthly,2026-04-01,2026-04-30,61fk5yAs7Jw,UC5mQQ4Ur6oA8lsGFkvH2lyg,Noche De Chicxs,¡Episodio estreno con Frida Araujo! #chisme #comedia #podcast,1106,42,0,0.062718,2,1917,101,0
monthly,2026-04-01,2026-04-30,yaBzATxyEYs,UCaVPhFg-Ax873wvhbNitsrQ,El Robot de Platón,La Gran Mentira del Helio - 3,1094,84,5,0.078041,4,38651,2905,113
monthly,2026-04-01,2026-04-30,jjSaUeqJi4s,UCX9NJ471o7Wie1DQe94RVIg,Fazt,Probé Claude Design: la nueva IA de Anthropic para crear interfaces,1072,16,0,0.031101,4,16428,469,33
monthly,2026-04-01,2026-04-30,-Ap6qWvqk0I,UCF7UoUGGOUcSSNcVDndq7KQ,Itzcalli,"SI ERES MUJER, TU BELLEZA ES UNA MONEDA DE CAMBIO: Barbie y los Diarios de una boticaria",1058,107,3,0.148892,4,18074,2522,143
monthly,2026-04-01,2026-04-30,1gyuiKoSc-w,UCjSVqRtdOsxQDss_pJpp_Yg,COMPUESTOS Podcast,Bárbara Tijerina: Cómo Detectar Mentiras y Leer a Cualquier Persona en Segundos | EP. #65,1045,74,4,0.09221,4,1057,75,4
monthly,2026-04-01,2026-04-30,ZB9IMq0ee0k,UCl5-lvQyfILb-l2abPk4Ntg,Inteligencia Artificial,OpenAI revienta a Nano Banana 🔥🤯,1042,28,2,0.047252,5,64949,2880,176
monthly,2026-04-01,2026-04-30,67JREKwyixk,UCl5-lvQyfILb-l2abPk4Ntg,Inteligencia Artificial,👉🏻 Te dejo la Guía Pro de ChatGPT fijada en los comentarios de este video.,1037,26,0,0.029131,2,2971,83,1
monthly,2026-04-01,2026-04-30,HOwVuamQvTc,UCEK0oX3X2yK9y27khCsrNKg,Mis Propias Finanzas,Esta es la historia del edificio que fue el más alto de LATAM durante muchos años,1034,66,0,0.054193,5,4969,268,9
monthly,2026-04-01,2026-04-30,EvauKuWaNmk,UCl5-lvQyfILb-l2abPk4Ntg,Inteligencia Artificial,Mis Agentes OpenClaw están empezando a putearse entre ellos 😡,1033,31,1,0.051576,5,59241,2776,266
monthly,2026-04-01,2026-04-30,gS87TtB9nk4,UCUyDOdBWhC1MCxEjC46d-zw,Alex Hormozi,This Changed How I Do Business,921,19,0,0.02123,4,107525,2263,22
monthly,2026-04-01,2026-04-30,_QHAqfILwPk,UCBBWpss2iXVXtTzl7-4eWbg,Jessica Fernández García,Escúchalo completo en Más Allá del Rosa en YouTube,901,28,0,0.030069,3,2280,67,1
monthly,2026-04-01,2026-04-30,evVs-Jtor50,UCqcbQf6yw5KzRoDDcZ_wBSw,Wes Roth,OpenAI just WON...,890,16,6,0.034576,4,58254,1718,293
monthly,2026-04-01,2026-04-30,2FdfXwODkr4,UCyM-2pRapEv6V2q7UNO9icg,Emprende Aprendiendo,El hombre que compró su empresa por 1 dólar,873,18,0,0.023629,4,25119,584,10
monthly,2026-04-01,2026-04-30,8MhnMHlXk7Q,UCRDQzsHtx2cXvzEXnEhbxBg,Mister Krax,Atacan al presidente Trump #notícias,856,66,4,0.073385,4,4962,335,31
monthly,2026-04-01,2026-04-30,e7IyFScAa-Q,UC9WGON3pXofvE958Uq3Lw3Q,Exito Financiero,Los 5 NIVELES De La LIBERTAD FINANCIERA,850,19,0,0.04722,4,14236,617,46
monthly,2026-04-01,2026-04-30,CZtseHx5dAM,UCUyDOdBWhC1MCxEjC46d-zw,Alex Hormozi,You Just Need To Pick One...,846,19,0,0.033939,4,32404,1085,11
monthly,2026-04-01,2026-04-30,F1D4G7VTBnY,UCxFACDJ98idvo9Gq9M9AQgg,Moris Dieck | Finanzas e Inversiones ,¿Qué te separa de los demás?,844,43,0,0.043799,4,3780,167,1
monthly,2026-04-01,2026-04-30,G-i7hiu_yPU,UCrr-NczCJHrwi1oBS97uwnw,Finanzas con Gus,El Imperio Más Poderoso del Mundo Está Empezando a Romperse,831,52,10,0.10377,4,7286,667,78
monthly,2026-04-01,2026-04-30,f7fbvRa4eJE,UCUyDOdBWhC1MCxEjC46d-zw,Alex Hormozi,Why Your Competition Is Already Ahead And You Don't See It,817,18,0,0.029419,4,26289,759,11
monthly,2026-04-01,2026-04-30,jq7ocNZXg_s,UCUyDOdBWhC1MCxEjC46d-zw,Alex Hormozi,This Is Your Lonely Chapter,811,45,2,0.106066,4,24642,2552,43
monthly,2026-04-01,2026-04-30,TAJkbsNrZuM,UCEK0oX3X2yK9y27khCsrNKg,Mis Propias Finanzas,¿Para dónde va el mercado?,798,44,42,0.109023,2,798,45,42
monthly,2026-04-01,2026-04-30,N14hiQw7Wdk,UCiqJoWIT-vm-hJoXilFGiUQ,Inversión Inteligente - Alain Cortés,¡La Sofipo con MEJOR TASA de interés! Hasta el 12.25% ANUAL | Leva: Alternativas Económicas,796,30,12,0.133509,4,971,60,21
monthly,2026-04-01,2026-04-30,4RmcHqjzw-A,UCOQEA3qmyzFmJdi6Z137yrA,Monitor fantasma,Sobre las elecciones en Perú y una reflexión sobre la democracia,792,45,14,0.116818,4,11518,1025,304
monthly,2026-04-01,2026-04-30,ax0ogeQpq3E,UCBBWpss2iXVXtTzl7-4eWbg,Jessica Fernández García,Escúchalo completo en Más Allá del Rosa en YouTube,770,16,0,0.050474,4,15668,761,17
monthly,2026-04-01,2026-04-30,qCFEWA_Nu3k,UCl5-lvQyfILb-l2abPk4Ntg,Inteligencia Artificial,🤖 Es necesario instalar más potencia para suplir a los nuevos consumidores 🤖 #ia #chatgpt #energía,760,5,0,0.019769,5,24233,464,9
monthly,2026-04-01,2026-04-30,xUWqMdypNsM,UC5PwIMtLiIBCBhsu8f_-6UQ,Santiago Bilinkis,Por qué no podés parar de comer (y no es tu culpa),760,29,2,0.060568,4,12868,744,27
monthly,2026-04-01,2026-04-30,wR8P970sqH8,UCUyDOdBWhC1MCxEjC46d-zw,Alex Hormozi,There Are Only Two Reasons People Feel Hopeless,759,22,0,0.039856,4,24988,982,9
monthly,2026-04-01,2026-04-30,Wj8owIKaQKQ,UCUyDOdBWhC1MCxEjC46d-zw,Alex Hormozi,Who Should You Blame?,759,18,0,0.052636,4,31447,1631,15
monthly,2026-04-01,2026-04-30,0moz0GJcIHg,UCUyDOdBWhC1MCxEjC46d-zw,Alex Hormozi,Which Would You Rather Be?,753,17,0,0.037835,4,27244,1010,14
monthly,2026-04-01,2026-04-30,MK-6-YuFzC4,UCdNnEDbRWhanA1O8zhCn3ZA,Omar - Educación Financiera,La CUENTA que más paga en abril 2026,742,17,1,0.06207,4,13715,755,83
monthly,2026-04-01,2026-04-30,uZ6Nbwp8GtU,UCX9NJ471o7Wie1DQe94RVIg,Fazt,Convierte Diseños de Figma en Código Automáticamente (MCP Tutorial),734,38,0,0.051723,4,9941,501,15
monthly,2026-04-01,2026-04-30,8mnzaIML2AM,UCF0L4jd9LcSIxsj5gKITMqQ,Jaime Higuera,Los millonarios no quieren que conozcas este modelo de negocio  #shorts,732,78,1,0.05877,2,2167,147,2
monthly,2026-04-01,2026-04-30,W1js1spTUPs,UCWn_0MmgojB711LFX-jaCDQ,El Rincón Del Dev,Así puedes crear tus MVP en un día 👀 #desarrolloweb #programacion #programador,730,20,1,0.02214,4,2309,53,1
monthly,2026-04-01,2026-04-30,pS5AOr4B7hg,UCWn_0MmgojB711LFX-jaCDQ,El Rincón Del Dev,"Deja de escribir, simplemente habla 👀🎙️ #desarrolloweb #programacion",722,34,0,0.055832,2,1950,104,1
monthly,2026-04-01,2026-04-30,BYv6i1MhiRA,UCjSVqRtdOsxQDss_pJpp_Yg,COMPUESTOS Podcast,¿El Algoritmo No Te Apoya? 🤖 #Compuestos #AndresGarza #EloisaWolf #Algoritmo,693,7,0,0.009254,4,1383,14,0
monthly,2026-04-01,2026-04-30,VvBy9AkhR2w,UCBBWpss2iXVXtTzl7-4eWbg,Jessica Fernández García,Escúchalo completo en Más Allá del Rosa en YouTube,662,15,0,0.037746,4,4868,176,3
monthly,2026-04-01,2026-04-30,Xq-4lUaLIp8,UCl5-lvQyfILb-l2abPk4Ntg,Inteligencia Artificial,🤖 Fuentes de energía que no salen la salud ni el ambiente 🤖 #ia #chatgpt #energía,642,5,0,0.025891,5,7289,178,4
monthly,2026-04-01,2026-04-30,-wkZoxeFIpM,UCEQXxiYxNZbym9Fad7-n2Lg,Doctor Fisión,Los Mayores Errores Científicos de la Historia - Domingo de Ciencia 225,630,15,0,0.09095,4,4011,337,9
monthly,2026-04-01,2026-04-30,PMX-urJB7uw,UCF0L4jd9LcSIxsj5gKITMqQ,Jaime Higuera,Esta es la idea de ingreso pasivo  #shorts,622,73,0,0.087465,4,2598,227,6
monthly,2026-04-01,2026-04-30,UN6X2Jj-qrQ,UCLYoURyGHMUuQ5YrfX55PWg,Aprendiz Financiero,Si siempre estás ocupado pero no avanzas… mira ESTO,604,36,0,0.086464,4,8273,703,2
