grain,period_start,period_end,video_id,channel_id,channel_name,title,period_views_delta,period_likes_delta,period_comments_delta,period_avg_engagement_rate,period_snapshots,latest_views,latest_likes,latest_comments
monthly,2026-04-01,2026-04-30,DSRfs1qKWR0,UCQHX6ViZmPsWiYSFAyS0a3Q,GothamChess,Big news,18715,381,26,0.034175,4,412814,13117,871
monthly,2026-04-01,2026-04-30,_twN29IEQlc,UC7MkZfrLCeE4Xwh9h2QnN0A,Arcade's Books,"La DECADENCIA de la CRÍTICA LITERARIA 🐍 ¿Crítica, adulación o ""hate""? | Arcade's Books",18705,1743,144,0.159431,4,20540,2186,185
monthly,2026-04-01,2026-04-30,SZ8r5VKtGes,UC1viRct91s1a3Z5yvk7FJXw,Diego Ruzzarin,La crisis Argentina impulsa el consumo de carne de burro.,18644,1186,94,0.077868,4,342149,24854,1746
monthly,2026-04-01,2026-04-30,WEnvorobhEE,UC1yNl2E66ZzKApQdRuTQ4tw,Sabine Hossenfelder,FBI investigates suspicious disappearances of scientists tied to classified research,18624,598,141,0.061075,4,677061,33099,8070
monthly,2026-04-01,2026-04-30,jIj6PuMrDGA,UCF0L4jd9LcSIxsj5gKITMqQ,Jaime Higuera,Nunca haría esto #shorts,18138,1514,14,0.097977,4,22157,1940,20
monthly,2026-04-01,2026-04-30,8QsAx7s9PmQ,UCQHX6ViZmPsWiYSFAyS0a3Q,GothamChess,Please stop,17996,213,2,0.026442,4,1246085,32379,446
monthly,2026-04-01,2026-04-30,ZhRgnBzcYHQ,UCvzk_MwdXD6jQa4Se-6B9ZQ,Adrià Solà Pastor,Cómo Ganar Dinero Por Internet (De Verdad) En 2026? Curso Completo Con Resultados Garantizados,17843,1100,15,0.096161,4,25449,1970,71
monthly,2026-04-01,2026-04-30,_9bYQ2tvc_s,UCV5cU7ORoUCCAT79kSrOJmg,Ricardo Alcaraz,La Peor Disculpa que he visto,17691,824,20,0.080698,4,213121,16370,550
monthly,2026-04-01,2026-04-30,Ff0AYRWrnGY,UC1yNl2E66ZzKApQdRuTQ4tw,Sabine Hossenfelder,The Truth About China’s Green Energy Industry,17417,861,146,0.079399,4,181440,11646,2582
monthly,2026-04-01,2026-04-30,g_7mUw6Xt2E,UCoXtmmnLCbXDiSo8GxsmOzA,La gata de Schrödinger,Sorpresa mundial: la homeopatía no funciona.,16808,608,54,0.05617,4,128933,6496,632
monthly,2026-04-01,2026-04-30,dhbt8y_LXQY,UCWBWgCD4oAqT3hUeq40SCUw,Sambucha,I Tested Dead Places At Their Busiest Hour,16689,709,8,0.051339,4,472131,23837,333
monthly,2026-04-01,2026-04-30,6WqWhSmCbXk,UCvzk_MwdXD6jQa4Se-6B9ZQ,Adrià Solà Pastor,"Experto En Lujo: Las Estrategias Para Luxurizar Tu Vida, Ser Más Deseado Y Ganar Mucho Dinero",16632,492,23,0.044743,4,73762,3017,150
monthly,2026-04-01,2026-04-30,vTXoE7BLv9s,UC1viRct91s1a3Z5yvk7FJXw,Diego Ruzzarin,El aterrador manifiesto de Palantir. #diegoruzzarin #noticias,16354,1375,49,0.092964,4,246697,22214,685
monthly,2026-04-01,2026-04-30,n1G2FQ0UEqc,UC5PwIMtLiIBCBhsu8f_-6UQ,Santiago Bilinkis,Por qué saber usar IA ya no es opcional.,16283,541,27,0.048211,2,26540,1075,48
monthly,2026-04-01,2026-04-30,Y9HJ_U3TdXk,UCUyDOdBWhC1MCxEjC46d-zw,Alex Hormozi,Stop Making Yourself Too Available For Everyone,16182,546,3,0.038486,4,140585,5342,28
monthly,2026-04-01,2026-04-30,_dASAu79K0s,UCUyDOdBWhC1MCxEjC46d-zw,Alex Hormozi,"Use  ""But"" The Right Way",16057,899,36,0.08213,3,19819,1297,42
monthly,2026-04-01,2026-04-30,h9kh7KssnMc,UCPTlwyaEoJOVyvDLzHagzNQ,WATOP,China Encontró Algo Inexplicable en Esta Montaña de África y Ahora se lo Lleva Rápido,16020,312,6,0.023802,4,93128,2128,59
monthly,2026-04-01,2026-04-30,0VjrLsr61pk,UC55-mxUj5Nj3niXFReG44OQ,Platzi,El futuro de Apple después de Tim Cook,15403,331,13,0.041996,4,124861,4770,319
monthly,2026-04-01,2026-04-30,x0HFad-M2iE,UC30ajuhy8cViP2DiM1QLjmg,98grados,La gente no me creyó cuando les enseñé la optimización de la laptop #laptop #windows,15218,1556,23,0.07912,4,15830,1581,24
monthly,2026-04-01,2026-04-30,8Uk97zU2GCg,UC1viRct91s1a3Z5yvk7FJXw,Diego Ruzzarin,Argentina: pesadilla libertaria. (Milei se supera cada día),15127,529,53,0.059736,4,230820,12165,1474
monthly,2026-04-01,2026-04-30,YPboGQjMxNY,UCQHX6ViZmPsWiYSFAyS0a3Q,GothamChess,Gotham vs PRODIGY,15038,209,3,0.025798,4,268371,6695,134
monthly,2026-04-01,2026-04-30,wnoSOSgBNHk,UC3nwmvE2aDzUSJ4evQ1NhoA,IA Innova,¡La NUEVA “Simula” de Google es INCREÍBLE!,14787,694,14,0.059606,4,17864,921,26
monthly,2026-04-01,2026-04-30,bFO0uAMPx1g,UCqcbQf6yw5KzRoDDcZ_wBSw,Wes Roth,Hermes Agent is INSANE...,14783,291,34,0.034089,4,50082,1379,233
monthly,2026-04-01,2026-04-30,5tW7CPAVii0,UCUyDOdBWhC1MCxEjC46d-zw,Alex Hormozi,This Is What Billionaire Are Doing.....,14468,402,3,0.029164,4,209024,5952,131
monthly,2026-04-01,2026-04-30,yzajLZXh9JU,UCbfYPyITQ-7l4upoX8nvctg,Two Minute Papers,Solved: The Bug That Haunted AI Video For Years,14459,658,55,0.08674,2,26527,1767,162
monthly,2026-04-01,2026-04-30,ND9eyW5Fw0s,UCSIvk78tK2TiviLQn4fSHaw,Up and Atom,Could a TRILLION Monkeys Write Shakespeare Before the Universe Ends?,14077,1755,393,0.228678,2,15346,2060,460
monthly,2026-04-01,2026-04-30,sjbKZ4CY1Ow,UCFBpVaKCC0ajGps1vf0AgBg,Humphrey Yang,"How Much You Need for $100 Per Month in Dividends with the following stocks: KO, AAPL, T",13922,179,23,0.018236,5,108261,1834,113
monthly,2026-04-01,2026-04-30,Cd5EHfRerGI,UC52kszkc08-acFOuogFl5jw,Tibees,The physics slop that YouTube wants me to make,13702,806,65,0.087172,4,201846,15375,2051
monthly,2026-04-01,2026-04-30,q1l42BPzbIk,UC4mg-nKTVI9CWodPPqB5d3A,Luna Martínez ,MALLWORLD: TODOS SOÑAMOS LO MISMO..😴👁️ | Luna Martínez ,13609,873,86,0.105907,4,96561,8753,1250
monthly,2026-04-01,2026-04-30,cnCEUFzWspI,UCUyDOdBWhC1MCxEjC46d-zw,Alex Hormozi,Just Pick Up The Phone And Start,13430,383,23,0.036033,3,28011,937,26
monthly,2026-04-01,2026-04-30,cdOcjUyQr8A,UCGq-a57w-aPwyi3pW7XLiHw,The Diary Of A CEO,TRAUMA TRIANGLE SHAPES WHO YOU ARE AS AN ADULT,13334,295,4,0.044211,4,187961,8001,171
monthly,2026-04-01,2026-04-30,OuOIrxBXB0M,UCUyDOdBWhC1MCxEjC46d-zw,Alex Hormozi,How I Filter Feedback,12919,230,0,0.022623,4,114998,2557,17
monthly,2026-04-01,2026-04-30,ABoKfabPQyY,UCUyDOdBWhC1MCxEjC46d-zw,Alex Hormozi,Why Can't You Just Do More?,12801,245,3,0.021603,4,211051,4496,44
monthly,2026-04-01,2026-04-30,F1gM7N-WXdU,UCQHX6ViZmPsWiYSFAyS0a3Q,GothamChess,Intermediate Chess Masterclass: 1300 to 2000 Elo,12497,277,14,0.039038,4,354054,12806,925
monthly,2026-04-01,2026-04-30,6XxQMeqG1P4,UCX9NJ471o7Wie1DQe94RVIg,Fazt,"El Fin de las Suscripciones Baratas de IA (Copilot, Claude y más)",12276,474,72,0.081926,2,15082,720,128
monthly,2026-04-01,2026-04-30,VVfMO6SJZLw,UCdNnEDbRWhanA1O8zhCn3ZA,Omar - Educación Financiera,"Gané $800,000+ en la bolsa de valores. ¿Cuánto pagué de impuestos?",12205,610,67,0.074681,3,20007,1190,130
monthly,2026-04-01,2026-04-30,XX7hskkX1AA,UC1viRct91s1a3Z5yvk7FJXw,Diego Ruzzarin,El imperio en decadencia: El capricho de Trump costeado por el pueblo de U.S.A.,12121,312,13,0.048888,4,84476,3888,123
monthly,2026-04-01,2026-04-30,myMj_ZfZ_xI,UCUyDOdBWhC1MCxEjC46d-zw,Alex Hormozi,How To Pick The Right Market,12059,228,0,0.026799,4,34764,877,7
monthly,2026-04-01,2026-04-30,XfY_L8MLOsU,UCWBWgCD4oAqT3hUeq40SCUw,Sambucha,How Much Money Does It Take To Empty A Claw Machine?,12006,480,6,0.045881,4,367746,16600,243
monthly,2026-04-01,2026-04-30,DQiQ30VepbU,UCP15FVAA2UL-QOcGhy7-ezA,EDteam,¿Qué hizo OpenAI para vencer a Anthropic?,11584,351,41,0.058201,4,16214,704,66
monthly,2026-04-01,2026-04-30,pVXm6lt1F7w,UCF0L4jd9LcSIxsj5gKITMqQ,Jaime Higuera,Este es el tiempo más peligroso #shorts,11575,1211,8,0.103115,4,13769,1421,12
monthly,2026-04-01,2026-04-30,UgfrzicHc80,UC5mQQ4Ur6oA8lsGFkvH2lyg,Noche De Chicxs,¡Tiene Un Fetiche Con Su Hermana! 😱 Ft. @leal_stephany y @lozano_gf - T10E04 #podcast #chismes,11571,269,10,0.035684,4,181297,5749,657
monthly,2026-04-01,2026-04-30,gPmmDEGCQLg,UC52hytXteCKmuOzMViTK8_w,CdeCiencia,Por qué hacer Alioli es casi imposible,11176,783,11,0.091334,4,270803,24180,446
monthly,2026-04-01,2026-04-30,p5zWy46yWxU,UCUyDOdBWhC1MCxEjC46d-zw,Alex Hormozi,Here's How I'd Get To $1M/Month,11115,182,2,0.02082,4,57410,1165,15
monthly,2026-04-01,2026-04-30,zj0BKLv9r8Y,UC4jlzJyMNQkkcEcCN3EFG7g,Brin,"Cuando el ""RARITO DE LA ESCUELA"" se cansa del bullying",11005,266,35,0.055127,4,76028,3541,486
monthly,2026-04-01,2026-04-30,GmTuhpMe1oM,UC52hytXteCKmuOzMViTK8_w,CdeCiencia,La ballena explosiva,11002,559,2,0.064548,4,158698,10096,82
monthly,2026-04-01,2026-04-30,rfnB9MhBI44,UCbdSYaPD-lr1kW27UJuk8Pw,QuantumFracture,Se Cumplen 40 años del Accidente de Chernobyl,10815,687,1,0.07276,4,157307,11164,232
monthly,2026-04-01,2026-04-30,ZOPXzlpBVoM,UCPgVPrgqpALC1s2e63fgKyg,elWacky,Comenzó,10455,462,21,0.07269,4,106726,7041,579
monthly,2026-04-01,2026-04-30,XXZ2wOom1l0,UCVt4ugq2txl_szlXAO7B3-g,Adrián Sáenz,Curso Completo De Claude Code: Cómo Crear y Vender Apps,10169,390,9,0.054118,4,73947,3808,118
monthly,2026-04-01,2026-04-30,rk2b7fH_Gcc,UCZRsSEs1OX74qBh0x5T22tg,EL CACHONDO,MIL MANERAS DE M0RIR EN ARGENTINA #5,10054,611,22,0.103474,4,35724,3301,185
monthly,2026-04-01,2026-04-30,sj1y9FDJKCM,UCJkMlOu7faDgqh4PfzbpLdg,Nerdwriter1,The Film That Attacks You,9986,519,20,0.074371,2,32770,2174,143
monthly,2026-04-01,2026-04-30,x3P8Zqux4A4,UCUyDOdBWhC1MCxEjC46d-zw,Alex Hormozi,"If You Feel Like You're Behind, Watch This.",9926,344,2,0.042538,4,47675,1981,12
monthly,2026-04-01,2026-04-30,Cs1nC8kqS5k,UC1viRct91s1a3Z5yvk7FJXw,Diego Ruzzarin,Polémica en el Mitin de María Corina Machado.,9882,420,22,0.079663,4,42298,2938,264
monthly,2026-04-01,2026-04-30,IwjPma4PPTM,UCVt4ugq2txl_szlXAO7B3-g,Adrián Sáenz,Pruebo La Nueva IA De Google Para Ganar Dinero,9666,444,13,0.061811,4,62263,3668,105
monthly,2026-04-01,2026-04-30,vd8fb3noIgY,UCF0L4jd9LcSIxsj5gKITMqQ,Jaime Higuera,Jaime Higuera no se equivocó cuando dijo esto #shorts,9150,886,9,0.082677,4,10268,943,11
monthly,2026-04-01,2026-04-30,UWRxdKxuOb8,UCF0L4jd9LcSIxsj5gKITMqQ,Jaime Higuera,Me voló la cabeza cuando Jaime Higuera dijo esto #shorts,8986,692,9,0.081072,3,9988,770,14
monthly,2026-04-01,2026-04-30,-IhdnUzV64Y,UCb8GKeOvI7WsFUkB4UVAeXA,Cordura Artificial,La Simple TÉCNICA que convierte a la gente en NPC,8960,449,31,0.075399,4,163346,11352,881
monthly,2026-04-01,2026-04-30,6AKlPLtjBR8,UC55-mxUj5Nj3niXFReG44OQ,Platzi,¿Fue Tim Cook un buen CEO?,8902,374,10,0.066856,4,12665,693,22
monthly,2026-04-01,2026-04-30,yIUDe9YH0ac,UCUyDOdBWhC1MCxEjC46d-zw,Alex Hormozi,Dating As An  Entrepreneur,8869,218,3,0.028152,4,192757,5317,95
monthly,2026-04-01,2026-04-30,EXOQ7vN2NXk,UC4FHiPgS1KXkUMx3dxBUtPg,HolaMundo,"Para programar, ¿cual modelo es mejor?",8781,331,27,0.058079,4,17400,847,83
monthly,2026-04-01,2026-04-30,rhVEOqNhjKo,UCUyDOdBWhC1MCxEjC46d-zw,Alex Hormozi,People WANT To Buy...,8766,199,5,0.033304,4,26468,830,16
monthly,2026-04-01,2026-04-30,UkbeRKmr5kM,UCjSVqRtdOsxQDss_pJpp_Yg,COMPUESTOS Podcast,¿Se Puede Vivir De YouTube? 📹 #Compuestos #AndresGarza #EloisaWolf #YouTube,8746,56,2,0.012497,4,54601,650,12
monthly,2026-04-01,2026-04-30,NM-bwZZoX80,UCbUYAYd1WUznxEEl498z7vA,Woshingo Streams,d4vd es peor de lo que imaginas,8600,383,13,0.05548,4,72288,3748,224
monthly,2026-04-01,2026-04-30,KXpgCNB6Dcs,UC52hytXteCKmuOzMViTK8_w,CdeCiencia,La valiosa excreción de cachalote,8578,465,3,0.078419,4,449789,34962,199
monthly,2026-04-01,2026-04-30,-0FsgHxwxgQ,UCbUYAYd1WUznxEEl498z7vA,Woshingo Streams,La Situación de Emilio Antun es muy Divertida,8228,222,5,0.040297,4,72225,2750,110
monthly,2026-04-01,2026-04-30,4ZK7Ms4IZ7g,UCoOae5nYA7VqaXzerajD0lg,Ali Abdaal,How to Chose Your Next Business Idea,8174,43,2,0.009822,4,18821,159,6
monthly,2026-04-01,2026-04-30,qsJSGpOs5q4,UCF0L4jd9LcSIxsj5gKITMqQ,Jaime Higuera,Me voló la cabeza cuando Jaime Higuera dijo esto #shorts,8110,573,4,0.060505,4,11404,733,6
monthly,2026-04-01,2026-04-30,B2ag364pRgQ,UCoOae5nYA7VqaXzerajD0lg,Ali Abdaal,I got cancelled for my 2x speed,8107,274,42,0.041484,4,59718,2077,384
monthly,2026-04-01,2026-04-30,95KqKaDsIAM,UCxcDzs-4quJV4QsairlFYNg,Alejavi Rivera,Lo hicieron! Crea vídeos largos GRATIS con audio de calidad por IA 🎥,7962,315,16,0.055763,4,29511,1503,88
monthly,2026-04-01,2026-04-30,H3lUaL6-XQQ,UCPgVPrgqpALC1s2e63fgKyg,elWacky,YouTuber Arruina Otro Hobby,7796,311,13,0.063716,4,187688,11217,650
monthly,2026-04-01,2026-04-30,MlSS4ZqvJuA,UCF0L4jd9LcSIxsj5gKITMqQ,Jaime Higuera,El interés no se puede fingir #shorts,7739,386,6,0.07912,2,16909,1169,26
monthly,2026-04-01,2026-04-30,sqXsMACtso0,UCEQXxiYxNZbym9Fad7-n2Lg,Doctor Fisión,ASÍ SE CONFIGURÓ EL MOTOR CLIMÁTICO DEL PLANETA 🌎,7705,526,11,0.131646,2,17531,1972,30
monthly,2026-04-01,2026-04-30,9LsgBjswQZY,UCLe_q9axMaeTbjN0hy1Z9xA,Caleb Hammer,Homeless Man Spent $5k on Paintings,7661,110,1,0.022386,4,116349,2542,31
monthly,2026-04-01,2026-04-30,fr78adfAnuA,UCUyDOdBWhC1MCxEjC46d-zw,Alex Hormozi,How to Use AI in Your Business in 2026,7655,183,4,0.034032,4,134608,4373,173
monthly,2026-04-01,2026-04-30,Hs6RxFMX1i4,UCUyDOdBWhC1MCxEjC46d-zw,Alex Hormozi,Almost No One Succeeds At First...,7596,304,25,0.049642,3,13055,592,29
monthly,2026-04-01,2026-04-30,2JhSWzxzLXA,UCJQQVLyM6wtPleV4wFBK06g,VisualPolitik,DELCY consolida su RÉGIMEN: ¿Está VENEZUELA SUFRIENDO una nueva DECEPCIÓN? @VisualPolitik,7594,67,3,0.043574,4,197653,7911,571
monthly,2026-04-01,2026-04-30,jdrW-vJOD1w,UC55-mxUj5Nj3niXFReG44OQ,Platzi,Meta está entrenando la IA con sus propios empleados,7577,453,19,0.0687,4,8910,557,22
monthly,2026-04-01,2026-04-30,v3JV42WbomE,UCP15FVAA2UL-QOcGhy7-ezA,EDteam,Los chinos van a superar a Estados Unidos en IA,7430,259,20,0.067501,2,14568,791,43
monthly,2026-04-01,2026-04-30,4IeYytwcpuQ,UCM55RjebjSevVWPnj2LEymw,viyaura,we tricked the internet...#art #artist,7171,279,1,0.065437,4,94502,5895,192
monthly,2026-04-01,2026-04-30,U4gpio58908,UC1yNl2E66ZzKApQdRuTQ4tw,Sabine Hossenfelder,Physicists finally prove that virtual particles are real and all around us,6671,226,17,0.058558,4,229486,11967,1401
monthly,2026-04-01,2026-04-30,y3HkZSayX2s,UC30ajuhy8cViP2DiM1QLjmg,98grados,Decisión por apariencia es mala decisión (probablemente) #smartphone #iphone #apple,6607,346,6,0.050894,4,10215,525,15
monthly,2026-04-01,2026-04-30,5fKeNMp7F6s,UCUyDOdBWhC1MCxEjC46d-zw,Alex Hormozi,Im Doing Too Many Things In The Business,6435,133,0,0.027963,2,18539,487,3
monthly,2026-04-01,2026-04-30,AzNb2nQrM7U,UC-bFpJCtP1lXn5vBxJ0b9dw,Diego Revuelta,Llegaron sin nada y hoy viven aquí. ¿Lo harías?,6365,247,36,0.074822,4,32149,2025,286
monthly,2026-04-01,2026-04-30,rYKQ0Ukxe6k,UC55-mxUj5Nj3niXFReG44OQ,Platzi,Me borran la memoria y despierto en 2008,6244,186,12,0.061198,2,11647,564,23
monthly,2026-04-01,2026-04-30,K38w2QlgHPQ,UC5PwIMtLiIBCBhsu8f_-6UQ,Santiago Bilinkis,¿Por qué tardás en responder cuando te hablan?,6163,269,8,0.070651,4,10098,605,22
monthly,2026-04-01,2026-04-30,OWkM5YoEhgM,UCEQXxiYxNZbym9Fad7-n2Lg,Doctor Fisión,EL FUTURO DE LA PROPULSIÓN ESPACIAL SIN COMBUSTIBLE 🛰️,6151,426,2,0.077986,4,64815,4944,93
monthly,2026-04-01,2026-04-30,-APimd6TUro,UC5mQQ4Ur6oA8lsGFkvH2lyg,Noche De Chicxs,No saben que lo mantengo #chisme #comedia #podcast,6052,109,0,0.027209,4,21807,561,2
monthly,2026-04-01,2026-04-30,rXs8JlFIS-U,UCF0L4jd9LcSIxsj5gKITMqQ,Jaime Higuera,Me voló la cabeza cuando Jaime Higuera dijo esto #shorts,6050,285,4,0.056178,4,15574,829,15
monthly,2026-04-01,2026-04-30,yemarhfhVA0,UCrdWRLq10OHuy7HmSckV3Vg,Nathaniel Drew,Epic transformation of my 1850s house in France (start to finish),5927,344,8,0.090602,4,103752,8774,544
monthly,2026-04-01,2026-04-30,M_FKC2NTb24,UCxFACDJ98idvo9Gq9M9AQgg,Moris Dieck | Finanzas e Inversiones ,Gasto culposo de Sofía Niño de Rivera,5829,107,1,0.025535,4,17111,411,6
monthly,2026-04-01,2026-04-30,UszcZZ1QZho,UCLYoURyGHMUuQ5YrfX55PWg,Aprendiz Financiero,Cuando tienes ESTOS 3 HÁBITOS siempre tendrás tu casa Limpia y Ordenada ✨,5818,134,6,0.059826,4,12068,572,23
monthly,2026-04-01,2026-04-30,T34ygnCahZc,UC5PwIMtLiIBCBhsu8f_-6UQ,Santiago Bilinkis,¿Nacimos para ser fieles? La mentira de la monogamia,5778,127,2,0.040015,4,36279,1287,107
monthly,2026-04-01,2026-04-30,GfSGy5C1OIA,UCxFACDJ98idvo9Gq9M9AQgg,Moris Dieck | Finanzas e Inversiones ,¿Tener seguro hace que pagues más?,5771,325,0,0.062689,2,7205,419,2
monthly,2026-04-01,2026-04-30,AHyZdLVYJfc,UCPdaxSov0mgwh77JvjQO2jQ,Man Carrying Thing,basically every Breaking Points™ video,5734,375,45,0.104252,4,175713,16075,2156
monthly,2026-04-01,2026-04-30,ERxzxl6fXbw,UCRDQzsHtx2cXvzEXnEhbxBg,Mister Krax,Un mundial para ricos? #mundial2026 #méxico,5696,316,6,0.071833,4,12657,851,18
monthly,2026-04-01,2026-04-30,dYJM9jmLBzY,UCPgVPrgqpALC1s2e63fgKyg,elWacky,No Lo Puedo Creer,5683,492,15,0.109733,4,158935,16602,790
monthly,2026-04-01,2026-04-30,TekYNY3eGC0,UCEQXxiYxNZbym9Fad7-n2Lg,Doctor Fisión,ARTEMIS II FOTOGRAFÍA NUESTRA GALAXIA EN PLENO VIAJE 🌌,5663,297,10,0.060307,4,102208,5957,191
monthly,2026-04-01,2026-04-30,krqt6eg3UoI,UCbUYAYd1WUznxEEl498z7vA,Woshingo Streams,EL TRISTE CASO DE JUAN MARTÍN (EL WILLIAMS DE TIIKTOK),5611,164,1,0.046669,4,54880,2378,134
monthly,2026-04-01,2026-04-30,DHk0gFHyHeE,UCl5-lvQyfILb-l2abPk4Ntg,Inteligencia Artificial,ChatGPT 5.5 es un cambio de era 🔥🚀,5585,109,3,0.034084,5,144428,4516,359
monthly,2026-04-01,2026-04-30,4vHF2qU89Jo,UCwd_qoS94df5orGoPLPnsxQ,Franco Pisso,La pregunta que me salvó la vida (y te va a incomodar),5581,417,16,0.114025,4,61199,6459,419
monthly,2026-04-01,2026-04-30,XzkJ2WrHR2c,UCF0L4jd9LcSIxsj5gKITMqQ,Jaime Higuera,No esperes que el mundo sea bueno contigo si no haces el bien #shorts,5568,236,13,0.068002,4,15558,956,36
monthly,2026-04-01,2026-04-30,CZe8DucT3qA,UCPgVPrgqpALC1s2e63fgKyg,elWacky,Actualización Repugnante,5501,317,11,0.076292,4,239140,17205,998
monthly,2026-04-01,2026-04-30,HEW0VJx9iw0,UCUyDOdBWhC1MCxEjC46d-zw,Alex Hormozi,Watch If You're Under $1M Year,5403,146,0,0.038349,4,50313,1889,14
monthly,2026-04-01,2026-04-30,BnAKfe0qGbE,UCP15FVAA2UL-QOcGhy7-ezA,EDteam,La forma más fácil de crear tu primera skill,5390,477,2,0.119995,2,5833,540,4
monthly,2026-04-01,2026-04-30,0dwlHNDdn2s,UCxFACDJ98idvo9Gq9M9AQgg,Moris Dieck | Finanzas e Inversiones ,¿Curar o facturar?,5389,259,2,0.051814,3,6978,345,2
monthly,2026-04-01,2026-04-30,ZjtJALByo70,UC55-mxUj5Nj3niXFReG44OQ,Platzi,¿Qué le dirías a la siguiente persona?,5388,358,6,0.050504,4,7420,456,8
monthly,2026-04-01,2026-04-30,tg0LuGGeOPA,UC1viRct91s1a3Z5yvk7FJXw,Diego Ruzzarin,¿Cómo van las cosas en Irán? Resumen noticias.,5332,168,5,0.062759,4,115920,6995,210
monthly,2026-04-01,2026-04-30,nZlhHf8vSbU,UCF0L4jd9LcSIxsj5gKITMqQ,Jaime Higuera,Por esto ser realista ha matado a nuestra generación #shorts,5279,596,6,0.078505,4,6740,668,8
monthly,2026-04-01,2026-04-30,pdNaIhcp3z4,UCaZ5txM63JGqgzRTVXy5e9g,César Dabián Finanzas,Me endeudé con 1 Millón en Tarjetas de Crédito - Cómo lo resolví (Storytime),5171,168,6,0.064945,4,17377,959,69
monthly,2026-04-01,2026-04-30,lYpHv3Tg0Vg,UCjSVqRtdOsxQDss_pJpp_Yg,COMPUESTOS Podcast,¿Cómo Tener Buenas Ideas En YouTube? 💡 #Compuestos #AndresGarza #EloisaWolf #Ideas,5020,122,1,0.015847,4,13686,247,1
monthly,2026-04-01,2026-04-30,SK8tkpErsm8,UCF0L4jd9LcSIxsj5gKITMqQ,Jaime Higuera,No te hables mal a ti mismo #shorts,4992,279,1,0.059119,4,17776,1034,13
monthly,2026-04-01,2026-04-30,0EqJD2o-Mnk,UCUyDOdBWhC1MCxEjC46d-zw,Alex Hormozi,Helping 6 Business Owners Scale in 33 Minutes,4909,89,3,0.027363,4,31814,798,50
monthly,2026-04-01,2026-04-30,mT-7tbs7rVw,UCF0L4jd9LcSIxsj5gKITMqQ,Jaime Higuera,Por esto digo que vestir bien es un acto de rebeldía  #shorts,4890,351,3,0.075967,2,6296,458,6
monthly,2026-04-01,2026-04-30,NuoEsHIW5JA,UCzR-rom72PHN9Zg7RML9EbA,PBS Eons,Why do mammals keep evolving into ant-eaters?,4882,131,3,0.041276,4,81293,3189,132
monthly,2026-04-01,2026-04-30,nJ0oh5u6YbM,UCUyDOdBWhC1MCxEjC46d-zw,Alex Hormozi,Don't Even Think About Passive Income,4800,132,0,0.035779,4,108623,3842,26
monthly,2026-04-01,2026-04-30,RVu1kgj-miw,UCRDQzsHtx2cXvzEXnEhbxBg,Mister Krax,Relaciones tensas entre México 🇲🇽 y Estados Unidos 🇺🇸 #mexico #chihuahua,4765,287,16,0.107961,3,5928,433,51
monthly,2026-04-01,2026-04-30,7vdW8a6jEfw,UCUyDOdBWhC1MCxEjC46d-zw,Alex Hormozi,"""What Should I Price My Products?""",4752,122,0,0.033064,4,36159,1169,10
monthly,2026-04-01,2026-04-30,AVyYMXc_t9s,UCEK0oX3X2yK9y27khCsrNKg,Mis Propias Finanzas,"""Dinero Roto"" (Broken Money) de Lyn Alden | Club de Lectura #199",4748,340,26,0.105578,5,4748,347,26
monthly,2026-04-01,2026-04-30,Xf_v62TQOx4,UCbfYPyITQ-7l4upoX8nvctg,Two Minute Papers,NVIDIA's New AI Broke My Brain,4729,154,10,0.052716,4,66052,3108,332
monthly,2026-04-01,2026-04-30,5ymn2oV1Zls,UCPgVPrgqpALC1s2e63fgKyg,elWacky,Al Parecer Sí Es Un Monstruo,4640,153,9,0.071925,4,301796,20498,1131
monthly,2026-04-01,2026-04-30,5BbGrGFI2gQ,UCRDQzsHtx2cXvzEXnEhbxBg,Mister Krax,Se inaugura tren suburbano Buenavista-AIFA #trensuburbano #méxico,4628,973,13,0.139961,4,6722,1176,19
monthly,2026-04-01,2026-04-30,664cs6FZEZo,UCUyDOdBWhC1MCxEjC46d-zw,Alex Hormozi,The Reason Why You Can't Is Why You Should,4562,87,0,0.029718,4,65976,1904,33
monthly,2026-04-01,2026-04-30,0IGNbK4bbXA,UCHMSzZaVrEjK35aYK3J7Htw,Pequeño Cerdo Capitalista,Ideas de Negocio: Servicios para Mascotas 🐶 🐱 (Ignorados Pero MUY Rentables),4416,247,15,0.084502,4,10158,737,52
monthly,2026-04-01,2026-04-30,lvw8Fe5wcBo,UCP15FVAA2UL-QOcGhy7-ezA,EDteam,"ChatGPT, Claude y Gemini están empatados, ninguno es mejor.",4414,99,6,0.042092,4,9107,324,20
monthly,2026-04-01,2026-04-30,nHH771Vtkxw,UC1viRct91s1a3Z5yvk7FJXw,Diego Ruzzarin,Por qué Israel ''manda'' en Estados Unidos?,4395,295,1,0.083666,4,343153,27958,728
monthly,2026-04-01,2026-04-30,Jr9Xm5f44NQ,UCPTlwyaEoJOVyvDLzHagzNQ,WATOP,China Abandonó A Millones De Vietnamitas A Su Suerte Arrebatándoles Lo Que Mantenía Viva A La Región,4220,202,2,0.087827,2,7005,488,8
monthly,2026-04-01,2026-04-30,-JTeDTLElVg,UC5mQQ4Ur6oA8lsGFkvH2lyg,Noche De Chicxs,Abandoné a mis trillizos #chisme #comedia #podcast,4219,172,0,0.035447,4,16693,601,3
monthly,2026-04-01,2026-04-30,SvLaz6y-mhs,UCBBWpss2iXVXtTzl7-4eWbg,Jessica Fernández García,Escúchalo completo en Más Allá del Rosa en YouTube,4211,121,0,0.035585,2,5701,180,0
monthly,2026-04-01,2026-04-30,Ju0usucry_g,UCmE44gpkHmf5bKIVTPSwxnQ,Judith Tiral,Lo que NO defendería jamás como ABOGADA,4184,64,4,0.032507,2,6413,150,8
monthly,2026-04-01,2026-04-30,6-PunI-5Ts4,UCEQXxiYxNZbym9Fad7-n2Lg,Doctor Fisión,DESCUBREN PARTÍCULAS QUE SALEN DIRECTAMENTE DEL VACÍO 🌌,4158,334,6,0.107723,4,25292,2587,82
monthly,2026-04-01,2026-04-30,a8LrJMGoVL4,UCoXtmmnLCbXDiSo8GxsmOzA,La gata de Schrödinger,Tres libros imprescindibles para cambiar tu forma de ver el mundo,4153,304,11,0.077947,4,121133,8970,463
monthly,2026-04-01,2026-04-30,0SSctcuOy0o,UCb8GKeOvI7WsFUkB4UVAeXA,Cordura Artificial,Mi nuevo lector de E-books #productividad #libros #lectura #tecnologia,4123,267,12,0.090901,4,16322,1383,59
monthly,2026-04-01,2026-04-30,3skIuC1lP00,UCOvzFyIAr32yspwxx77BHcQ,Rob Paper Clips,"Las mujeres tienen pepino… y están guangas, según esta fan del temach",4089,199,6,0.057358,4,9184,500,18
monthly,2026-04-01,2026-04-30,QDZUOBnmf4Q,UCEQXxiYxNZbym9Fad7-n2Lg,Doctor Fisión,LA MATERIA OSCURA PODRÍA TENER DOS ESTADOS 🌌,4076,284,12,0.096213,4,34645,3183,104
monthly,2026-04-01,2026-04-30,0ShXZN7aHqA,UCP15FVAA2UL-QOcGhy7-ezA,EDteam,¿Qué es exactamente una skill de IA?,4038,274,3,0.068293,4,4506,304,4
monthly,2026-04-01,2026-04-30,_O6ICkmg1Zg,UCyM-2pRapEv6V2q7UNO9icg,Emprende Aprendiendo,Cruzó ESTADOS UNIDOS con UN CENTAVO,3909,67,5,0.030095,4,8921,240,8
monthly,2026-04-01,2026-04-30,kLJNcHqVmJA,UC9WGON3pXofvE958Uq3Lw3Q,Exito Financiero,Las 3 Metas Financieras Que Deberías Lograr,3897,216,10,0.080492,3,5904,401,16
monthly,2026-04-01,2026-04-30,OkuWh46I4m4,UCDOSaJ0pnglwzfkR6fYbisA,Luis Mi Negocios,5 pasos para MULTIPLICAR tu DINERO,3894,186,4,0.070349,4,12631,824,23
monthly,2026-04-01,2026-04-30,z-7AhJ55htQ,UCJQQVLyM6wtPleV4wFBK06g,VisualPolitik,ESTADO DE ALERTA en COREA: IRÁN pone al país CONTRA LAS CUERDAS @VisualPolitik,3813,120,3,0.034952,4,403006,13218,864
monthly,2026-04-01,2026-04-30,uvfU2B8b4G4,UCDOSaJ0pnglwzfkR6fYbisA,Luis Mi Negocios,¿Por qué ESPERAN años para SALIR a BOLSA?,3782,166,4,0.047787,4,40860,1933,17
monthly,2026-04-01,2026-04-30,IQZiAOokKXo,UCUyDOdBWhC1MCxEjC46d-zw,Alex Hormozi,Here Is Why People Stop Buying From You,3768,73,1,0.027306,4,25441,678,3
monthly,2026-04-01,2026-04-30,LPTQADIf6Xk,UCaVPhFg-Ax873wvhbNitsrQ,El Robot de Platón,Tecnologías de las que NADIE Habla,3678,189,8,0.070977,4,119080,7936,489
monthly,2026-04-01,2026-04-30,DB1fSfulSJQ,UCUyDOdBWhC1MCxEjC46d-zw,Alex Hormozi,This Is What Wasted Potential Actually Looks Like,3605,125,1,0.042326,4,50754,2114,17
monthly,2026-04-01,2026-04-30,wB2Kb0MiyAc,UC5mQQ4Ur6oA8lsGFkvH2lyg,Noche De Chicxs,¡Estafó a sus padres por años! #chisme #comedia #podcast,3569,46,0,0.01974,4,30719,587,6
monthly,2026-04-01,2026-04-30,B18aH00d8oE,UCJQQVLyM6wtPleV4wFBK06g,VisualPolitik,El PENTÁGONO ya tiene un plan para CUBA:  ¿Intervención a la vista? @VisualPolitik,3559,96,2,0.046804,4,276190,12138,755
monthly,2026-04-01,2026-04-30,nOR-IY0SnEY,UCRDQzsHtx2cXvzEXnEhbxBg,Mister Krax,Los mexicanos saben sobrevivir #méxico #mrbeast,3535,193,7,0.063895,4,37960,2275,147
monthly,2026-04-01,2026-04-30,HVPhcOmSMtM,UCEK0oX3X2yK9y27khCsrNKg,Mis Propias Finanzas,La Verdad que Nadie te Dice sobre Cómo los Colombianos Están Gastando Su Dinero | VP de Mastercard,3530,106,71,0.063625,2,3809,126,72
monthly,2026-04-01,2026-04-30,l1-D1s67YU4,UCP15FVAA2UL-QOcGhy7-ezA,EDteam,Anthropic perdió su liderazgo frente a OpenAI ¿cómo pasó? ,3529,116,5,0.049092,4,49458,2227,173
monthly,2026-04-01,2026-04-30,CzIJ566XexE,UCyM-2pRapEv6V2q7UNO9icg,Emprende Aprendiendo,Por esto NO DEBES vender BARATO,3523,112,1,0.040341,2,8145,309,1
monthly,2026-04-01,2026-04-30,iq599kyAjVA,UCOHxDwCcOzBaLkeTazanwcw,Bravos Research,The UNTHINKABLE is About to Happen to Stocks (Emergency Update),3504,45,0,0.027229,4,144927,3842,80
