grain,period_start,period_end,channel_id,channel_name,period_video_count,period_new_videos,period_views_delta,period_likes_delta,period_comments_delta,period_avg_engagement_rate,period_top_video_id,period_top_video_title,period_top_video_views_delta
daily,2026-04-29,2026-04-29,UCiqJoWIT-vm-hJoXilFGiUQ,Inversión Inteligente - Alain Cortés,17,1,1132,16,3,0.03392,FdFgh2vQp8I,¡LEVA supera a todos! Paga la TASA más ALTA de todo el mercafdo,397
daily,2026-04-29,2026-04-29,UC3IEYr87JpgBeVbbc0gP9DA,Irene Albacete,2,0,1022,89,2,0.095855,J9p4GMskefU,“La memoria colectiva” puede ser tu mayor obstáculo.,558
daily,2026-04-29,2026-04-29,UCYZLVhSSwdBllvn4tw5a4uQ,Rob Paper Sheet,2,0,972,38,3,0.052586,-6t20SnbOyc,"Un buen clasista no es aquel que juzga, es que el describe la realidad.",857
daily,2026-04-29,2026-04-29,UCWn_0MmgojB711LFX-jaCDQ,El Rincón Del Dev,4,0,950,42,0,0.032665,pS5AOr4B7hg,"Deja de escribir, simplemente habla 👀🎙️ #desarrolloweb #programacion",722
daily,2026-04-29,2026-04-29,UCV5G678sZwW5IcF3pCfRbHQ,La Hiperactina,1,0,891,74,0,0.081181,9QKOkpu78CQ,Publi⭐️ ¿Por qué hay cosas que lees mil veces y no entiendes… y en vídeo sí? 📹🧬✨,891
daily,2026-04-29,2026-04-29,UCQIUhtP5WYIx_pMG8UvMYHg,Cristina Dayz ,3,0,825,31,2,0.068967,5Z4z2oEoxw8,"11,7 Cosas que son un DESPERDICIO de Dinero en 2026",584
daily,2026-04-29,2026-04-29,UCOxW1h1VV379Q8GDdUJOhgw,Mariano Trejo,1,0,817,47,1,0.075104,3W1KfxQnQiU,30 Hábitos que (Silenciosamente) Cambiaron mi Vida para Siempre,817
daily,2026-04-29,2026-04-29,UCRlBDnRQduDk4tmm1OtpSRg,UN POCO MEJOR,1,0,800,47,0,0.078058,TUSbI3pqiCM,El ÚNICO Sistema de Dinero que Necesitas // Te Enseñaré a Ser Rico,800
daily,2026-04-29,2026-04-29,UC9mrBfjgyOsqJ0J-zw7kZLQ,Atherion,4,0,682,44,0,0.080452,EnLpF9i3I4I,querido desconocido…,348
daily,2026-04-29,2026-04-29,UCX6b17PVsYBQ0ip5gyeme-Q,CrashCourse,1,0,593,22,0,0.07263,bouvNyq8xCY,Earth's Crust and Mantle Explained: Crash Course Geology #3,593
daily,2026-04-29,2026-04-29,UCDnUOd6PIlQAL9bPUTf9BkQ,Sapiencia práctica,2,0,585,46,1,0.115715,5ov8sBSV-pc,6 TRUCOS psicológicos para ENAMORAR a cualquiera,442
daily,2026-04-29,2026-04-29,UCuhw3KIv3wM14By2-LcxDGw,El Consejero,5,1,517,28,2,0.089606,ieJE93iObcI,Por qué las personas secretamente te odian (aún más de lo que imaginas) | Carl Jung,369
daily,2026-04-29,2026-04-29,UCF7UoUGGOUcSSNcVDndq7KQ,Itzcalli,1,0,352,24,1,0.147449,-Ap6qWvqk0I,"SI ERES MUJER, TU BELLEZA ES UNA MONEDA DE CAMBIO: Barbie y los Diarios de una boticaria",352
daily,2026-04-29,2026-04-29,UCrr-NczCJHrwi1oBS97uwnw,Finanzas con Gus,1,0,271,17,7,0.102251,G-i7hiu_yPU,El Imperio Más Poderoso del Mundo Está Empezando a Romperse,271
daily,2026-04-29,2026-04-29,UCOD6LXgeBoeiUZTsPLdG-0g,Vida MRR - Programacion web,4,0,242,5,1,0.060455,6_o0OElprPo,GITHUB Copilot va a COBRAR por TOKEN...,163
daily,2026-04-29,2026-04-29,UCOQEA3qmyzFmJdi6Z137yrA,Monitor fantasma,1,0,193,7,5,0.115385,4RmcHqjzw-A,Sobre las elecciones en Perú y una reflexión sobre la democracia,193
daily,2026-04-29,2026-04-29,UCsmEAwbV7WbYndpQKbY4Ntw,Juan Villalvazo,1,0,64,1,1,0.104535,NLrfMQ0dqpQ,La Tumba de Microsoft y Windows,64
daily,2026-04-29,2026-04-29,UC2RIppRBTTa6JBY-Zwv6lQw,El Maikini Dev,1,0,44,1,0,0.125943,qGa8y4tPUkc,Calificando comentarios de mis videos junto a ChatGPT,44
daily,2026-04-28,2026-04-28,UCLe_q9axMaeTbjN0hy1Z9xA,Caleb Hammer,27,27,3412598,74422,2816,0.028888,v_1Dhh8G84c,Paying $2500 a Month For Rent in Texas,746127
daily,2026-04-28,2026-04-28,UCWBWgCD4oAqT3hUeq40SCUw,Sambucha,18,18,2142654,84574,1294,0.056011,39czcByvq7c,I Investigated Stores That Are Disappearing (Again),309947
daily,2026-04-28,2026-04-28,UC52hytXteCKmuOzMViTK8_w,CdeCiencia,8,8,1968693,34251,198,0.060296,WgcdDVIUXcI,¿Cómo funcionan las gomas de borrar?,1193374
daily,2026-04-28,2026-04-28,UC415bOPUcGSamy543abLmRA,Cleo Abram,5,5,1912449,85676,768,0.058695,Su0aCV35IFM,There's a Telescope at the Bottom of the Ocean,1440460
daily,2026-04-28,2026-04-28,UCOWFKaCN-rzmYk502JFWnqg,Eze Martínez,3,3,701439,17488,184,0.058775,vmRbevilfpU,Números de la suerte 🍀,532492
daily,2026-04-28,2026-04-28,UCQHX6ViZmPsWiYSFAyS0a3Q,GothamChess,14,14,692368,16744,286,0.036995,XsY6iChNzf0,Human vs Computer,251470
daily,2026-04-28,2026-04-28,UCGq-a57w-aPwyi3pW7XLiHw,The Diary Of A CEO,8,8,684759,13617,812,0.032191,PnpHwhTWw0c,Sex Expert: What Women Actually Need To Enjoy Sex,295845
daily,2026-04-28,2026-04-28,UCHnyfMqiRRG1u-2MsSQLbXA,Veritasium,2,2,575684,17389,269,0.025854,MVFd0qFB9TE,Why don't trains make *that* sound anymore?,324673
daily,2026-04-28,2026-04-28,UCUyDOdBWhC1MCxEjC46d-zw,Alex Hormozi,55,55,376792,12071,116,0.039279,if955Z_s4Ts,I Don't Do Early Meetings,71721
daily,2026-04-28,2026-04-28,UC4QZ_LsYcvcq7qOsOhpAX4A,ColdFusion,1,1,374008,13199,1043,0.051573,QfUb5MEAOXA,"Apple CEO Resigns, What Now?",374008
daily,2026-04-28,2026-04-28,UC1viRct91s1a3Z5yvk7FJXw,Diego Ruzzarin,11,11,361011,28428,2117,1.062578,48hHo2WcAQI,"¿Argentina, será el nuevo patio trasero de Israel? #diegoruzzarin #milei #argentina",263408
daily,2026-04-28,2026-04-28,UCyJbb85EUgWjl38GcF236Jg,Eva Maria Beristain,3,3,332250,11984,1020,0.06226,BOmc_wliaRg,CASO EDITH GUADALUPE Y JUAN JESUS N - Ruido Social,171011
daily,2026-04-28,2026-04-28,UCsXVk37bltHxD1rDPwtNM8Q,Kurzgesagt – In a Nutshell,3,3,220373,8788,225,0.053366,z7Qp9Q_Br88,Laughing Gas Is Not So Funny,138803
daily,2026-04-28,2026-04-28,UCFBpVaKCC0ajGps1vf0AgBg,Humphrey Yang,4,0,208199,3713,424,0.022157,iaYdIU5n6vw,10 Things That Are No Longer Worth Your Money,118619
daily,2026-04-28,2026-04-28,UCSju5G2aFaWMqn-_0YBtq5A,Stand-up Maths,1,1,197295,9499,1330,0.077313,kH_bSvf7EVA,What is up with UK bridge height signs?,197295
daily,2026-04-28,2026-04-28,UCNYW2vfGrUE6R5mIJYzkRyQ,DrossRotzank,4,4,194373,9652,278,0.087592,kijJaXVri7Q,3 metrajes hechos antes de morir,92166
daily,2026-04-28,2026-04-28,UCJQQVLyM6wtPleV4wFBK06g,VisualPolitik,5,5,184058,4955,193,0.043743,rc-xQnupse0,La EXTRAÑA decisión de CHINA sobre IRÁN que DESCONCIERTA a todo el mundo @VisualPolitik,172607
daily,2026-04-28,2026-04-28,UC36xmz34q02JYaZYKrMwXng,Nate Gentile,2,2,178891,9287,251,0.055089,3LnNwS6rqk8,Monté el PC de BATMAN dentro de una Batcueva REAL,177482
daily,2026-04-28,2026-04-28,UCPgVPrgqpALC1s2e63fgKyg,elWacky,9,9,164334,9325,397,0.081951,kf9ghd5-VII,Al Parecer Los Viajes En El Tiempo Son Real,121604
daily,2026-04-28,2026-04-28,UCDOSaJ0pnglwzfkR6fYbisA,Luis Mi Negocios,11,11,149089,8290,260,0.110812,sKME5er1OKc,Las CIUDADES que van a explotar ECONÓMICAMENTE,62181
daily,2026-04-28,2026-04-28,UCl5-lvQyfILb-l2abPk4Ntg,Inteligencia Artificial,31,6,124990,2447,94,0.031285,BPt0fwBCDbQ,🤖 Es imposible que un reactor nuclear sufra una explosión nuclear 🤖 #ia #chatgpt #educación,63998
daily,2026-04-28,2026-04-28,UCF0L4jd9LcSIxsj5gKITMqQ,Jaime Higuera,78,78,118839,7742,101,0.06791,tQCVAU-fZPA,Me cambió la vida cuando Jaime Higuera dijo esto #shorts,34154
daily,2026-04-28,2026-04-28,UCEQXxiYxNZbym9Fad7-n2Lg,Doctor Fisión,9,9,82815,3186,66,0.087464,6UPfq3KETg4,HAN DESCUBIERTO 11.000 NUEVOS INTEGRANTES DEL SISTEMA SOLAR 🌌,66153
daily,2026-04-28,2026-04-28,UCQX_MZRCaluNKxkywkLEgfA,Date un Vlog,3,3,79469,4492,178,0.077533,er7v-GJj_V0,La economía mundial depende de esta isla (no es petroleo),60921
daily,2026-04-28,2026-04-28,UCR1IuLEqb6UEA_zQ81kwXfg,Real Engineering,1,1,78694,2285,48,0.039351,FYMdllTCrc0,The Insane Engineering of the V-22 Osprey,78694
daily,2026-04-28,2026-04-28,UCM55RjebjSevVWPnj2LEymw,viyaura,5,5,75988,2715,173,0.072317,UM9dcnJXX0k,I Mastered Popular Anime Art Styles,44925
daily,2026-04-28,2026-04-28,UCPdaxSov0mgwh77JvjQO2jQ,Man Carrying Thing,3,3,75683,3802,403,0.092616,GybLbhXj2Nw,Game Theory #2: The Collapse of the Trump Empire,46616
daily,2026-04-28,2026-04-28,UC1yNl2E66ZzKApQdRuTQ4tw,Sabine Hossenfelder,5,5,70736,3255,598,0.070046,XeN7wKfDOPk,Our Evolutionary Past Is Killing Us Now,38154
daily,2026-04-28,2026-04-28,UCtIdb7KRqOTcOogKsos_QRw,Lord Draugr,1,1,63965,2095,40,0.04911,TET8fTKH1e8,Algo MUY RARO está pasando en el DESIERTO de CHINA,63965
daily,2026-04-28,2026-04-28,UCP15FVAA2UL-QOcGhy7-ezA,EDteam,27,27,61904,2334,129,0.050974,OEqMxMEBQQY,SpaceX comprará Cursor por 60 mil millones. ¿Por qué?,20851
daily,2026-04-28,2026-04-28,UCbUYAYd1WUznxEEl498z7vA,Woshingo Streams,10,10,61856,2080,94,0.053452,MqpQhyjFZQU,aimep3 siendo pickme,43458
daily,2026-04-28,2026-04-28,UCOHxDwCcOzBaLkeTazanwcw,Bravos Research,2,2,60801,1157,14,0.030202,PN8bHAr0f1M,The Damage is done…,58439
daily,2026-04-28,2026-04-28,UC5mQQ4Ur6oA8lsGFkvH2lyg,Noche De Chicxs,17,17,59012,1553,122,0.039676,QIKiQjEMUjY,¡Abandoné A Mis Trillizos! 😭 Ft. @CD9MX - T10E05 #podcast #chisme #cd9,22888
daily,2026-04-28,2026-04-28,UCxFACDJ98idvo9Gq9M9AQgg,Moris Dieck | Finanzas e Inversiones ,17,17,52013,1275,97,0.044902,Cp3DxMyEBIM,Por qué EE.UU. necesita a México más que nunca | Dimes y Billetes #447,37191
daily,2026-04-28,2026-04-28,UCoOae5nYA7VqaXzerajD0lg,Ali Abdaal,7,7,50844,1586,83,0.036214,bfENsVP77VQ,The Only Investing Video You’ll Ever Need (Start With $0),20192
daily,2026-04-28,2026-04-28,UC7DdEm33SyaTDtWYGO2CwdA,Physics Girl,1,1,45067,2785,61,0.075432,Ycdklm6W1_o,What happened to my face,45067
daily,2026-04-28,2026-04-28,UCBBWpss2iXVXtTzl7-4eWbg,Jessica Fernández García,8,8,39077,902,122,0.039545,LLK879SXq_w,La TÍA PATY: Del CHISME en REDES a la CÁRCEL- Más allá del rosa con Perla Calvillo Cantu,37458
daily,2026-04-28,2026-04-28,UCDfbsXLRCyk_LIkrtaTmliQ,PlanetaJuan,1,1,39069,2694,327,0.131555,T7_l896OH20,Mi abuela tiene 94 años... y esto aprendió.,39069
daily,2026-04-28,2026-04-28,UC52kszkc08-acFOuogFl5jw,Tibees,2,2,33424,2536,282,0.119,o8YcWD2ri9U,Something Weird Is Happening in Self-Publishing,23878
daily,2026-04-28,2026-04-28,UCVt4ugq2txl_szlXAO7B3-g,Adrián Sáenz,3,3,31067,1446,58,0.058746,Lqq78q17jDY,La Forma Más Fácil De Ganar Dinero Con Claude,17015
daily,2026-04-28,2026-04-28,UC55-mxUj5Nj3niXFReG44OQ,Platzi,10,10,30685,1056,39,0.049347,0VjrLsr61pk,El futuro de Apple después de Tim Cook,11083
daily,2026-04-28,2026-04-28,UCaVPhFg-Ax873wvhbNitsrQ,El Robot de Platón,4,4,28928,1780,119,0.074733,hXPy19kPego,El Gran Vacío de Nuestro Genoma,24695
daily,2026-04-28,2026-04-28,UCTfQ65AxquXmih3r6rZmK-Q,jefillysh,2,2,26790,1483,71,0.08281,crrTHKN_R58,Por qué ODIAMOS a los demás? - CIENCIA SIMPLIFICADA EP#77,25662
daily,2026-04-28,2026-04-28,UC5PwIMtLiIBCBhsu8f_-6UQ,Santiago Bilinkis,7,7,26203,942,29,0.051156,U14_qm5y38o,Cómo detectar a un charlatán en una sobremesa,14585
daily,2026-04-28,2026-04-28,UC1VLQPn9cYSqx8plbk9RxxQ,The Action Lab,1,1,25056,730,37,0.045851,EFhMcL3Kf1c,How To Eliminate Gravity,25056
daily,2026-04-28,2026-04-28,UCmE44gpkHmf5bKIVTPSwxnQ,Judith Tiral,2,2,23841,1124,50,0.05855,zxQJIBt9CBI,Así es DEFENDER a un ASESINO: entrevisto a Beatriz de Vicente,23841
daily,2026-04-28,2026-04-28,UCvzk_MwdXD6jQa4Se-6B9ZQ,Adrià Solà Pastor,2,2,23661,1158,25,0.073414,ZhRgnBzcYHQ,Cómo Ganar Dinero Por Internet (De Verdad) En 2026? Curso Completo Con Resultados Garantizados,12601
daily,2026-04-28,2026-04-28,UCRDQzsHtx2cXvzEXnEhbxBg,Mister Krax,13,13,19128,1527,48,0.07728,ERxzxl6fXbw,Un mundial para ricos? #mundial2026 #méxico,4439
daily,2026-04-28,2026-04-28,UCDV1MWcRLthxSrmb2Zv-jeg,Ricardo Alca2,1,1,17670,1491,44,0.112034,YhNUPGphSM8,El Lobo de Wall Street de TikTok,17670
daily,2026-04-28,2026-04-28,UChhw6DlKKTQ9mYSpTfXUYqA,Starter Story,3,3,16462,791,38,0.038754,D4fkiQfzw_I,How I Work: $77K/Month Solopreneur,15308
daily,2026-04-28,2026-04-28,UCoXtmmnLCbXDiSo8GxsmOzA,La gata de Schrödinger,3,3,16403,654,58,0.07873,g_7mUw6Xt2E,Sorpresa mundial: la homeopatía no funciona.,13782
daily,2026-04-28,2026-04-28,UCjSVqRtdOsxQDss_pJpp_Yg,COMPUESTOS Podcast,19,19,15156,307,7,0.048179,UkbeRKmr5kM,¿Se Puede Vivir De YouTube? 📹 #Compuestos #AndresGarza #EloisaWolf #YouTube,7024
daily,2026-04-28,2026-04-28,UC7MkZfrLCeE4Xwh9h2QnN0A,Arcade's Books,1,1,14769,1480,112,0.174098,_twN29IEQlc,"La DECADENCIA de la CRÍTICA LITERARIA 🐍 ¿Crítica, adulación o ""hate""? | Arcade's Books",14769
daily,2026-04-28,2026-04-28,UCMOqf8ab-42UUQIdVoKwjlQ,Practical Engineering,1,1,14653,327,17,0.033372,J7ieKmP96Hc,The Wild Story of the Teton Dam Failure,14653
daily,2026-04-28,2026-04-28,UC30ajuhy8cViP2DiM1QLjmg,98grados,5,5,14069,1162,31,0.059408,x0HFad-M2iE,La gente no me creyó cuando les enseñé la optimización de la laptop #laptop #windows,8682
daily,2026-04-28,2026-04-28,UCV5cU7ORoUCCAT79kSrOJmg,Ricardo Alcaraz,1,1,12651,610,14,0.081133,_9bYQ2tvc_s,La Peor Disculpa que he visto,12651
daily,2026-04-28,2026-04-28,UCPTlwyaEoJOVyvDLzHagzNQ,WATOP,4,4,12508,267,5,0.045438,h9kh7KssnMc,China Encontró Algo Inexplicable en Esta Montaña de África y Ahora se lo Lleva Rápido,10146
daily,2026-04-28,2026-04-28,UC0N6ZYT8Q9bdQkGrgl9g9Ug,Pinwin,1,1,12082,1075,50,0.126489,TfojYStTlZE,Tienes que Aprender a Estar SOLO.,12082
daily,2026-04-28,2026-04-28,UCqcbQf6yw5KzRoDDcZ_wBSw,Wes Roth,6,6,12016,225,30,0.027512,bFO0uAMPx1g,Hermes Agent is INSANE...,10938
daily,2026-04-28,2026-04-28,UCEK0oX3X2yK9y27khCsrNKg,Mis Propias Finanzas,12,2,10833,579,46,0.057666,AVyYMXc_t9s,"""Dinero Roto"" (Broken Money) de Lyn Alden | Club de Lectura #199",3930
daily,2026-04-28,2026-04-28,UC4mg-nKTVI9CWodPPqB5d3A,Luna Martínez ,1,1,10001,652,68,0.106679,q1l42BPzbIk,MALLWORLD: TODOS SOÑAMOS LO MISMO..😴👁️ | Luna Martínez ,10001
daily,2026-04-28,2026-04-28,UCb8GKeOvI7WsFUkB4UVAeXA,Cordura Artificial,2,2,9289,489,32,0.08366,-IhdnUzV64Y,La Simple TÉCNICA que convierte a la gente en NPC,6809
daily,2026-04-28,2026-04-28,UC3nwmvE2aDzUSJ4evQ1NhoA,IA Innova,4,4,8517,371,8,0.053158,wnoSOSgBNHk,¡La NUEVA “Simula” de Google es INCREÍBLE!,8398
daily,2026-04-28,2026-04-28,UCdNnEDbRWhanA1O8zhCn3ZA,Omar - Educación Financiera,3,3,7783,436,61,0.061847,VVfMO6SJZLw,"Gané $800,000+ en la bolsa de valores. ¿Cuánto pagué de impuestos?",6950
daily,2026-04-28,2026-04-28,UCbdSYaPD-lr1kW27UJuk8Pw,QuantumFracture,1,1,7575,488,1,0.072865,rfnB9MhBI44,Se Cumplen 40 años del Accidente de Chernobyl,7575
daily,2026-04-28,2026-04-28,UCZRsSEs1OX74qBh0x5T22tg,EL CACHONDO,1,1,7395,492,15,0.105438,rk2b7fH_Gcc,MIL MANERAS DE M0RIR EN ARGENTINA #5,7395
daily,2026-04-28,2026-04-28,UC4FHiPgS1KXkUMx3dxBUtPg,HolaMundo,1,1,7105,271,22,0.059622,EXOQ7vN2NXk,"Para programar, ¿cual modelo es mejor?",7105
daily,2026-04-28,2026-04-28,UC4jlzJyMNQkkcEcCN3EFG7g,Brin,1,1,6509,176,23,0.055847,zj0BKLv9r8Y,"Cuando el ""RARITO DE LA ESCUELA"" se cansa del bullying",6509
daily,2026-04-28,2026-04-28,UC9WGON3pXofvE958Uq3Lw3Q,Exito Financiero,4,4,6035,260,16,0.062077,kLJNcHqVmJA,Las 3 Metas Financieras Que Deberías Lograr,2816
daily,2026-04-28,2026-04-28,UCxcDzs-4quJV4QsairlFYNg,Alejavi Rivera,1,1,5847,228,10,0.05638,95KqKaDsIAM,Lo hicieron! Crea vídeos largos GRATIS con audio de calidad por IA 🎥,5847
daily,2026-04-28,2026-04-28,UCyM-2pRapEv6V2q7UNO9icg,Emprende Aprendiendo,8,8,5457,116,6,0.030292,_O6ICkmg1Zg,Cruzó ESTADOS UNIDOS con UN CENTAVO,3378
daily,2026-04-28,2026-04-28,UCOvzFyIAr32yspwxx77BHcQ,Rob Paper Clips,2,2,5402,209,5,0.05584,3skIuC1lP00,"Las mujeres tienen pepino… y están guangas, según esta fan del temach",3124
daily,2026-04-28,2026-04-28,UCLYoURyGHMUuQ5YrfX55PWg,Aprendiz Financiero,4,4,5211,177,5,0.077859,UszcZZ1QZho,Cuando tienes ESTOS 3 HÁBITOS siempre tendrás tu casa Limpia y Ordenada ✨,3959
daily,2026-04-28,2026-04-28,UC-bFpJCtP1lXn5vBxJ0b9dw,Diego Revuelta,1,1,4684,186,16,0.075802,AzNb2nQrM7U,Llegaron sin nada y hoy viven aquí. ¿Lo harías?,4684
daily,2026-04-28,2026-04-28,UCrdWRLq10OHuy7HmSckV3Vg,Nathaniel Drew,1,1,4492,246,6,0.090866,yemarhfhVA0,Epic transformation of my 1850s house in France (start to finish),4492
daily,2026-04-28,2026-04-28,UCHMSzZaVrEjK35aYK3J7Htw,Pequeño Cerdo Capitalista,7,7,4102,195,17,0.053639,0IGNbK4bbXA,Ideas de Negocio: Servicios para Mascotas 🐶 🐱 (Ignorados Pero MUY Rentables),2604
daily,2026-04-28,2026-04-28,UCwd_qoS94df5orGoPLPnsxQ,Franco Pisso,1,1,4072,304,14,0.114571,4vHF2qU89Jo,La pregunta que me salvó la vida (y te va a incomodar),4072
daily,2026-04-28,2026-04-28,UCX9NJ471o7Wie1DQe94RVIg,Fazt,4,4,3889,164,3,0.06059,NkWtrW-9GDY,3 Formas de Desplegar tu Proyecto Web que TODO Desarrollador Debe Conocer,2591
daily,2026-04-28,2026-04-28,UCbfYPyITQ-7l4upoX8nvctg,Two Minute Papers,2,2,3810,132,6,0.064886,Xf_v62TQOx4,NVIDIA's New AI Broke My Brain,3810
daily,2026-04-28,2026-04-28,UCQIUhtP5WYIx_pMG8UvMYHg,Cristina Dayz ,3,3,3301,132,8,0.070734,5Z4z2oEoxw8,"11,7 Cosas que son un DESPERDICIO de Dinero en 2026",2241
daily,2026-04-28,2026-04-28,UCzR-rom72PHN9Zg7RML9EbA,PBS Eons,2,2,2923,80,2,0.057034,NuoEsHIW5JA,Why do mammals keep evolving into ant-eaters?,2923
daily,2026-04-28,2026-04-28,UCYZLVhSSwdBllvn4tw5a4uQ,Rob Paper Sheet,2,2,2823,92,2,0.053018,-6t20SnbOyc,"Un buen clasista no es aquel que juzga, es que el describe la realidad.",2635
daily,2026-04-28,2026-04-28,UCaZ5txM63JGqgzRTVXy5e9g,César Dabián Finanzas,1,1,2815,107,4,0.066874,pdNaIhcp3z4,Me endeudé con 1 Millón en Tarjetas de Crédito - Cómo lo resolví (Storytime),2815
daily,2026-04-28,2026-04-28,UC3IEYr87JpgBeVbbc0gP9DA,Irene Albacete,2,2,2503,176,8,0.09686,MSl5mD3E7PE,4 creencias que te mantienen pobre.,1405
daily,2026-04-28,2026-04-28,UC9mrBfjgyOsqJ0J-zw7kZLQ,Atherion,4,4,2336,139,3,0.081739,EnLpF9i3I4I,querido desconocido…,1900
daily,2026-04-28,2026-04-28,UCRlBDnRQduDk4tmm1OtpSRg,UN POCO MEJOR,1,1,2114,139,2,0.080403,TUSbI3pqiCM,El ÚNICO Sistema de Dinero que Necesitas // Te Enseñaré a Ser Rico,2114
daily,2026-04-28,2026-04-28,UCOxW1h1VV379Q8GDdUJOhgw,Mariano Trejo,1,0,2082,122,4,0.082082,3W1KfxQnQiU,30 Hábitos que (Silenciosamente) Cambiaron mi Vida para Siempre,2082
daily,2026-04-28,2026-04-28,UCOD6LXgeBoeiUZTsPLdG-0g,Vida MRR - Programacion web,4,4,2037,85,26,0.065675,6_o0OElprPo,GITHUB Copilot va a COBRAR por TOKEN...,1711
daily,2026-04-28,2026-04-28,UCs0QXHkbkBDM_NwnRiGFoTA,Crea Y Transforma,2,2,1670,58,0,0.071951,L7fVqlOzegQ,TRONÓ el Petrodólar! Petróleo en YUANES CHINOS! Deuda de 39 TRILLONES de USA,1670
daily,2026-04-28,2026-04-28,UCV5G678sZwW5IcF3pCfRbHQ,La Hiperactina,1,1,1648,115,1,0.081208,9QKOkpu78CQ,Publi⭐️ ¿Por qué hay cosas que lees mil veces y no entiendes… y en vídeo sí? 📹🧬✨,1648
daily,2026-04-28,2026-04-28,UCuhw3KIv3wM14By2-LcxDGw,El Consejero,4,4,1557,70,5,0.082824,ieJE93iObcI,Por qué las personas secretamente te odian (aún más de lo que imaginas) | Carl Jung,1306
daily,2026-04-28,2026-04-28,UCDnUOd6PIlQAL9bPUTf9BkQ,Sapiencia práctica,2,2,1486,97,3,0.129111,5ov8sBSV-pc,6 TRUCOS psicológicos para ENAMORAR a cualquiera,1209
daily,2026-04-28,2026-04-28,UCX6b17PVsYBQ0ip5gyeme-Q,CrashCourse,1,1,1452,49,0,0.074604,bouvNyq8xCY,Earth's Crust and Mantle Explained: Crash Course Geology #3,1452
daily,2026-04-28,2026-04-28,UC2UXDak6o7rBm23k3Vv5dww,Tina Huang,3,3,1449,31,0,0.041265,DWt3zfqtI6g,Top 10 AI-Exposed Occupations,1110
daily,2026-04-28,2026-04-28,UCP7PV59jal4PobLeo5cSG_Q,Santiago Amat,5,5,990,29,-17,0.138037,sPHe-L95K0o,Estrategia Gaps Tesla,841
daily,2026-04-28,2026-04-28,UCiqJoWIT-vm-hJoXilFGiUQ,Inversión Inteligente - Alain Cortés,16,16,875,36,11,0.041465,N14hiQw7Wdk,¡La Sofipo con MEJOR TASA de interés! Hasta el 12.25% ANUAL | Leva: Alternativas Económicas,493
daily,2026-04-28,2026-04-28,UCWn_0MmgojB711LFX-jaCDQ,El Rincón Del Dev,4,4,819,19,2,0.02826,W1js1spTUPs,Así puedes crear tus MVP en un día 👀 #desarrolloweb #programacion #programador,537
daily,2026-04-28,2026-04-28,UCF7UoUGGOUcSSNcVDndq7KQ,Itzcalli,1,1,706,83,2,0.149373,-Ap6qWvqk0I,"SI ERES MUJER, TU BELLEZA ES UNA MONEDA DE CAMBIO: Barbie y los Diarios de una boticaria",706
daily,2026-04-28,2026-04-28,UCOQEA3qmyzFmJdi6Z137yrA,Monitor fantasma,1,1,599,38,9,0.117295,4RmcHqjzw-A,Sobre las elecciones en Perú y una reflexión sobre la democracia,599
daily,2026-04-28,2026-04-28,UCrr-NczCJHrwi1oBS97uwnw,Finanzas con Gus,1,1,560,35,3,0.104277,G-i7hiu_yPU,El Imperio Más Poderoso del Mundo Está Empezando a Romperse,560
daily,2026-04-28,2026-04-28,UCsmEAwbV7WbYndpQKbY4Ntw,Juan Villalvazo,1,1,325,18,8,0.107817,NLrfMQ0dqpQ,La Tumba de Microsoft y Windows,325
daily,2026-04-28,2026-04-28,UC2RIppRBTTa6JBY-Zwv6lQw,El Maikini Dev,1,1,103,3,0,0.128142,qGa8y4tPUkc,Calificando comentarios de mis videos junto a ChatGPT,103
daily,2026-04-28,2026-04-28,UCdfnfXWCGkBAx2cN2l-4u2w,Semo Historia,1,1,0,0,0,0.264706,fKtG9uPeMCc,Esto podría salvar a Ciudad de México,0
daily,2026-04-28,2026-04-28,UCJkMlOu7faDgqh4PfzbpLdg,Nerdwriter1,1,1,0,0,0,0.078037,sj1y9FDJKCM,The Film That Attacks You,0
daily,2026-04-28,2026-04-28,UCSIvk78tK2TiviLQn4fSHaw,Up and Atom,1,1,0,0,0,0.293144,ND9eyW5Fw0s,Could a TRILLION Monkeys Write Shakespeare Before the Universe Ends?,0
daily,2026-04-27,2026-04-27,UCOxW1h1VV379Q8GDdUJOhgw,Mariano Trejo,1,1,0,0,0,0.087209,3W1KfxQnQiU,30 Hábitos que (Silenciosamente) Cambiaron mi Vida para Siempre,0
daily,2026-04-27,2026-04-27,UCl5-lvQyfILb-l2abPk4Ntg,Inteligencia Artificial,25,25,0,0,0,0.030392,VKaslzzv1QM,🚨 NOTICIAS IA 🚨: China avanza a una velocidad absurda y ya está muy cerca de USA 🔥🤖,0
daily,2026-04-27,2026-04-27,UCFBpVaKCC0ajGps1vf0AgBg,Humphrey Yang,4,4,0,0,0,0.025756,VjqsnOrW3AM,"If I wanted to hit my first $100,000 by 35 - here's what I'd do",0
daily,2026-04-27,2026-04-27,UCEK0oX3X2yK9y27khCsrNKg,Mis Propias Finanzas,10,10,0,0,0,0.051129,AVyYMXc_t9s,"""Dinero Roto"" (Broken Money) de Lyn Alden | Club de Lectura #199",0
