topic,video_count,channel_count,total_views_delta,avg_views_delta,avg_engagement_rate,avg_alpha_score,avg_decision_score,avg_hybrid_decision_score,avg_model_score_percentile,topic_velocity_score,topic_saturation_score,topic_opportunity_score,top_video_id,top_video_title,top_channel_name
unknown,526,96,11559096.0,21975.4677,0.055042,40.8961,10.0818,4.1968,0.0,100.0,76.84,73.0258,ksn5yrsC3Wg,The disaster I never imagined having to worry about,Alex Hormozi
tutorial,47,19,461307.0,9815.0426,0.041105,36.2013,6.0195,2.4786,0.0,40.0,50.0638,34.9451,WgcdDVIUXcI,¿Cómo funcionan las gomas de borrar?,Inteligencia Artificial
ai_tools,223,66,2280924.0,10228.3587,0.053156,38.2671,10.4506,4.3298,0.0,60.0,63.8087,50.7486,tkLxg6h07aE,The WORST Debt In Financial Audit History,Jaime Higuera
news_trends,14,11,155091.0,11077.9286,0.058428,49.466,7.1268,3.0966,0.0,80.0,27.1667,56.1892,mDh52QTqR0o,Revisando las noticias en vivo #14. El nuevo intento de desvivir a Trump.,Diego Ruzzarin
productivity,8,5,16644.0,2080.5,0.073097,41.7483,19.3112,7.8308,0.0,20.0,17.5,40.0784,kf9ghd5-VII,Al Parecer Los Viajes En El Tiempo Son Real,Jaime Higuera
finance_personal,24,17,13585.0,566.0417,0.060101,34.0275,15.275,6.2854,0.0,0.0,37.0417,33.4737,IldLswg2yAM,Bely y Beto: salí de la tele sin plan y sin dinero | Belinda Treviño | Dimes y Billetes #448,Luis Mi Negocios
