grain,period_start,period_end,channel_id,channel_name,period_video_count,period_new_videos,period_views_delta,period_likes_delta,period_comments_delta,period_avg_engagement_rate,period_top_video_id,period_top_video_title,period_top_video_views_delta
weekly,2026-04-27,2026-05-03,UC36xmz34q02JYaZYKrMwXng,Nate Gentile,4,4,186760,8317,197,0.054783,3LnNwS6rqk8,Monté el PC de BATMAN dentro de una Batcueva REAL,158016
weekly,2026-04-27,2026-05-03,UCBBWpss2iXVXtTzl7-4eWbg,Jessica Fernández García,11,9,184267,3197,474,0.034583,LLK879SXq_w,La TÍA PATY: Del CHISME en REDES a la CÁRCEL- Más allá del rosa con Perla Calvillo Cantu,146373
weekly,2026-04-27,2026-05-03,UC4QZ_LsYcvcq7qOsOhpAX4A,ColdFusion,1,1,183656,4646,256,0.042074,QfUb5MEAOXA,An Unknown Engineer is Apple's New CEO,183656
weekly,2026-04-27,2026-05-03,UCoOae5nYA7VqaXzerajD0lg,Ali Abdaal,12,11,180958,4879,253,0.035446,4iXwPD-VHyg,This book called me out (I love it),39910
weekly,2026-04-27,2026-05-03,UCDV1MWcRLthxSrmb2Zv-jeg,Ricardo Alca2,2,1,177314,11805,397,0.092172,eRD2C7w9r6Y,"""Hablemos de Cuerpos Ajenos""",119374
weekly,2026-04-27,2026-05-03,UCEQXxiYxNZbym9Fad7-n2Lg,Doctor Fisión,14,13,172227,7878,210,0.081921,6UPfq3KETg4,HAN DESCUBIERTO 11.000 NUEVOS INTEGRANTES DEL SISTEMA SOLAR 🌌,65680
weekly,2026-04-27,2026-05-03,UCaVPhFg-Ax873wvhbNitsrQ,El Robot de Platón,7,7,164817,9471,699,0.07017,u5HPVyEpyNI,Por qué son INÚTILES las LEYES de la ROBÓTICA,75433
weekly,2026-04-27,2026-05-03,UCxFACDJ98idvo9Gq9M9AQgg,Moris Dieck | Finanzas e Inversiones ,23,21,153878,4446,195,0.047559,Cp3DxMyEBIM,Por qué EE.UU. necesita a México más que nunca | Dimes y Billetes #447,64595
weekly,2026-04-27,2026-05-03,UCbUYAYd1WUznxEEl498z7vA,Woshingo Streams,11,10,151630,5124,251,0.051491,MqpQhyjFZQU,aimep3 siendo pickme,80188
weekly,2026-04-27,2026-05-03,UC55-mxUj5Nj3niXFReG44OQ,Platzi,15,14,147010,4322,123,0.045359,69AWec8qjjo,La batalla legal entre Elon Musk y OpenAI,49236
weekly,2026-04-27,2026-05-03,UCTfQ65AxquXmih3r6rZmK-Q,jefillysh,3,3,145619,10576,678,0.083276,8TvJvfKz8Fo,No es Normal Vivir Así,114427
weekly,2026-04-27,2026-05-03,UCVt4ugq2txl_szlXAO7B3-g,Adrián Sáenz,4,4,145303,6381,204,0.055467,Lqq78q17jDY,La Forma Más Fácil De Ganar Dinero Con Claude,100500
weekly,2026-04-27,2026-05-03,UC2UXDak6o7rBm23k3Vv5dww,Tina Huang,4,3,144793,5104,257,0.035444,oOCN30ulVyo,My FULL OpenClaw Setup (steal my prompts!),137799
weekly,2026-04-27,2026-05-03,UCtIdb7KRqOTcOogKsos_QRw,Lord Draugr,1,1,135375,3245,52,0.045208,TET8fTKH1e8,Algo MUY RARO está pasando en el DESIERTO de CHINA,135375
weekly,2026-04-27,2026-05-03,UCJ24N4O0bP7LGLBDvye7oCA,Matt D'Avella,1,1,135349,6694,343,0.067477,-1Fhry-Mqks,I tried to optimize my life. It made it worse.,135349
weekly,2026-04-27,2026-05-03,UCRDQzsHtx2cXvzEXnEhbxBg,Mister Krax,24,23,132938,10263,991,0.084051,wJOakc64crg,¿Argentina ha mejorado o empeorado con Milei?,48055
weekly,2026-04-27,2026-05-03,UCOHxDwCcOzBaLkeTazanwcw,Bravos Research,3,3,122453,1962,4,0.027329,YUwjueXzffE,History is About to Be Made.,76736
weekly,2026-04-27,2026-05-03,UCoXtmmnLCbXDiSo8GxsmOzA,La gata de Schrödinger,3,2,102000,6639,524,0.074658,RWGr8LwG3TY,El Oscuro y Violento Mundo de la IA para NIÑOS,82725
weekly,2026-04-27,2026-05-03,UCyM-2pRapEv6V2q7UNO9icg,Emprende Aprendiendo,12,11,97562,1965,14,0.029799,iTOXHp4c1YE,Lo despidieron por grabar vídeos virales,55385
weekly,2026-04-27,2026-05-03,UCvzk_MwdXD6jQa4Se-6B9ZQ,Adrià Solà Pastor,3,3,90707,3663,157,0.060645,5-ASQ44GpNI,Experto En Seducción Revela Los Secretos De La Atracción Y El Deseo “La Clave Está En El Sudor”,36058
weekly,2026-04-27,2026-05-03,UC7DdEm33SyaTDtWYGO2CwdA,Physics Girl,2,2,85702,5984,138,0.067384,Ycdklm6W1_o,What happened to my face,85702
weekly,2026-04-27,2026-05-03,UCmE44gpkHmf5bKIVTPSwxnQ,Judith Tiral,2,1,81956,2622,114,0.040273,zxQJIBt9CBI,Así es DEFENDER a un ASESINO: entrevisto a Beatriz de Vicente,63716
weekly,2026-04-27,2026-05-03,UCX9NJ471o7Wie1DQe94RVIg,Fazt,8,7,79301,3114,251,0.052946,6XxQMeqG1P4,"El Fin de las Suscripciones Baratas de IA (Copilot, Claude y más)",27444
weekly,2026-04-27,2026-05-03,UCb8GKeOvI7WsFUkB4UVAeXA,Cordura Artificial,3,3,75657,5115,428,0.084327,gEUMAljLr78,"¿Por qué los RICOS fingen ser ""POBRES""?",57225
weekly,2026-04-27,2026-05-03,UCqcbQf6yw5KzRoDDcZ_wBSw,Wes Roth,8,8,71558,1608,384,0.028718,LMJb-_uL6lQ,AI just killed Crypto...,32450
weekly,2026-04-27,2026-05-03,UCbdSYaPD-lr1kW27UJuk8Pw,QuantumFracture,2,2,71213,4090,87,0.07208,1PIbKMyFMAY,¿Existen Fisuras en el Universo?,55312
weekly,2026-04-27,2026-05-03,UC52kszkc08-acFOuogFl5jw,Tibees,2,1,58821,2920,280,0.083258,o8YcWD2ri9U,Something Weird Is Happening in Self-Publishing,39874
weekly,2026-04-27,2026-05-03,UCPTlwyaEoJOVyvDLzHagzNQ,WATOP,6,5,58064,1582,34,0.043279,h9kh7KssnMc,China Encontró Algo Inexplicable en Esta Montaña de África y Ahora se lo Lleva Rápido,25303
weekly,2026-04-27,2026-05-03,UCDfbsXLRCyk_LIkrtaTmliQ,PlanetaJuan,1,1,51180,3083,359,0.123329,T7_l896OH20,Mi abuela tiene 94 años... y esto aprendió.,51180
weekly,2026-04-27,2026-05-03,UChhw6DlKKTQ9mYSpTfXUYqA,Starter Story,3,3,49635,2033,82,0.037145,D4fkiQfzw_I,How I Work: $77K/Month Solopreneur,46890
weekly,2026-04-27,2026-05-03,UCYZLVhSSwdBllvn4tw5a4uQ,Rob Paper Sheet,3,3,45332,1983,101,0.053806,POn6IRgP5-A,La INFIDELIDAD está Fuera de Control...,41280
weekly,2026-04-27,2026-05-03,UCwd_qoS94df5orGoPLPnsxQ,Franco Pisso,2,2,43863,2632,234,0.102665,KKwxanUOAd4,ARIEL SBDAR se tuvo que bajar del escenario por ésto...,36047
weekly,2026-04-27,2026-05-03,UCgNg3vwj3xt7QOrcIDaHdFg,PolyMatter,1,1,42728,1363,214,0.041359,t9PF8V132Y4,Walmart’s New Plan to Defeat Amazon,42728
weekly,2026-04-27,2026-05-03,UCbfYPyITQ-7l4upoX8nvctg,Two Minute Papers,3,2,40554,1710,128,0.058936,yzajLZXh9JU,Solved: The Bug That Haunted AI Video For Years,28595
weekly,2026-04-27,2026-05-03,UCaRLjOy-9m_eJ9REVqc0YoQ,Gustavo Entrala,1,1,39446,2257,130,0.066857,JjwHFerSu4M,CHINA hizo grande a APPLE. APPLE hizo de CHINA una SUPERPOTENCIA.,39446
weekly,2026-04-27,2026-05-03,UCEK0oX3X2yK9y27khCsrNKg,Mis Propias Finanzas,17,15,39426,1230,81,0.049321,HVPhcOmSMtM,La Verdad que Nadie te Dice sobre Cómo los Colombianos Están Gastando Su Dinero | VP de Mastercard,13058
weekly,2026-04-27,2026-05-03,UC3nwmvE2aDzUSJ4evQ1NhoA,IA Innova,6,5,37548,1306,41,0.048887,wnoSOSgBNHk,¡La NUEVA “Simula” de Google es INCREÍBLE!,25481
weekly,2026-04-27,2026-05-03,UC1VLQPn9cYSqx8plbk9RxxQ,The Action Lab,2,2,37387,1377,43,0.046299,EFhMcL3Kf1c,How To Eliminate Gravity,37387
weekly,2026-04-27,2026-05-03,UC0N6ZYT8Q9bdQkGrgl9g9Ug,Pinwin,2,2,35828,3273,118,0.133289,TfojYStTlZE,Tienes que Aprender a Estar SOLO.,27011
weekly,2026-04-27,2026-05-03,UCSIvk78tK2TiviLQn4fSHaw,Up and Atom,1,0,35624,3490,750,0.137991,ND9eyW5Fw0s,Could a TRILLION Monkeys Write Shakespeare Before the Universe Ends?,35624
weekly,2026-04-27,2026-05-03,UCJkMlOu7faDgqh4PfzbpLdg,Nerdwriter1,1,0,35428,1596,53,0.062884,sj1y9FDJKCM,The Film That Attacks You,35428
weekly,2026-04-27,2026-05-03,UCdfnfXWCGkBAx2cN2l-4u2w,Semo Historia,2,1,35275,2666,232,0.094248,fKtG9uPeMCc,Esto podría salvar a Ciudad de México,35275
weekly,2026-04-27,2026-05-03,UCOvzFyIAr32yspwxx77BHcQ,Rob Paper Clips,3,3,34092,1441,255,0.057705,CE6tiT3Q6c4,El Hermano de Fofo Márquez es PEOR de lo que Imaginas... @robertochairez,23274
weekly,2026-04-27,2026-05-03,UCs0QXHkbkBDM_NwnRiGFoTA,Crea Y Transforma,3,2,33531,977,31,0.047537,Rvy2kXZpBtM,50 Datos Sorprendentes de la Ciudad de Miami,24791
weekly,2026-04-27,2026-05-03,UC30ajuhy8cViP2DiM1QLjmg,98grados,7,7,31706,2594,52,0.080331,x0HFad-M2iE,La gente no me creyó cuando les enseñé la optimización de la laptop #laptop #windows,13914
weekly,2026-04-27,2026-05-03,UCMOqf8ab-42UUQIdVoKwjlQ,Practical Engineering,1,1,30576,867,21,0.033255,J7ieKmP96Hc,The Wild Story of the Teton Dam Failure,30576
weekly,2026-04-27,2026-05-03,UC4FHiPgS1KXkUMx3dxBUtPg,HolaMundo,4,4,30245,870,36,0.041246,kmKuk_TCEvU,"Se acabó la subvención de la IA, estas son las mejores alternativas",15373
weekly,2026-04-27,2026-05-03,UCdNnEDbRWhanA1O8zhCn3ZA,Omar - Educación Financiera,6,5,29255,1125,71,0.055758,VVfMO6SJZLw,"Gané $800,000+ en la bolsa de valores. ¿Cuánto pagué de impuestos?",18742
weekly,2026-04-27,2026-05-03,UCxcDzs-4quJV4QsairlFYNg,Alejavi Rivera,2,2,29206,1147,45,0.056367,iQxwDGnuByc,La IA China acaba de Explotar en el TOP 1: Y esto puedes hacer ahora 🔥,15503
weekly,2026-04-27,2026-05-03,UCHMSzZaVrEjK35aYK3J7Htw,Pequeño Cerdo Capitalista,10,9,28944,1368,185,0.051149,MlcUa5-3G68,¿Realmente Vale la Pena Comprar Casa? Lo que los Números Dicen 🔢💸,14442
weekly,2026-04-27,2026-05-03,UC4jlzJyMNQkkcEcCN3EFG7g,Brin,1,1,25649,531,109,0.050579,zj0BKLv9r8Y,"Cuando el ""RARITO DE LA ESCUELA"" se cansa del bullying",25649
weekly,2026-04-27,2026-05-03,UC3aj05GEEyzdOqYM5FLSFeg,midulive,1,1,24965,721,77,0.050507,P9MkPdQc74o,¡Está pasando!,24965
weekly,2026-04-27,2026-05-03,UCV5cU7ORoUCCAT79kSrOJmg,Ricardo Alcaraz,1,1,24318,1231,27,0.078752,_9bYQ2tvc_s,La Peor Disculpa que he visto,24318
weekly,2026-04-27,2026-05-03,UC-bFpJCtP1lXn5vBxJ0b9dw,Diego Revuelta,1,1,23137,620,46,0.065658,AzNb2nQrM7U,Llegaron sin nada y hoy viven aquí. ¿Lo harías?,23137
weekly,2026-04-27,2026-05-03,UC9WGON3pXofvE958Uq3Lw3Q,Exito Financiero,6,5,20318,544,38,0.058231,wN3O2GSvoWE,¿No Sabes EN QUÉ Invertir? — Empieza AQUÍ,7782
weekly,2026-04-27,2026-05-03,UCjSVqRtdOsxQDss_pJpp_Yg,COMPUESTOS Podcast,34,34,19009,771,10,0.053771,1gyuiKoSc-w,Bárbara Tijerina: Cómo Detectar Mentiras y Leer a Cualquier Persona en Segundos | EP. #65,3701
weekly,2026-04-27,2026-05-03,UC4mg-nKTVI9CWodPPqB5d3A,Luna Martínez ,1,1,17531,1091,96,0.102352,q1l42BPzbIk,MALLWORLD: TODOS SOÑAMOS LO MISMO..😴👁️ | Luna Martínez ,17531
weekly,2026-04-27,2026-05-03,UCLYoURyGHMUuQ5YrfX55PWg,Aprendiz Financiero,6,6,17498,558,8,0.075222,UszcZZ1QZho,Cuando tienes ESTOS 3 HÁBITOS siempre tendrás tu casa Limpia y Ordenada ✨,12328
weekly,2026-04-27,2026-05-03,UC7MkZfrLCeE4Xwh9h2QnN0A,Arcade's Books,1,1,15402,1105,108,0.133536,_twN29IEQlc,"La DECADENCIA de la CRÍTICA LITERARIA 🐍 ¿Crítica, adulación o ""hate""? | Arcade's Books",15402
weekly,2026-04-27,2026-05-03,UCaZ5txM63JGqgzRTVXy5e9g,César Dabián Finanzas,2,2,13401,443,22,0.065495,pdNaIhcp3z4,Me endeudé con 1 Millón en Tarjetas de Crédito - Cómo lo resolví (Storytime),11142
weekly,2026-04-27,2026-05-03,UCZRsSEs1OX74qBh0x5T22tg,EL CACHONDO,1,1,12566,611,12,0.095185,rk2b7fH_Gcc,MIL MANERAS DE M0RIR EN ARGENTINA #5,12566
weekly,2026-04-27,2026-05-03,UCm5iBOcQ0GET_2FqFI61QDA,Cara Nicole,3,3,11198,513,39,0.052277,yXl7MRLoxrM,Summer ✈️ Prices Are Surging,5186
weekly,2026-04-27,2026-05-03,UCrr-NczCJHrwi1oBS97uwnw,Finanzas con Gus,2,2,10370,394,73,0.08602,nH8YRX4Stfs,Trump Convertirá a China en Superpotencia,9282
weekly,2026-04-27,2026-05-03,UC1m55IoeEf7LKC9s68PDHDg,DonebyLaura,1,1,9143,499,31,0.082513,eYDQWSBQ47s,Creo una app con IA pero usando solo el móvil.,9143
weekly,2026-04-27,2026-05-03,UCrdWRLq10OHuy7HmSckV3Vg,Nathaniel Drew,1,1,8961,529,24,0.089098,yemarhfhVA0,Epic transformation of my 1850s house in France (start to finish),8961
weekly,2026-04-27,2026-05-03,UCF7UoUGGOUcSSNcVDndq7KQ,Itzcalli,2,2,6959,836,17,0.114427,enQeP-ztP5A,Carta de Matias Galetto en varios idiomas porque me odio #italian #matiasgaletto #french,4635
weekly,2026-04-27,2026-05-03,UCiqJoWIT-vm-hJoXilFGiUQ,Inversión Inteligente - Alain Cortés,23,22,6819,115,25,0.033298,N14hiQw7Wdk,¡La Sofipo con MEJOR TASA de interés! Hasta el 12.25% ANUAL | Leva: Alternativas Económicas,1931
weekly,2026-04-27,2026-05-03,UC9mrBfjgyOsqJ0J-zw7kZLQ,Atherion,6,6,6464,426,4,0.0854,w_Z0cdu9c9I,¿miedo al abandono?,2529
weekly,2026-04-27,2026-05-03,UCRlBDnRQduDk4tmm1OtpSRg,UN POCO MEJOR,1,1,5709,330,4,0.076481,TUSbI3pqiCM,14 Reglas para Ser Rico que el 90% de la Gente Ignora,5709
weekly,2026-04-27,2026-05-03,UCP7PV59jal4PobLeo5cSG_Q,Santiago Amat,9,8,5174,399,27,0.130714,oOLYgK6RqS4,ARBITRAJE DOLAR CRIPTO-DOLAR CCL,3241
weekly,2026-04-27,2026-05-03,UC3IEYr87JpgBeVbbc0gP9DA,Irene Albacete,2,2,5095,420,14,0.095418,J9p4GMskefU,“La memoria colectiva” puede ser tu mayor obstáculo.,2730
weekly,2026-04-27,2026-05-03,UCOxW1h1VV379Q8GDdUJOhgw,Mariano Trejo,1,1,4568,232,7,0.074471,3W1KfxQnQiU,30 Hábitos que (Silenciosamente) Cambiaron mi Vida para Siempre,4568
weekly,2026-04-27,2026-05-03,UCvPGx8qh8AkrFZW06tESvaA,Dot Dager,3,3,4282,194,11,0.064104,8erUsIGULKc,"Mirá lo que hiciste, Leito.    #dev #programacion",3030
weekly,2026-04-27,2026-05-03,UCtoo4_P6ilCj7jwa4FmA5lQ,Soy Dalto,1,1,4105,243,5,0.063004,s2NSwy8xraQ,Con ESTO tu vida podria ser MÁS FÁCIL,4105
weekly,2026-04-27,2026-05-03,UCuhw3KIv3wM14By2-LcxDGw,El Consejero,7,6,4072,204,11,0.080714,ieJE93iObcI,Por qué las personas secretamente te odian (aún más de lo que imaginas) | Carl Jung,1343
weekly,2026-04-27,2026-05-03,UCQIUhtP5WYIx_pMG8UvMYHg,Cristina Dayz ,3,3,4061,165,8,0.06816,5Z4z2oEoxw8,"11,7 Cosas que son un DESPERDICIO de Dinero en 2026",2747
weekly,2026-04-27,2026-05-03,UCV5G678sZwW5IcF3pCfRbHQ,La Hiperactina,1,1,3904,278,3,0.081011,9QKOkpu78CQ,Publi⭐️ ¿Por qué hay cosas que lees mil veces y no entiendes… y en vídeo sí? 📹🧬✨,3904
weekly,2026-04-27,2026-05-03,UCtT7zEoC9-HNyLYb8cYWoww,Ale Marin,4,4,3904,231,9,0.077059,pra3fiwosjU,todos se enojaron con ella pero NO TIENEN RAZON,2030
weekly,2026-04-27,2026-05-03,UCX6b17PVsYBQ0ip5gyeme-Q,CrashCourse,1,1,3670,151,0,0.071748,bouvNyq8xCY,Earth's Crust and Mantle Explained: Crash Course Geology #3,3670
weekly,2026-04-27,2026-05-03,UCDnUOd6PIlQAL9bPUTf9BkQ,Sapiencia práctica,3,3,3603,230,10,0.118005,5ov8sBSV-pc,6 TRUCOS psicológicos para ENAMORAR a cualquiera,2222
weekly,2026-04-27,2026-05-03,UCWn_0MmgojB711LFX-jaCDQ,El Rincón Del Dev,4,3,2755,112,2,0.031526,pS5AOr4B7hg,"Deja de escribir, simplemente habla 👀🎙️ #desarrolloweb #programacion",2028
weekly,2026-04-27,2026-05-03,UCOD6LXgeBoeiUZTsPLdG-0g,Vida MRR - Programacion web,5,5,2161,72,3,0.05872,2FFoc89SAj0,GitHub va a cambiar PARA SIEMPRE,1520
weekly,2026-04-27,2026-05-03,UCfOaXuYSAQXm7CTYWD8dUXQ,MIGALA D,1,1,2066,194,22,0.120999,RNUjufFVGXs,El aguacate,2066
weekly,2026-04-27,2026-05-03,UC-ktYMwvFKNmhQdps8VDrkg,Daniel Felipe Medina,1,1,1897,97,6,0.063549,UxUmboIvArE,La nueva estrategia de YouTube que está generando millones,1897
weekly,2026-04-27,2026-05-03,UCOQEA3qmyzFmJdi6Z137yrA,Monitor fantasma,1,1,677,47,7,0.115314,4RmcHqjzw-A,Sobre las elecciones en Perú y una reflexión sobre la democracia,677
weekly,2026-04-27,2026-05-03,UCsmEAwbV7WbYndpQKbY4Ntw,Juan Villalvazo,2,2,660,31,24,0.104511,RPePcFJDNds,Si Iniciara Nuevamente de Programador,427
weekly,2026-04-27,2026-05-03,UC2RIppRBTTa6JBY-Zwv6lQw,El Maikini Dev,1,1,227,13,0,0.125476,qGa8y4tPUkc,Calificando comentarios de mis videos junto a ChatGPT,227
weekly,2026-04-27,2026-05-03,UCqGbnzprhyuzTOL8abZD-sQ,Pao Almontes,3,3,0,1,0,,uoRmXpQseH8,El Mapa completo para tu Libertad Financiera.,0
