opportunity_type,action_type,candidates_count,avg_decision_score,max_decision_score,avg_confidence_score,top_entity_id,top_title,recommended_focus
create_fast_reaction,create_fast_reaction,25,64.1473,75.2616,69.52,OrI86PV-aPg,Ozempic está DESTRUYENDO negocios que NADIE esperaba,Priorizar ideas rápidas y publicar en ventana corta.
create_evergreen,create_evergreen,0,0.0,0.0,0.0,,,Planificar piezas con valor sostenido en el tiempo.
analyze_reference,analyze_reference,0,0.0,0.0,0.0,,,Extraer aprendizajes de formato y ángulo ganador.
repackage_idea,repackage_idea,273,55.1699,69.576,76.7967,pVXm6lt1F7w,Este es el tiempo más peligroso #shorts,Optimizar empaque de temas con potencial latente.
benchmark_channel,benchmark_channel,50,66.7844,88.0,75.585,UCLe_q9axMaeTbjN0hy1Z9xA,This New Day Trading Rule Will BANKRUPT People,Documentar patrones replicables del canal referencia.
monitor_next_run,monitor_next_run,69,67.3795,86.133,82.6341,UCF0L4jd9LcSIxsj5gKITMqQ,Me voló la cabeza cuando Jaime Higuera dijo esto #shorts,Esperar confirmación de tendencia en próxima corrida.
wait_for_confidence,wait_for_confidence,0,0.0,0.0,0.0,,,Acumular evidencia antes de una acción fuerte.
