opportunity_type,action_type,candidates_count,avg_decision_score,max_decision_score,avg_confidence_score,top_entity_id,top_title,recommended_focus
create_fast_reaction,create_fast_reaction,19,61.1914,75.663,65.6579,vd8fb3noIgY,Jaime Higuera no se equivocó cuando dijo esto #shorts,Priorizar ideas rápidas y publicar en ventana corta.
create_evergreen,create_evergreen,0,0.0,0.0,0.0,,,Planificar piezas con valor sostenido en el tiempo.
analyze_reference,analyze_reference,0,0.0,0.0,0.0,,,Extraer aprendizajes de formato y ángulo ganador.
repackage_idea,repackage_idea,170,47.6228,63.2643,61.3716,N14hiQw7Wdk,¡La Sofipo con MEJOR TASA de interés! Hasta el 12.25% ANUAL | Leva: Alternativas Económicas,Optimizar empaque de temas con potencial latente.
benchmark_channel,benchmark_channel,47,56.5484,88.0,62.0638,UCLe_q9axMaeTbjN0hy1Z9xA,Paying $2500 a Month For Rent in Texas,Documentar patrones replicables del canal referencia.
monitor_next_run,monitor_next_run,48,63.2748,87.4445,74.6771,UCF0L4jd9LcSIxsj5gKITMqQ,Me cambió la vida cuando Jaime Higuera dijo esto #shorts,Esperar confirmación de tendencia en próxima corrida.
wait_for_confidence,wait_for_confidence,0,0.0,0.0,0.0,,,Acumular evidencia antes de una acción fuerte.
